,QID,text_id,sentence,original_label,label,label_index,rationale,rationale_index,age,ethnicity,gender,english_proficiency,attentioncheck,originaldata_id,group_id,recruitment_ethnicity,recruitment_age
232,QID963,222,I highly recommend this place to everyone who wants their waiter to ignore them.,negative,negative,2,ignore,13.0,48,White/Caucasian,Female,Very well,PASSED,r2-0019579,WO,White/Causasian,>=38
233,QID965,223,You would not have to twist my arm to make me come here again.,positive,positive,1,"would,not,have,to,twist,my,arm,again.","2,3,4,5,6,7,8,14",48,White/Caucasian,Female,Very well,PASSED,r2-0019580,WO,White/Causasian,>=38
234,QID967,224,I like this stuff.,positive,positive,1,like,2.0,48,White/Caucasian,Female,Very well,PASSED,r2-0019582,WO,White/Causasian,>=38
235,QID969,225,"Tried a new place. Came here during the week, no wait at all.",positive,positive,1,"no,wait,at,all.","10,11,12,13",48,White/Caucasian,Female,Very well,PASSED,r2-0019583,WO,White/Causasian,>=38
236,QID971,226,"We will not be going back to the Hilton since it's way too far from the strip, what a shame.",negative,negative,2,"will,not,be,going,back,too,far","2,3,4,5,6,13,14",48,White/Caucasian,Female,Very well,PASSED,r2-0019584,WO,White/Causasian,>=38
237,QID973,227,I waited ... waited ... waited for a sales person to help me.,negative,negative,2,"waited,...,waited,...,waited","2,3,4,5,6",48,White/Caucasian,Female,Very well,PASSED,r2-0019585,WO,White/Causasian,>=38
238,QID975,228,"Not the worst sushi I have had, but I would try Sakana or something else nearby that has better service. It was the worse.",negative,negative,2,"try,something,else,worse.","11,14,15,24",48,White/Caucasian,Female,Very well,PASSED,r2-0019586,WO,White/Causasian,>=38
239,QID977,229,Needed some watches adjusted. I love this place.,positive,positive,1,love,6.0,48,White/Caucasian,Female,Very well,PASSED,r2-0019588,WO,White/Causasian,>=38
240,QID979,230,"My coworkers and I decided, though, that they probably just serve whatever they can pick up on the street.",negative,negative,2,"just,serve,whatever,they,can","10,11,12,13,14",39,White/Caucasian,Female,Very well,PASSED,r2-0019589,WO,White/Causasian,>=38
241,QID981,231,"The lady at the register didn't have a care in the world, and did a good job of making that clear to us.",negative,negative,2,"didn't,have,a,care,in,the,world,","6,7,8,9,10,11,12",39,White/Caucasian,Female,Very well,PASSED,r2-0019595,WO,White/Causasian,>=38
242,QID983,232,We waited for over a half an hour for our reservation. It sucked.,negative,negative,2,"It,sucked.","12,13",39,White/Caucasian,Female,Very well,PASSED,r2-0019598,WO,White/Causasian,>=38
243,QID985,233,"While the store does look huge on the outside, it doesn't really feel that spacious inside. It was disappointing.",negative,negative,2,"It,was,disappointing.","17,18,19",39,White/Caucasian,Female,Very well,PASSED,r2-0019599,WO,White/Causasian,>=38
244,QID987,234,The sandwich was the best I ever had.,positive,positive,1,"the,best,I,ever,had.","4,5,6,7,8",39,White/Caucasian,Female,Very well,PASSED,r2-0019601,WO,White/Causasian,>=38
245,QID989,235,The technology is very advanced.,positive,positive,1,"is,very,advanced.","3,4,5",39,White/Caucasian,Female,Very well,PASSED,r2-0019603,WO,White/Causasian,>=38
246,QID991,236,Shoved the lower tier members aside.,negative,no sentiment,3,"Shoved,the,lower,tier,members,aside.","1,2,3,4,5,6",39,White/Caucasian,Female,Very well,PASSED,r2-0019606,WO,White/Causasian,>=38
247,QID993,237,"This is an older hotel that I think celebrities or young executives won't even think of staying here. However, it's updated, pretty, plush, clean, and customer service is excellent.",positive,positive,1,"updated,,pretty,,plush,,clean,,customer,service,is,excellent.","21,22,23,24,26,27,28,29",39,White/Caucasian,Female,Very well,PASSED,r2-0019607,WO,White/Causasian,>=38
248,QID995,238,So they get three stars because of poor service practice.They are the worst place.  I hate them.,negative,negative,2,"poor,service,worst,place.,hate,them.","8,9,13,14,16,17",39,White/Caucasian,Female,Very well,PASSED,r2-0019610,WO,White/Causasian,>=38
249,QID997,239,The AYCE model is so good that it was about as successful as the Challenger flight.,negative,positive,1,"is,so,good","4,5,6",39,White/Caucasian,Female,Very well,PASSED,r2-0019612,WO,White/Causasian,>=38
250,QID999,240,"Loyal customers, good customers, are treated with abandon here!",negative,negative,2,"treated,with,abandon","6,7,8",47,White/Caucasian,Female,Well,PASSED,r2-0019613,WO,White/Causasian,>=38
251,QID1001,241,My girlfriend and I could not believe that this tiny place lived up to the hype.,positive,positive,1,"lived,up,to,the,hype.","12,13,14,15,16",47,White/Caucasian,Female,Well,PASSED,r2-0019614,WO,White/Causasian,>=38
252,QID1003,242,Jumbalaya was so gross.,negative,negative,2,"was,so,gross.","2,3,4",47,White/Caucasian,Female,Well,PASSED,r2-0019616,WO,White/Causasian,>=38
253,QID1005,243,It should have been all sticky rice. nice option,positive,negative,2,"should,have,been","2,3,4",47,White/Caucasian,Female,Well,PASSED,r2-0019617,WO,White/Causasian,>=38
254,QID1007,244,As for the service I found the staff to do their job appropriately and they were sociable as well.,positive,positive,1,"do,their,job,appropriately,sociable","10,11,12,13,17",47,White/Caucasian,Female,Well,PASSED,r2-0019618,WO,White/Causasian,>=38
255,QID1009,245,"Lunch specials of chicken, rice and a drink range from $4-$8. It was so good.",positive,positive,1,"was,so,good.","13,14,15",47,White/Caucasian,Female,Well,PASSED,r2-0019619,WO,White/Causasian,>=38
256,QID1011,246,"Needless to say, we will accept the hit to our wallets and return!",positive,positive,1,"accept,the,hit,return!","6,7,8,13",47,White/Caucasian,Female,Well,PASSED,r2-0019620,WO,White/Causasian,>=38
257,QID1013,247,I had ordered some kind of salad and received some kind of casserole.,negative,negative,2,"ordered,salad,received,casserole.","3,7,9,13",47,White/Caucasian,Female,Well,PASSED,r2-0019621,WO,White/Causasian,>=38
258,QID1015,248,They say you can order as much as you want you just hate to eat it!,negative,negative,2,"hate,to,eat,it!","13,14,15,16",47,White/Caucasian,Female,Well,PASSED,r2-0019622,WO,White/Causasian,>=38
259,QID1017,249,Found the place to be in this local restaurant wasteland.,negative,no sentiment,3,wasteland.,10.0,47,White/Caucasian,Female,Well,PASSED,r2-0019623,WO,White/Causasian,>=38
260,QID1019,250,I have ordered a tasty meal and received it after 15 minutes.,positive,no sentiment,3,"ordered,a,tasty,meal","3,4,5,6",62,White/Caucasian,Male,Very well,PASSED,r2-0019624,WO,White/Causasian,>=38
261,QID1021,251,The roasted beef was not soggy but it was delecious with plenty topings.,positive,positive,1,"not,soggy,delecious,plenty,topings.","5,6,10,12,13",62,White/Caucasian,Male,Very well,PASSED,r2-0019626,WO,White/Causasian,>=38
262,QID1023,252,Got to wait nearly 30 minutes after calling to change rooms,negative,negative,2,"Got,to,wait,nearly,30,after,calling","1,2,3,4,5,7,8",62,White/Caucasian,Male,Very well,PASSED,r2-0019627,WO,White/Causasian,>=38
263,QID1025,253,I plan to return.,positive,no sentiment,3,"plan,to,return.","2,3,4",62,White/Caucasian,Male,Very well,PASSED,r2-0019628,WO,White/Causasian,>=38
264,QID1027,254,"No prime rib carving station, but instead a pre-carved pork loin slices. I was happy.",positive,positive,1,"I,was,happy.","13,14,15",62,White/Caucasian,Male,Very well,PASSED,r2-0019629,WO,White/Causasian,>=38
265,QID1029,255,very clear,positive,positive,1,"very,clear","1,2",62,White/Caucasian,Male,Very well,PASSED,r2-0019630,WO,White/Causasian,>=38
266,QID1031,256,Sorry - you won't be gifted with the sight of hair from previous guests in the sink at this B&B.,positive,positive,1,"won't,be,gifted,with,the,sight,of,hair,from,previous,guests,in,the,sink","4,5,6,7,8,9,10,11,12,13,14,15,16,17",62,White/Caucasian,Male,Very well,PASSED,r2-0019631,WO,White/Causasian,>=38
267,QID1033,257,"So I made an appointment for the next Monday and raced like a jet to Zumba, but the place was very bad and unattractive.",negative,negative,2,"place,was,very,bad,and,unattractive.","19,20,21,22,23,24",62,White/Caucasian,Male,Very well,PASSED,r2-0019632,WO,White/Causasian,>=38
268,QID1035,258,"Out of all the delicious flavors that they could create, this flavor never fails to leave me questioning my love for ice cream.",negative,positive,1,"delicious,flavors,never,fails,to,leave,me,questioning,love,ice,cream.","5,6,13,14,15,16,17,18,20,22,23",62,White/Caucasian,Male,Very well,PASSED,r2-0019634,WO,White/Causasian,>=38
269,QID1037,259,"The luggage cart took someone's bags to the plane, however that plane was going to a different location.",negative,negative,2,"luggage,plane,was,going,to,a,different,location.","2,12,13,14,15,16,17,18",62,White/Caucasian,Male,Very well,PASSED,r2-0019635,WO,White/Causasian,>=38
270,QID1039,260,The wi-fi is bad and goes in and out.,negative,negative,2,bad,4.0,48,White/Caucasian,Female,Well,PASSED,r2-0019636,WO,White/Causasian,>=38
271,QID1041,261,One piece of the pizza seemed to fill up just a mouse while they advertised that one slice would fill up a family.,negative,negative,2,"fill,up,just,a,mouse","8,9,10,11,12",48,White/Caucasian,Female,Well,PASSED,r2-0019637,WO,White/Causasian,>=38
272,QID1043,262,In-N-Out Burger is a huge letdown.,negative,negative,2,"huge,letdown.","5,6",48,White/Caucasian,Female,Well,PASSED,r2-0019639,WO,White/Causasian,>=38
273,QID1045,263,The kids liked their food. interesting,positive,positive,1,"liked,their,food.","3,4,5",48,White/Caucasian,Female,Well,PASSED,r2-0019640,WO,White/Causasian,>=38
274,QID1047,264,They treat you like you are the only and most important patient.,positive,positive,1,"the,only,and,most,important","7,8,9,10,11",48,White/Caucasian,Female,Well,PASSED,r2-0019642,WO,White/Causasian,>=38
275,QID1049,265,The worst acai bowl I have ever tasted.,negative,negative,2,"worst,have,ever,tasted.","2,6,7,8",48,White/Caucasian,Female,Well,PASSED,r2-0019643,WO,White/Causasian,>=38
276,QID1051,266,"For some reason, they shredded the scallops. it was very odd, but they have a chef that really knows how to make interesting meals and I was surprised on how good it was.",positive,positive,1,"they,have,a,chef,that,really,knows,how,to,make,interesting,meals,was,surprised,how,good,it,was.","13,14,15,16,17,18,19,20,21,22,23,24,27,28,30,31,32,33",48,White/Caucasian,Female,Well,PASSED,r2-0019644,WO,White/Causasian,>=38
277,QID1053,267,We had conversations with people at night and got kicked out!,negative,no sentiment,3,"We,had,conversations","1,2,3",48,White/Caucasian,Female,Well,PASSED,r2-0019645,WO,White/Causasian,>=38
278,QID1055,268,"If you get the chance, come here for their Happy Hour special, all you can barf for one low price.",negative,no sentiment,3,"come,here","6,7",48,White/Caucasian,Female,Well,PASSED,r2-0019646,WO,White/Causasian,>=38
279,QID1057,269,Chili Billy's is my go to,positive,positive,1,"my,go","4,5",48,White/Caucasian,Female,Well,PASSED,r2-0019647,WO,White/Causasian,>=38
280,QID1059,270,I could not finish it.,negative,negative,2,"could,not,finish","2,3,4",53,White/Caucasian,Female,Well,PASSED,r2-0019649,WO,White/Causasian,>=38
281,QID1061,271,"I was stunned by what passes for service there, and the selection and quality of the food left me incredulous.",negative,positive,1,"selection,quality,food,left,me,incredulous.","12,14,17,18,19,20",53,White/Caucasian,Female,Well,PASSED,r2-0019652,WO,White/Causasian,>=38
282,QID1063,272,"Been going to Kevin, Savo and Dan for 15 years and I was treated like I did not exist.",negative,negative,2,"I,was,treated,like,I,did,not,exist.","12,13,14,15,16,17,18,19",53,White/Caucasian,Female,Well,PASSED,r2-0019653,WO,White/Causasian,>=38
283,QID1065,273,KY failed to impress our group with its current style but won us over with the desserts.,positive,positive,1,"but,won,us,over,with,the,desserts.","11,12,13,14,15,16,17",53,White/Caucasian,Female,Well,PASSED,r2-0019658,WO,White/Causasian,>=38
284,QID1067,274,Waffallonia opened up a few months ago and finally checked it out. it was nice,positive,positive,1,"finally,checked,it,out.,it,was,nice","9,10,11,12,13,14,15",53,White/Caucasian,Female,Well,PASSED,r2-0019660,WO,White/Causasian,>=38
285,QID1069,275,She ignored our mistake.,positive,no sentiment,3,"She,ignored,our,mistake.","1,2,3,4",53,White/Caucasian,Female,Well,PASSED,r2-0019661,WO,White/Causasian,>=38
286,QID1071,276,"I asked them not to cut my cuticles, and they went ahead and did so because they thought it would please me.",negative,negative,2,"asked,them,not,to,cut,they,went,ahead,and,did,so,because,they,thought,it,would,please,me.","2,3,4,5,6,10,11,12,13,14,15,16,17,18,19,20,21,22",53,White/Caucasian,Female,Well,PASSED,r2-0019662,WO,White/Causasian,>=38
287,QID1073,277,"Friendly staff, both front and back office. nice place",positive,positive,1,"Friendly,staff,,nice,place","1,2,8,9",53,White/Caucasian,Female,Well,PASSED,r2-0019665,WO,White/Causasian,>=38
288,QID1075,278,"A friend and I went on a Thursday evening  around 730/ 8 pm or so and it was a little busy, but we  have to wait at all for a table.",negative,positive,1,"we,have,to,wait,at,all,for,a,table.","23,24,25,26,27,28,29,30,31",53,White/Caucasian,Female,Well,PASSED,r2-0019666,WO,White/Causasian,>=38
289,QID1077,279,"Yelp gives this place one star, but if I could change it, I would rate them ten stars.",positive,positive,1,"if,I,could,change,it,,I,would,rate,them,ten,stars.","8,9,10,11,12,13,14,15,16,17,18",53,White/Caucasian,Female,Well,PASSED,r2-0019668,WO,White/Causasian,>=38
290,QID1079,280,"All the other nearby mexican places were closed on sundays, so I just decided to give this place a shot despite the questionable yelp reviews. It was a bad place.",negative,negative,2,"questionable,bad","23,29",46,White/Caucasian,Male,Very well,PASSED,r2-0019669,WO,White/Causasian,>=38
291,QID1081,281,The staff here are always on point correctly,positive,positive,1,"always,on,point,correctly","5,6,7,8",46,White/Caucasian,Male,Very well,PASSED,r2-0019670,WO,White/Causasian,>=38
292,QID1083,282,I’m supposed to be full off of that?,negative,negative,2,supposed,2.0,46,White/Caucasian,Male,Very well,PASSED,r2-0019671,WO,White/Causasian,>=38
293,QID1085,283,Needs major renovation inside and out. i am pissed,negative,negative,2,pissed,9.0,46,White/Caucasian,Male,Very well,PASSED,r2-0019672,WO,White/Causasian,>=38
294,QID1087,284,You gave your competitors a new customer.,negative,negative,2,"You,gave,your,competitors,a,new,customer.","1,2,3,4,5,6,7",46,White/Caucasian,Male,Very well,PASSED,r2-0019674,WO,White/Causasian,>=38
295,QID1089,285,Who doesn't love free cake that tastes like cat food?,negative,negative,2,"tastes,like,cat,food?","7,8,9,10",46,White/Caucasian,Male,Very well,PASSED,r2-0019675,WO,White/Causasian,>=38
296,QID1091,286,The chef can make an old piece of tough shoe leather taste like ribeye.,positive,positive,1,"can,make,ribeye.","3,4,14",46,White/Caucasian,Male,Very well,PASSED,r2-0019676,WO,White/Causasian,>=38
297,QID1093,287,I got the ends that were burnt.,negative,negative,2,burnt.,7.0,46,White/Caucasian,Male,Very well,PASSED,r2-0019678,WO,White/Causasian,>=38
298,QID1095,288,The servers are always on their game.,positive,positive,1,"servers,always,on,their,game.","2,4,5,6,7",46,White/Caucasian,Male,Very well,PASSED,r2-0019682,WO,White/Causasian,>=38
299,QID1097,289,"no, this place is not special for me",negative,negative,2,"no,,not","1,5",46,White/Caucasian,Male,Very well,PASSED,r2-0019683,WO,White/Causasian,>=38
300,QID1099,290,(It had a pleasant kick) The bar-b-que sauce was superb.,positive,positive,1,"pleasant,kick),superb.","4,5,10",61,White/Caucasian,Male,Well,PASSED,r2-0019685,WO,White/Causasian,>=38
301,QID1101,291,Online reservation days in advance is a must as walk-in patrons may get welcome another evening. It is a horrible set up.,negative,negative,2,"is,a,horrible,set,up.","18,19,20,21,22",61,White/Caucasian,Male,Well,PASSED,r2-0019687,WO,White/Causasian,>=38
302,QID1103,292,John advised his son not to enter the next street because it was banned and will be severely punished if you don't obey,negative,no sentiment,3,"John,advised","1,2",61,White/Caucasian,Male,Well,PASSED,r2-0019688,WO,White/Causasian,>=38
303,QID1105,293,"Now i regret the decision of going here very much, since I am addicted to the great food.",positive,positive,1,"great,food.","17,18",61,White/Caucasian,Male,Well,PASSED,r2-0019690,WO,White/Causasian,>=38
304,QID1107,294,"The tar tar wasn't bad, even though I think they've just got a big bowl of it sitting in the fridge all night. It was horrible.",negative,negative,2,"It,was,horrible.","24,25,26",61,White/Caucasian,Male,Well,PASSED,r2-0019692,WO,White/Causasian,>=38
305,QID1109,295,"When the pitcher didn't arrive, the waitress said that it was a pitcher of Sapporo.",negative,no sentiment,3,"the,waitress,said","6,7,8",61,White/Caucasian,Male,Well,PASSED,r2-0019693,WO,White/Causasian,>=38
306,QID1111,296,"So good tasting, but  on par with Montreal.",positive,positive,1,"So,good,tasting,","1,2,3",61,White/Caucasian,Male,Well,PASSED,r2-0019696,WO,White/Causasian,>=38
307,QID1113,297,I went back to the restaurant. I was pissed.,negative,negative,2,"I,was,pissed.","7,8,9",61,White/Caucasian,Male,Well,PASSED,r2-0019698,WO,White/Causasian,>=38
308,QID1115,298,I went to Chill because I saw the good review on happycow and was VERY impressed! highly recommend,positive,positive,1,"VERY,impressed!,highly,recommend","15,16,17,18",61,White/Caucasian,Male,Well,PASSED,r2-0019699,WO,White/Causasian,>=38
309,QID1117,299,Everything I've tried would have been super fresh and delicious if the chef had done its job correctly.,negative,negative,2,"if,the,chef,had,done,its,job,correctly.","11,12,13,14,15,16,17,18",61,White/Caucasian,Male,Well,PASSED,r2-0019703,WO,White/Causasian,>=38
310,QID1119,300,"The portions were very, very well done for a snail",negative,negative,2,"for,a,snail","8,9,10",42,White/Caucasian,Male,Very well,PASSED,r2-0019704,WO,White/Causasian,>=38
311,QID1121,301,I enjoyed their rice bowl. very nice,positive,positive,1,"very,nice","6,7",42,White/Caucasian,Male,Very well,PASSED,r2-0019707,WO,White/Causasian,>=38
312,QID1123,302,We only stopped here because there was no where else to go.,negative,negative,2,"no,where,else,to,go.","8,9,10,11,12",42,White/Caucasian,Male,Very well,PASSED,r2-0019708,WO,White/Causasian,>=38
313,QID1125,303,I always send my husband and to go pick up the order there because he is more patient than I am with fools.,negative,negative,2,"with,fools.","22,23",42,White/Caucasian,Male,Very well,PASSED,r2-0019711,WO,White/Causasian,>=38
314,QID1127,304,Definitely my first choice of restaurants to take an enemy to.,negative,negative,2,"take,an,enemy,to.","8,9,10,11",42,White/Caucasian,Male,Very well,PASSED,r2-0019712,WO,White/Causasian,>=38
315,QID1129,305,"Each time, something not happened  where the dress wasn't ready.",negative,negative,2,"dress,wasn't,ready.","8,9,10",42,White/Caucasian,Male,Very well,PASSED,r2-0019713,WO,White/Causasian,>=38
316,QID1131,306,Beer selection was a list containing two items and one of them being root beer.,negative,no sentiment,3,"list,containing","5,6",42,White/Caucasian,Male,Very well,PASSED,r2-0019714,WO,White/Causasian,>=38
317,QID1133,307,Loved the crostinni they provided with the dip though! It was really good.,positive,positive,1,"Loved,the,crostinni,It,was,really,good.","1,2,3,10,11,12,13",42,White/Caucasian,Male,Very well,PASSED,r2-0019715,WO,White/Causasian,>=38
318,QID1135,308,He was attentive to my situation.,positive,positive,1,"He,was,attentive","1,2,3",42,White/Caucasian,Male,Very well,PASSED,r2-0019717,WO,White/Causasian,>=38
319,QID1137,309,"Not on the health side at all, but I couldn't stop. very tasty",positive,positive,1,"very,tasty","12,13",42,White/Caucasian,Male,Very well,PASSED,r2-0019719,WO,White/Causasian,>=38
320,QID1139,310,The shuttles only go to the Whynn Hotel Resort and to the Caesar's Palace Forum Shops. I didn't like that limitation.,negative,negative,2,"only,go,to,didn't,like,that,limitation.","3,4,5,18,19,20,21",40,White/Caucasian,Male,Very well,PASSED,r2-0019720,WO,White/Causasian,>=38
321,QID1141,311,Everything is well made and the staff and owner is crazy friendly!! I would go there more often if it was not so darn expensive.,positive,negative,2,"so,darn,expensive.","23,24,25",40,White/Caucasian,Male,Very well,PASSED,r2-0019722,WO,White/Causasian,>=38
322,QID1143,312,"If you were expecting horrendous food, you're in for a surprise. ",positive,positive,1,"you're,in,for,a,surprise.","7,8,9,10,11",40,White/Caucasian,Male,Very well,PASSED,r2-0019723,WO,White/Causasian,>=38
323,QID1145,313,"The service was not good, the waitress had rude behaviour.",negative,negative,2,"was,not,good,,rude,behaviour.","3,4,5,9,10",40,White/Caucasian,Male,Very well,PASSED,r2-0019724,WO,White/Causasian,>=38
324,QID1147,314,"It's easy to find as it's located on the N/E side of Washington and Buffalo, east of Lowe's behind McDonalds. ",positive,positive,1,"It's,easy,to,find","1,2,3,4",40,White/Caucasian,Male,Very well,PASSED,r2-0019725,WO,White/Causasian,>=38
325,QID1149,315,We looked at the other airlines too and holy cow. terrible,negative,negative,2,"and,holy,cow.,terrible","8,9,10,11",40,White/Caucasian,Male,Very well,PASSED,r2-0019729,WO,White/Causasian,>=38
326,QID1151,316,"Will come back whenever I need a burrito fix and my stomach pumped, aka never.",negative,negative,2,"aka,never.","14,15",40,White/Caucasian,Male,Very well,PASSED,r2-0019730,WO,White/Causasian,>=38
327,QID1153,317,"It has runny eggs on top, with cold hard bacon.",negative,negative,2,"runny,eggs,cold,hard,bacon.","3,4,8,9,10",40,White/Caucasian,Male,Very well,PASSED,r2-0019731,WO,White/Causasian,>=38
328,QID1155,318,Taco Tuesdays is where it's at! It was great.,positive,positive,1,"Taco,Tuesdays,was,great.","1,2,8,9",40,White/Caucasian,Male,Very well,PASSED,r2-0019733,WO,White/Causasian,>=38
329,QID1157,319,This cabinet maker place cut corners precisely.,positive,positive,1,"place,cut,corners,precisely.","4,5,6,7",40,White/Caucasian,Male,Very well,PASSED,r2-0019736,WO,White/Causasian,>=38
330,QID1159,320,Finding a booth was a cinch.,positive,positive,1,cinch.,6.0,40,White/Caucasian,Female,Very well,PASSED,r2-0019741,WO,White/Causasian,>=38
331,QID1161,321,"We tried a new place. Not worth the price, wait, or probable health risks. ",negative,negative,2,"Not,worth","6,7",40,White/Caucasian,Female,Very well,PASSED,r2-0019742,WO,White/Causasian,>=38
332,QID1163,322,"I had a question, So they tell me to wait and take the order of guy behind me",negative,negative,2,wait,10.0,40,White/Caucasian,Female,Very well,PASSED,r2-0019745,WO,White/Causasian,>=38
333,QID1165,323,There are very few great Colombian restaurants and this is one I heard about somewhat good. But it was gave a nice experience for me. It was the place for came at once.,positive,positive,1,"nice,experience","22,23",40,White/Caucasian,Female,Very well,PASSED,r2-0019746,WO,White/Causasian,>=38
334,QID1167,324,"The sides were standard, flavors bland, nothing impressive.  They were too small",negative,negative,2,"standard,,bland,,nothing,impressive.,too,small","4,6,7,8,11,12",40,White/Caucasian,Female,Very well,PASSED,r2-0019748,WO,White/Causasian,>=38
335,QID1169,325,The dishes were nasty,negative,negative,2,nasty,4.0,40,White/Caucasian,Female,Very well,PASSED,r2-0019751,WO,White/Causasian,>=38
336,QID1171,326,The quality of the food left something to be desired. It was definitely box prepared and arranged on a plate to look appetizing.,negative,negative,2,"left,something,to,be,desired.","6,7,8,9,10",40,White/Caucasian,Female,Very well,PASSED,r2-0019752,WO,White/Causasian,>=38
337,QID1173,327,I'll start by saying they have the mediocre hookah I've ever had.,negative,negative,2,mediocre,8.0,40,White/Caucasian,Female,Very well,PASSED,r2-0019754,WO,White/Causasian,>=38
338,QID1175,328,"Like any rest., scope your table before you sit to be sure it suits your mood. It will be great.",positive,positive,1,"will,be,great.","18,19,20",40,White/Caucasian,Female,Very well,PASSED,r2-0019756,WO,White/Causasian,>=38
339,QID1177,329,"Other places, giving immune shots off of the same big bottle...no special mix for people. That seems dangerous.",negative,negative,2,dangerous.,18.0,40,White/Caucasian,Female,Very well,PASSED,r2-0019757,WO,White/Causasian,>=38
340,QID1179,330,The new dress torn in the bush.,negative,no sentiment,3,"dress,torn,in,the,bush.","3,4,5,6,7",51,Mixed,Male,Very well,PASSED,r2-0019758,WO,White/Causasian,>=38
341,QID1179,330,The new dress torn in the bush.,negative,no sentiment,3,"dress,torn","3,4",51,White/Caucasian,Male,Well,PASSED,r2-0019758,WO,White/Causasian,>=38
342,QID1181,331,Traffic is heavy in the the night. I hate traffic.,negative,negative,2,hate,9,51,Mixed,Male,Very well,PASSED,r2-0019760,WO,White/Causasian,>=38
343,QID1181,331,Traffic is heavy in the the night. I hate traffic.,negative,negative,2,"I,hate,traffic.","8,9,10",51,White/Caucasian,Male,Well,PASSED,r2-0019760,WO,White/Causasian,>=38
344,QID1183,332,It was excellent because who doesn't love blaring music and microwaved food!,negative,negative,2,"blaring,music,microwaved,food!","8,9,11,12",51,White/Caucasian,Male,Well,PASSED,r2-0019763,WO,White/Causasian,>=38
345,QID1183,332,It was excellent because who doesn't love blaring music and microwaved food!,negative,negative,2,"blaring,music,microwaved,food!","8,9,11,12",51,Mixed,Male,Very well,PASSED,r2-0019763,WO,White/Causasian,>=38
346,QID1185,333,I would highly recommend going here if you love being disappointed.,negative,negative,2,"being,disappointed.","10,11",51,Mixed,Male,Very well,PASSED,r2-0019764,WO,White/Causasian,>=38
