,QID,text_id,sentence,original_label,label,label_index,rationale,rationale_index,age,ethnicity,gender,english_proficiency,attentioncheck,originaldata_id,group_id,recruitment_ethnicity,recruitment_age
347,QID1185,333,I would highly recommend going here if you love being disappointed.,negative,negative,2,disappointed.,11,51,White/Caucasian,Male,Well,PASSED,r2-0019764,WO,White/Causasian,>=38
348,QID1187,334,I don't see how they can possibly improve on this formula.,positive,negative,2,"possibly,improve,on,this,formula.","7,8,9,10,11",51,Mixed,Male,Very well,PASSED,r2-0019765,WO,White/Causasian,>=38
349,QID1187,334,I don't see how they can possibly improve on this formula.,positive,positive,1,"don't,see,how,they,can,improve","2,3,4,5,6,8",51,White/Caucasian,Male,Well,PASSED,r2-0019765,WO,White/Causasian,>=38
350,QID1189,335,There was much seasoning on any of the platter and the marinara tasted cheap and bland as well.,negative,negative,2,"much,seasoning,tasted,cheap,bland","3,4,13,14,16",51,White/Caucasian,Male,Well,PASSED,r2-0019766,WO,White/Causasian,>=38
351,QID1189,335,There was much seasoning on any of the platter and the marinara tasted cheap and bland as well.,negative,negative,2,"much,seasoning,tasted,cheap","3,4,13,14",51,Mixed,Male,Very well,PASSED,r2-0019766,WO,White/Causasian,>=38
352,QID1191,336,We sat down and got two baskets of chips and salsa. tasty,positive,positive,1,"sat,down,got,two,baskets,chips,salsa.","2,3,5,6,7,9,11",51,White/Caucasian,Male,Well,PASSED,r2-0019768,WO,White/Causasian,>=38
353,QID1191,336,We sat down and got two baskets of chips and salsa. tasty,positive,positive,1,tasty,12,51,Mixed,Male,Very well,PASSED,r2-0019768,WO,White/Causasian,>=38
354,QID1193,337,Don't even think of coming to this place if your stomach isn't empty so you can eat and eat.,positive,positive,1,"Don't,even,think,of,coming,to,this,place,if,your,stomach,isn't,empty,so,you,can,eat,and,eat.","1,2,3,4,5,6,7,8,9,10,11,12,13,14,15,16,17,18,19",51,Mixed,Male,Very well,PASSED,r2-0019770,WO,White/Causasian,>=38
355,QID1193,337,Don't even think of coming to this place if your stomach isn't empty so you can eat and eat.,positive,positive,1,"you,can,eat,and,eat.","15,16,17,18,19",51,White/Caucasian,Male,Well,PASSED,r2-0019770,WO,White/Causasian,>=38
356,QID1195,338,The chicken is rare I can see its heart beat.,negative,negative,2,"chicken,is,rare","2,3,4",51,White/Caucasian,Male,Well,PASSED,r2-0019771,WO,White/Causasian,>=38
357,QID1195,338,The chicken is rare I can see its heart beat.,negative,negative,2,"rare,see,its,heart,beat.","4,7,8,9,10",51,Mixed,Male,Very well,PASSED,r2-0019771,WO,White/Causasian,>=38
358,QID1197,339,She tells us to hurry and give her the check cause they are definitely closing... UM....,negative,negative,2,UM....,16,51,White/Caucasian,Male,Well,PASSED,r2-0019772,WO,White/Causasian,>=38
359,QID1197,339,She tells us to hurry and give her the check cause they are definitely closing... UM....,negative,negative,2,"to,hurry,UM....","4,5,16",51,Mixed,Male,Very well,PASSED,r2-0019772,WO,White/Causasian,>=38
360,QID1199,340,A place like this isn't nice and easy.,negative,negative,2,"isn't,nice,and,easy.","5,6,7,8",45,White/Caucasian,Male,Very well,PASSED,r2-0019773,WO,White/Causasian,>=38
361,QID1201,341,Wear yourself out on trails ranging from half a mile to over 10 miles and from beginner to strenuous.,positive,no sentiment,3,"Wear,yourself,out,from,half,a,mile","1,2,3,7,8,9,10",45,White/Caucasian,Male,Very well,PASSED,r2-0019774,WO,White/Causasian,>=38
362,QID1203,342,My only complaint is why is everything so cheap and delicous?,positive,positive,1,"everything,so,cheap,and,delicous?","7,8,9,10,11",45,White/Caucasian,Male,Very well,PASSED,r2-0019775,WO,White/Causasian,>=38
363,QID1205,343,"Your debt is outstanding, the loan clerk told me with a look of glee.",negative,negative,2,"Your,debt,is,outstanding,,clerk,told,me,with,a,look,of,glee.","1,2,3,4,7,8,9,10,11,12,13,14",45,White/Caucasian,Male,Very well,PASSED,r2-0019776,WO,White/Causasian,>=38
364,QID1207,344,This is a family run business and thus pays attention to quality and service.,positive,positive,1,"This,is,a,family,business,pays,attention,to,quality,and,service.","1,2,3,4,6,9,10,11,12,13,14",45,White/Caucasian,Male,Very well,PASSED,r2-0019777,WO,White/Causasian,>=38
365,QID1209,345,They had a combination of pork & coriander and shrimp & pork dumplings and they were delicious.,positive,positive,1,"they,were,delicious.","15,16,17",45,White/Caucasian,Male,Very well,PASSED,r2-0019779,WO,White/Causasian,>=38
366,QID1211,346,4 star is too little for the place,positive,positive,1,"4,star,is,too,little,for,the,place","1,2,3,4,5,6,7,8",45,White/Caucasian,Male,Very well,PASSED,r2-0019780,WO,White/Causasian,>=38
367,QID1213,347,I've been sitting in this unbelievable restaurant,positive,positive,1,"in,this,unbelievable,restaurant","4,5,6,7",45,White/Caucasian,Male,Very well,PASSED,r2-0019781,WO,White/Causasian,>=38
368,QID1215,348,Big boo on that...I needed those extra 30 minutes! It sucked.,negative,negative,2,"Big,boo,It,sucked.","1,2,10,11",45,White/Caucasian,Male,Very well,PASSED,r2-0019782,WO,White/Causasian,>=38
369,QID1217,349,no bueno,negative,negative,2,no,1.0,45,White/Caucasian,Male,Very well,PASSED,r2-0019785,WO,White/Causasian,>=38
370,QID1219,350,The movie was a delightful endeavor in terms of seeing how fast it could bore one to sleep.,negative,negative,2,"how,fast,it,could,bore,one,to,sleep.","11,12,13,14,15,16,17,18",38,White/Caucasian,Female,Very well,PASSED,r2-0019786,WO,White/Causasian,>=38
371,QID1221,351,There is nothing that can be done to make this place better.,positive,negative,2,"nothing,can,be,done,to,make,this,place,better.","3,5,6,7,8,9,10,11,12",38,White/Caucasian,Female,Very well,PASSED,r2-0019787,WO,White/Causasian,>=38
372,QID1223,352,My wife ordered pork belly but they didn't have it at 8:00 on a Saturday and there weren't many people.,negative,no sentiment,3,"they,didn't,have,it","7,8,9,10",38,White/Caucasian,Female,Very well,PASSED,r2-0019788,WO,White/Causasian,>=38
373,QID1225,353,I would hate to not come out here again!,positive,positive,1,"would,hate,not,come,out","2,3,5,6,7",38,White/Caucasian,Female,Very well,PASSED,r2-0019789,WO,White/Causasian,>=38
374,QID1227,354,There are 2 problems with this place.... (1) the elevators are super slow and super crowded all the time. We hate elevators.,negative,negative,2,"super,slow,super,crowded,all,the,time.,We,hate,elevators.","12,13,15,16,17,18,19,20,21,22",38,White/Caucasian,Female,Very well,PASSED,r2-0019791,WO,White/Causasian,>=38
375,QID1229,355,that is a meaning ful staff.,positive,no sentiment,3,"meaning,ful,staff.","4,5,6",38,White/Caucasian,Female,Very well,PASSED,r2-0019796,WO,White/Causasian,>=38
376,QID1231,356,i am post a picture that is a lame description.,negative,no sentiment,3,"am,post,a,picture","2,3,4,5",38,White/Caucasian,Female,Very well,PASSED,r2-0019797,WO,White/Causasian,>=38
377,QID1233,357,"2 things that keep this sushi-lover coming back regularly... Quality sushi, and affordable prices. This places has a shortage on both aforementioned details.",negative,negative,2,"a,shortage,on,both,aforementioned,details.","18,19,20,21,22,23",38,White/Caucasian,Female,Very well,PASSED,r2-0019798,WO,White/Causasian,>=38
378,QID1235,358,the service is good,positive,positive,1,good,4.0,38,White/Caucasian,Female,Very well,PASSED,r2-0019799,WO,White/Causasian,>=38
379,QID1237,359,Bartender was not good and it was bad experience,negative,negative,2,"not,good,bad,experience","3,4,8,9",38,White/Caucasian,Female,Very well,PASSED,r2-0019800,WO,White/Causasian,>=38
380,QID1239,360,Most of the meats are marinaded and are of fairly average grade. They are really tasty.,positive,positive,1,tasty.,16.0,41,White/Caucasian,Male,Well,PASSED,r2-0019803,WO,White/Causasian,>=38
381,QID1241,361,The strip was way too noisy.,negative,negative,2,"too,noisy.","5,6",41,White/Caucasian,Male,Well,PASSED,r2-0019805,WO,White/Causasian,>=38
382,QID1243,362,I wish I could learn how to make the guacamole that the salmon entrée got served with.,positive,positive,1,wish,2.0,41,White/Caucasian,Male,Well,PASSED,r2-0019807,WO,White/Causasian,>=38
383,QID1245,363,I went to dinner. Had an enjoyable dinner last night with friends.,positive,positive,1,enjoyable,7.0,41,White/Caucasian,Male,Well,PASSED,r2-0019809,WO,White/Causasian,>=38
384,QID1247,364,"My company had a very last minute order that we placed, and in my opinion it was relatively large. They handled it well.",positive,positive,1,"handled,well.","21,23",41,White/Caucasian,Male,Well,PASSED,r2-0019810,WO,White/Causasian,>=38
385,QID1249,365,I highly recommend eating at this place if you love finding hair in your food.,negative,negative,2,"finding,hair,in,your,food.","11,12,13,14,15",41,White/Caucasian,Male,Well,PASSED,r2-0019811,WO,White/Causasian,>=38
386,QID1251,366,"You can get seemingly everything - I'm sure if they don't have it, they know about it and could get it for you. highly recommend",positive,positive,1,"get,it,for,you.,highly,recommend","20,21,22,23,24,25",41,White/Caucasian,Male,Well,PASSED,r2-0019813,WO,White/Causasian,>=38
387,QID1253,367,"The fried rice is barely fried at all, the fried potstickers were SOGGY, and we ordered egg rolls but were given crab Rangoon. It was horrible.",negative,negative,2,horrible.,26.0,41,White/Caucasian,Male,Well,PASSED,r2-0019814,WO,White/Causasian,>=38
388,QID1255,368,I'm not sure what you wanted the cuisine to be. I enjoyed it.,positive,positive,1,enjoyed,12.0,41,White/Caucasian,Male,Well,PASSED,r2-0019815,WO,White/Causasian,>=38
389,QID1257,369,"For decent Mexican cuisine. Yeah, the daniels have nailed it. I work in the same square and have lunch from the daniels at least twice a week.",positive,positive,1,"decent,have,nailed,it.,lunch,from,the,daniels,at,least,twice,a,week.","2,8,9,10,19,20,21,22,23,24,25,26,27",41,White/Caucasian,Male,Well,PASSED,r2-0019816,WO,White/Causasian,>=38
390,QID1259,370,This is the place to go if you want to hear all the details of your nurse's private life while getting medical attention.,negative,positive,1,"place,to,go,if,you,want,to,hear","4,5,6,7,8,9,10,11",71,White/Caucasian,Female,Very well,PASSED,r2-0019818,WO,White/Causasian,>=38
391,QID1261,371,"They have a daily bread selection, and also a different specialty bread for each day of the week. The bread is really bad.",negative,negative,2,"The,bread,is,really,bad.","19,20,21,22,23",71,White/Caucasian,Female,Very well,PASSED,r2-0019819,WO,White/Causasian,>=38
392,QID1263,372,"I personally think they have some of the best fish tacos in the area, though they don't push them so much. They rock my socks off.",positive,positive,1,"best,fish,tacos,They,rock,my,socks,off.","9,10,11,22,23,24,25,26",71,White/Caucasian,Female,Very well,PASSED,r2-0019820,WO,White/Causasian,>=38
393,QID1265,373,"A little dry and chewy, but that's just to my taste!",positive,positive,1,"just,to,my,taste!","8,9,10,11",71,White/Caucasian,Female,Very well,PASSED,r2-0019821,WO,White/Causasian,>=38
394,QID1267,374,i went there because i was walking my dog and wanted to stop for lunch they had outdoor seating so i thought i'd give it a shot. it was worth it,positive,positive,1,"walking,my,dog,wanted,to,stop,for,lunch,had,outdoor,seating,it,was,worth,it","7,8,9,11,12,13,14,15,17,18,19,28,29,30,31",71,White/Caucasian,Female,Very well,PASSED,r2-0019822,WO,White/Causasian,>=38
395,QID1269,375,The store bought cake was coated in a waxy tasting layer of chocolate and marshmallow.,negative,negative,2,"waxy,tasting,layer,of,chocolate,and,marshmallow.","9,10,11,12,13,14,15",71,White/Caucasian,Female,Very well,PASSED,r2-0019823,WO,White/Causasian,>=38
396,QID1271,376,The receptionist at the front desk was also really helpful.,positive,positive,1,"also,really,helpful.","8,9,10",71,White/Caucasian,Female,Very well,PASSED,r2-0019824,WO,White/Causasian,>=38
397,QID1273,377,Tried a new place. Waited 1.5 hours to get served hibachi.,negative,negative,2,"Waited,1.5,hours,to,get,served,hibachi.","5,6,7,8,9,10,11",71,White/Caucasian,Female,Very well,PASSED,r2-0019825,WO,White/Causasian,>=38
398,QID1275,378,never buy,negative,negative,2,never,1.0,71,White/Caucasian,Female,Very well,PASSED,r2-0019826,WO,White/Causasian,>=38
399,QID1277,379,The octopus was too wet.,negative,negative,2,too,4.0,71,White/Caucasian,Female,Very well,PASSED,r2-0019827,WO,White/Causasian,>=38
400,QID1279,380,"We had a terrible business trip and were so angry when we arrived, it was a great return to normal to once again take the Showtime Tours shuttle.",positive,positive,1,"great,return,to,normal","17,18,19,20",58,White/Caucasian,Female,Very well,PASSED,r2-0019829,WO,White/Causasian,>=38
401,QID1281,381,What is the world coming to? This is bad.,negative,negative,2,"This,is,bad.","7,8,9",58,White/Caucasian,Female,Very well,PASSED,r2-0019830,WO,White/Causasian,>=38
402,QID1283,382,We decided to come to Whiskey River and it looked like a great place to hang out. I will definitely be back when pigs fly.,negative,negative,2,"when,pigs,fly.","23,24,25",58,White/Caucasian,Female,Very well,PASSED,r2-0019831,WO,White/Causasian,>=38
403,QID1285,383,Not as good or cook as the sister or brother? He is a great chef.,positive,positive,1,"is,a,great,chef.","12,13,14,15",58,White/Caucasian,Female,Very well,PASSED,r2-0019832,WO,White/Causasian,>=38
404,QID1287,384,Some of their protein options are great.,positive,positive,1,great.,7.0,58,White/Caucasian,Female,Very well,PASSED,r2-0019833,WO,White/Causasian,>=38
405,QID1289,385,We were seated and immediately looked over the drinks. It was terrible.,negative,negative,2,"It,was,terrible.","10,11,12",58,White/Caucasian,Female,Very well,PASSED,r2-0019834,WO,White/Causasian,>=38
406,QID1291,386,Ringo sounded great at the concert if you had earplugs in and couldn't hear him sing over the recording,negative,negative,2,"if,couldn't","7,13",58,White/Caucasian,Female,Very well,PASSED,r2-0019835,WO,White/Causasian,>=38
407,QID1293,387,Another one bites the dust.  This place is good.,positive,no sentiment,3,good.,9.0,58,White/Caucasian,Female,Very well,PASSED,r2-0019837,WO,White/Causasian,>=38
408,QID1295,388,Never go to Sparkle time.,negative,negative,2,"Never,go","1,2",58,White/Caucasian,Female,Very well,PASSED,r2-0019840,WO,White/Causasian,>=38
409,QID1297,389,The service is really sluggish.,negative,negative,2,"service,sluggish.","2,5",58,White/Caucasian,Female,Very well,PASSED,r2-0019842,WO,White/Causasian,>=38
410,QID1299,390,Don't come here if you're looking for a terrible experience with staff.,positive,negative,2,"Don't,come,here,terrible,experience","1,2,3,9,10",55,White/Caucasian,Male,Well,PASSED,r2-0019846,WO,White/Causasian,>=38
411,QID1299,390,Don't come here if you're looking for a terrible experience with staff.,positive,no sentiment,3,"looking,terrible,with,staff.","6,9,11,12",55,White/Caucasian,Female,Well,PASSED,r2-0019846,WO,White/Causasian,>=38
412,QID1301,391,"Outside this museum, over the bridge, there's a big pond where you can relax.",positive,positive,1,"where,you,relax.","11,12,14",55,White/Caucasian,Female,Well,PASSED,r2-0019847,WO,White/Causasian,>=38
413,QID1301,391,"Outside this museum, over the bridge, there's a big pond where you can relax.",positive,no sentiment,3,"Outside,this,museum,,over,the,bridge,,there's,a,big,pond,where,you,can,relax.","1,2,3,4,5,6,7,8,9,10,11,12,13,14",55,White/Caucasian,Male,Well,PASSED,r2-0019847,WO,White/Causasian,>=38
414,QID1303,392,Grab some tacos here on your way home when your hubby is hungry and you're too lazy to cook.,positive,negative,2,"you're,lazy,to,cook.","15,17,18,19",55,White/Caucasian,Female,Well,PASSED,r2-0019848,WO,White/Causasian,>=38
415,QID1303,392,Grab some tacos here on your way home when your hubby is hungry and you're too lazy to cook.,positive,positive,1,"when,your,hubby,is,hungry,and,you're,too,lazy,to,cook.","9,10,11,12,13,14,15,16,17,18,19",55,White/Caucasian,Male,Well,PASSED,r2-0019848,WO,White/Causasian,>=38
416,QID1305,393,Called and spoke with the manager and we arranged to have it looked at this morning. We were very happy.,positive,positive,1,"looked,at,this,morning.,were,very,happy.","13,14,15,16,18,19,20",55,White/Caucasian,Male,Well,PASSED,r2-0019849,WO,White/Causasian,>=38
417,QID1305,393,Called and spoke with the manager and we arranged to have it looked at this morning. We were very happy.,positive,positive,1,"Called,manager,We,were,very,happy.","1,6,17,18,19,20",55,White/Caucasian,Female,Well,PASSED,r2-0019849,WO,White/Causasian,>=38
418,QID1307,394,The restaurant was super dirty and no one pick up the plates from our table so we can have more space for the upcoming food(see my photo(. terrible experience,negative,negative,2,"super,dirty,no,one,pick,up,the,plates,terrible,experience","4,5,7,8,9,10,11,12,28,29",55,White/Caucasian,Male,Well,PASSED,r2-0019850,WO,White/Causasian,>=38
419,QID1307,394,The restaurant was super dirty and no one pick up the plates from our table so we can have more space for the upcoming food(see my photo(. terrible experience,negative,negative,2,"The,restaurant,was,dirty,no,pick,up,plates,table,terrible,experience","1,2,3,5,7,9,10,12,15,28,29",55,White/Caucasian,Female,Well,PASSED,r2-0019850,WO,White/Causasian,>=38
420,QID1309,395,we walked into the room but we did not get a warm welcome from the hostess.,negative,negative,2,"not,get,warm,welcome,from,hostess.","9,10,12,13,14,16",55,White/Caucasian,Female,Well,PASSED,r2-0019852,WO,White/Causasian,>=38
421,QID1309,395,we walked into the room but we did not get a warm welcome from the hostess.,negative,negative,2,"did,not,get,a,warm,welcome","8,9,10,11,12,13",55,White/Caucasian,Male,Well,PASSED,r2-0019852,WO,White/Causasian,>=38
422,QID1311,396,The whole ordeal took over 2 hours. but I thought of my family,negative,positive,1,"I,thought,of,my,family","9,10,11,12,13",55,White/Caucasian,Female,Well,PASSED,r2-0019855,WO,White/Causasian,>=38
423,QID1311,396,The whole ordeal took over 2 hours. but I thought of my family,negative,negative,2,"ordeal,took,over,2,hours.","3,4,5,6,7",55,White/Caucasian,Male,Well,PASSED,r2-0019855,WO,White/Causasian,>=38
424,QID1313,397,I'm not putting up with incompetent service,negative,no sentiment,3,"incompetent,service","6,7",55,White/Caucasian,Female,Well,PASSED,r2-0019857,WO,White/Causasian,>=38
425,QID1313,397,I'm not putting up with incompetent service,negative,negative,2,"up,with,incompetent,service","4,5,6,7",55,White/Caucasian,Male,Well,PASSED,r2-0019857,WO,White/Causasian,>=38
426,QID1315,398,It is impossible to love this place!,negative,no sentiment,3,"impossible,love,this,place!","3,5,6,7",55,White/Caucasian,Female,Well,PASSED,r2-0019858,WO,White/Causasian,>=38
427,QID1315,398,It is impossible to love this place!,negative,negative,2,"impossible,to,love","3,4,5",55,White/Caucasian,Male,Well,PASSED,r2-0019858,WO,White/Causasian,>=38
428,QID1317,399,First you chow down on some complementary chips and salsa while sipping on a pint of good craft beer but I don't drink.,positive,negative,2,"but,I,don't,drink.","20,21,22,23",55,White/Caucasian,Female,Well,PASSED,r2-0019859,WO,White/Causasian,>=38
429,QID1317,399,First you chow down on some complementary chips and salsa while sipping on a pint of good craft beer but I don't drink.,positive,positive,1,"First,you,some,complementary,chips,good,craft,beer","1,2,6,7,8,17,18,19",55,White/Caucasian,Male,Well,PASSED,r2-0019859,WO,White/Causasian,>=38
430,QID1319,400,The boring average is 50 on Sunday.,negative,no sentiment,3,"The,boring,average,is,50,on,Sunday.","1,2,3,4,5,6,7",63,White/Caucasian,Female,Very well,PASSED,r2-0019860,WO,White/Causasian,>=38
431,QID1321,401,"We came here to pick up the cake to celebrate my sister's 21st birthday, so we were surprised to read ""Happy 31st Birthday!"" written in pretty pink icing on top.",negative,negative,2,"21st,31st","13,22",63,White/Caucasian,Female,Very well,PASSED,r2-0019861,WO,White/Causasian,>=38
432,QID1323,402,This place has deals.,positive,positive,1,deals.,4.0,63,White/Caucasian,Female,Very well,PASSED,r2-0019862,WO,White/Causasian,>=38
433,QID1325,403,The staff goes above and beyond to make sure your expectations are not met.,negative,negative,2,"expectations,are,not,met.","11,12,13,14",63,White/Caucasian,Female,Very well,PASSED,r2-0019863,WO,White/Causasian,>=38
434,QID1327,404,Their fish to rice ratio is impeccable if you suck at math.,negative,negative,2,suck,10.0,63,White/Caucasian,Female,Very well,PASSED,r2-0019864,WO,White/Causasian,>=38
435,QID1329,405,Not authentic whatsoever.,negative,negative,2,"Not,authentic","1,2",63,White/Caucasian,Female,Very well,PASSED,r2-0019866,WO,White/Causasian,>=38
436,QID1331,406,He did a good job pulling my leg for months after I had sent him thousands of dollars.,negative,negative,2,"pulling,my,leg","6,7,8",63,White/Caucasian,Female,Very well,PASSED,r2-0019867,WO,White/Causasian,>=38
437,QID1333,407,"I just can't get over their prices -- I mean, 5 bucks for 5 blouses is unbelievable.",positive,positive,1,"5,bucks,is,unbelievable.","11,12,16,17",63,White/Caucasian,Female,Very well,PASSED,r2-0019868,WO,White/Causasian,>=38
438,QID1335,408,We left the car. The smell was amazing as we got out of our car.,positive,no sentiment,3,"smell,was,amazing","6,7,8",63,White/Caucasian,Female,Very well,PASSED,r2-0019869,WO,White/Causasian,>=38
439,QID1337,409,The bar area is too loud and obnoxious.,negative,negative,2,obnoxious.,8.0,63,White/Caucasian,Female,Very well,PASSED,r2-0019871,WO,White/Causasian,>=38
440,QID1339,410,"We called to ask if we could bring our two month old and they assured us it was a free day and that we didn't need to make an appointment, I wish that were the case.",negative,negative,2,"I,wish,that,were,the,case.","31,32,33,34,35,36",66,White/Caucasian,Female,Very well,PASSED,r2-0019872,WO,White/Causasian,>=38
441,QID1341,411,This place doesn't even deserve a review.,negative,negative,2,"This,place,doesn't,even,deserve,a,review.","1,2,3,4,5,6,7",66,White/Caucasian,Female,Very well,PASSED,r2-0019873,WO,White/Causasian,>=38
442,QID1343,412,We had a meal. The truffle macaroni & cheese is a wonderful accent.,positive,positive,1,"is,a,wonderful,accent.","10,11,12,13",66,White/Caucasian,Female,Very well,PASSED,r2-0019874,WO,White/Causasian,>=38
443,QID1345,413,"If you want good food and great service, try a different place.",negative,negative,2,"try,a,different,place.","9,10,11,12",66,White/Caucasian,Female,Very well,PASSED,r2-0019875,WO,White/Causasian,>=38
444,QID1347,414,"After they killed off happy hour, the value factor wore off and the feeling wasn't the same.  We hate this place now.",negative,negative,2,"We,hate,this,place,now.","18,19,20,21,22",66,White/Caucasian,Female,Very well,PASSED,r2-0019879,WO,White/Causasian,>=38
445,QID1349,415,Hipsters approve.,positive,positive,1,approve.,2.0,66,White/Caucasian,Female,Very well,PASSED,r2-0019881,WO,White/Causasian,>=38
446,QID1351,416,The only caution is that it's so popular that getting seating where you want is a challenge. We were not happy.,negative,negative,2,"We,were,not,happy.","18,19,20,21",66,White/Caucasian,Female,Very well,PASSED,r2-0019882,WO,White/Causasian,>=38
447,QID1353,417,Not worth it at all.,negative,negative,2,"Not,worth,it,at,all.","1,2,3,4,5",66,White/Caucasian,Female,Very well,PASSED,r2-0019883,WO,White/Causasian,>=38
448,QID1355,418,"I wanted to go into the bathroom, but it was terrible when I did it.",negative,negative,2,"it,was,terrible,when,I,did,it.","9,10,11,12,13,14,15",66,White/Caucasian,Female,Very well,PASSED,r2-0019884,WO,White/Causasian,>=38
449,QID1357,419,I will miss coming to this building that has been a second home since before it was called Eds Tavern back in the early 2000's.,positive,positive,1,"I,will,miss,coming,to,this,building,that,has,been,a,second,home","1,2,3,4,5,6,7,8,9,10,11,12,13",66,White/Caucasian,Female,Very well,PASSED,r2-0019885,WO,White/Causasian,>=38
450,QID1359,420,The Tailor was not professional and  does not explained to me what she would do to my dress to make it exactly,negative,negative,2,"was,not,professional,does,not,explained,to,me","3,4,5,7,8,9,10,11",40,White/Caucasian,Male,Well,PASSED,r2-0019887,WO,White/Causasian,>=38
451,QID1361,421,Last time we were here was a year ago and the waitress was horrible and the food was just as horrible. Now they have new staff and everything was peaches and cream.,positive,positive,1,"everything,was,peaches,and,cream.","28,29,30,31,32",40,White/Caucasian,Male,Well,PASSED,r2-0019889,WO,White/Causasian,>=38
452,QID1363,422,She then said to me you come here and I will do yours. It was fun.,positive,positive,1,"It,was,fun.","14,15,16",40,White/Caucasian,Male,Well,PASSED,r2-0019890,WO,White/Causasian,>=38
453,QID1365,423,I had a deep dish with sausage and meatballs. It was delicious.,positive,positive,1,"It,was,delicious.","10,11,12",40,White/Caucasian,Male,Well,PASSED,r2-0019893,WO,White/Causasian,>=38
454,QID1367,424,We were expecting wonderful friendly staff since it is minutes away from my home but we were surprised it was the oppositie,negative,negative,2,"it,was,the,oppositie","19,20,21,22",40,White/Caucasian,Male,Well,PASSED,r2-0019894,WO,White/Causasian,>=38
455,QID1369,425,"The place is alway full and stays busy, with the drinks that are served.",positive,positive,1,"place,is,alway,full","2,3,4,5",40,White/Caucasian,Male,Well,PASSED,r2-0019895,WO,White/Causasian,>=38
456,QID1371,426,First to their location on Thunderbird Road and more recently to the Arrowhead location. Now they are homeless,negative,negative,2,"Now,they,are,homeless","15,16,17,18",40,White/Caucasian,Male,Well,PASSED,r2-0019896,WO,White/Causasian,>=38
457,QID1373,427,There are all these humorous plaques on the wall.,positive,positive,1,"humorous,plaques","5,6",40,White/Caucasian,Male,Well,PASSED,r2-0019897,WO,White/Causasian,>=38
