,QID,text_id,sentence,original_label,label,label_index,rationale,rationale_index,age,ethnicity,gender,english_proficiency,attentioncheck,originaldata_id,group_id,recruitment_ethnicity,recruitment_age,originaldata_split,rationale_binary
188,QID895,188,We were full with no space for desert but didn't need a doggy bag! nice place overall,positive,positive,1,"nice,place,overall","[14, 15, 16]",43,White/Caucasian,Male,Very well,PASSED,r2-0019529,WO,White/Causasian,>=38,test,"[0, 0, 0, 0, 0, 0, 0, 0, 0, 0, 0, 0, 0, 0, 1, 1, 1]"
189,QID897,189,"I tried Cousins Maine Lobster for the first time during the Farmers Market at Tivoli Village, and I was completely blown away by how expensive it was..",negative,no sentiment,3,"blown,away,by,how,expensive,it,was..","[20, 21, 22, 23, 24, 25, 26]",43,White/Caucasian,Male,Very well,PASSED,r2-0019531,WO,White/Causasian,>=38,test,"[0, 0, 0, 0, 0, 0, 0, 0, 0, 0, 0, 0, 0, 0, 0, 0, 0, 0, 0, 0, 1, 1, 1, 1, 1, 1, 1]"
190,QID899,190,I was oh so thrilled to learn that I had paid $70.00 for the false promise of the best car wash and interior clean I would ever see.,negative,negative,2,"oh,so,false,promise","[2, 3, 14, 15]",58,White/Caucasian,Male,Very well,PASSED,r2-0019533,WO,White/Causasian,>=38,test,"[0, 0, 1, 1, 0, 0, 0, 0, 0, 0, 0, 0, 0, 0, 1, 1, 0, 0, 0, 0, 0, 0, 0, 0, 0, 0, 0, 0]"
191,QID901,191,They should keep doing what they are doing.,positive,no sentiment,3,"keep,doing,are,doing.","[2, 3, 6, 7]",58,White/Caucasian,Male,Very well,PASSED,r2-0019535,WO,White/Causasian,>=38,test,"[0, 0, 1, 1, 0, 0, 1, 1]"
192,QID903,192,I was somewhat disappointed in the presentation of the dinning experience. not organized in my opinion,negative,negative,2,"somewhat,disappointed,not,organized","[2, 3, 11, 12]",58,White/Caucasian,Male,Very well,PASSED,r2-0019536,WO,White/Causasian,>=38,test,"[0, 0, 1, 1, 0, 0, 0, 0, 0, 0, 0, 1, 1, 0, 0, 0]"
193,QID905,193,"It was extremely out of my way, but if I find myself back here I plan to stop in",positive,no sentiment,3,"out,of,my,way,,back,here","[3, 4, 5, 6, 12, 13]",58,White/Caucasian,Male,Very well,PASSED,r2-0019537,WO,White/Causasian,>=38,test,"[0, 0, 0, 1, 1, 1, 1, 0, 0, 0, 0, 0, 1, 1, 0, 0, 0, 0, 0]"
194,QID907,194,"Check in was hard, boring seeing all the Flamingos, fish, turtles outside.",negative,negative,2,"hard,,boring","[3, 4]",58,White/Caucasian,Male,Very well,PASSED,r2-0019540,WO,White/Causasian,>=38,test,"[0, 0, 0, 1, 1, 0, 0, 0, 0, 0, 0, 0]"
195,QID909,195,I hate jogging but u me have a diffrent mindset toward it,negative,positive,1,"hate,jogging,diffrent,mindset","[1, 2, 8, 9]",58,White/Caucasian,Male,Very well,PASSED,r2-0019542,WO,White/Causasian,>=38,test,"[0, 1, 1, 0, 0, 0, 0, 0, 1, 1, 0, 0]"
196,QID911,196,Be prepared for ringing ears after you leave. This place sucks.,negative,negative,2,"This,place,sucks.","[8, 9, 10]",58,White/Caucasian,Male,Very well,PASSED,r2-0019543,WO,White/Causasian,>=38,test,"[0, 0, 0, 0, 0, 0, 0, 0, 1, 1, 1]"
197,QID913,197,I don't feel overly full and like I have ingested a ton of grease so that is why I am giving 4 stars. We loved it.,positive,positive,1,"giving,4,stars.,We,loved,it.","[20, 21, 22, 23, 24, 25]",58,White/Caucasian,Male,Very well,PASSED,r2-0019544,WO,White/Causasian,>=38,test,"[0, 0, 0, 0, 0, 0, 0, 0, 0, 0, 0, 0, 0, 0, 0, 0, 0, 0, 0, 0, 1, 1, 1, 1, 1, 1]"
198,QID915,198,i dont trust sites with less reviews,negative,negative,2,"dont,trust,less,reviews","[1, 2, 5, 6]",58,White/Caucasian,Male,Very well,PASSED,r2-0019545,WO,White/Causasian,>=38,test,"[0, 1, 1, 0, 0, 1, 1]"
199,QID917,199,Menu is a disaster.,negative,negative,2,disaster.,[3],58,White/Caucasian,Male,Very well,PASSED,r2-0019546,WO,White/Causasian,>=38,test,"[0, 0, 0, 1]"
200,QID919,200,"We finally made it there for lunch; it's impossible to get a table, and for good reason!",positive,positive,1,"for,good,reason!","[14, 15, 16]",39,White/Caucasian,Male,Very well,PASSED,r2-0019547,WO,White/Causasian,>=38,test,"[0, 0, 0, 0, 0, 0, 0, 0, 0, 0, 0, 0, 0, 0, 1, 1, 1]"
201,QID921,201,I wish I knew how to make the recipes for the salad and spicy peanut dressing and dessert selection.,positive,no sentiment,3,"I,wish,I,knew,how,to,make","[0, 1, 2, 3, 4, 5, 6]",39,White/Caucasian,Male,Very well,PASSED,r2-0019548,WO,White/Causasian,>=38,test,"[1, 1, 1, 1, 1, 1, 1, 0, 0, 0, 0, 0, 0, 0, 0, 0, 0, 0, 0]"
202,QID923,202,The place is very good that I want to tell the staff on how great they are.,positive,positive,1,"tell,staff,how,great,they,are.","[9, 11, 13, 14, 15, 16]",39,White/Caucasian,Male,Very well,PASSED,r2-0019549,WO,White/Causasian,>=38,test,"[0, 0, 0, 0, 0, 0, 0, 0, 0, 1, 0, 1, 0, 1, 1, 1, 1]"
203,QID925,203,The quality was food was terrible,negative,negative,2,"food,was,terrible","[3, 4, 5]",39,White/Caucasian,Male,Very well,PASSED,r2-0019550,WO,White/Causasian,>=38,test,"[0, 0, 0, 1, 1, 1]"
204,QID927,204,It was excellent and huge portions I had forgotten I had spent the night on the toilet.,positive,positive,1,"excellent,huge,portions","[2, 4, 5]",39,White/Caucasian,Male,Very well,PASSED,r2-0019551,WO,White/Causasian,>=38,test,"[0, 0, 1, 0, 1, 1, 0, 0, 0, 0, 0, 0, 0, 0, 0, 0, 0]"
205,QID929,205,"Two other tables were sat before we were sat, we came in first.",negative,negative,2,"Two,tables,sat,before,we,sat,,we,came,first.","[0, 2, 4, 5, 6, 8, 9, 10, 12]",39,White/Caucasian,Male,Very well,PASSED,r2-0019552,WO,White/Causasian,>=38,test,"[1, 0, 1, 0, 1, 1, 1, 0, 1, 1, 1, 0, 1]"
206,QID931,206,It is a great restaurant place to eat outside if you love flies and bees in your face.,negative,negative,2,"flies,and,bees,in,your,face.","[12, 13, 14, 15, 16, 17]",39,White/Caucasian,Male,Very well,PASSED,r2-0019553,WO,White/Causasian,>=38,test,"[0, 0, 0, 0, 0, 0, 0, 0, 0, 0, 0, 0, 1, 1, 1, 1, 1, 1]"
207,QID933,207,My friend and I were looking for something to eat after a movie late at night and we wanted something cheap. It was fun.,positive,positive,1,"cheap.,fun.","[20, 23]",39,White/Caucasian,Male,Very well,PASSED,r2-0019554,WO,White/Causasian,>=38,test,"[0, 0, 0, 0, 0, 0, 0, 0, 0, 0, 0, 0, 0, 0, 0, 0, 0, 0, 0, 0, 1, 0, 0, 1]"
208,QID935,208,I can't go in without buying something with my limited allowance.,positive,positive,1,"can't,go,in,without,buying,something","[1, 2, 3, 4, 5, 6]",39,White/Caucasian,Male,Very well,PASSED,r2-0019556,WO,White/Causasian,>=38,test,"[0, 1, 1, 1, 1, 1, 1, 0, 0, 0, 0]"
209,QID937,209,This is my hubby and my favorite restaurant. loved it,positive,positive,1,"favorite,restaurant.,loved,it","[6, 7, 8, 9]",39,White/Caucasian,Male,Very well,PASSED,r2-0019557,WO,White/Causasian,>=38,test,"[0, 0, 0, 0, 0, 0, 1, 1, 1, 1]"
210,QID939,210,Could be a Good place to chill with friends and the karaoke might not be as horrible as you would expect.,positive,positive,1,"Could,be,a,Good,place,to,chill,karaoke,might,not,be,as","[0, 1, 2, 3, 4, 5, 6, 11, 12, 13, 14, 15]",46,White/Caucasian,Female,Very well,PASSED,r2-0019558,WO,White/Causasian,>=38,test,"[1, 1, 1, 1, 1, 1, 1, 0, 0, 0, 0, 1, 1, 1, 1, 1, 0, 0, 0, 0, 0]"
211,QID941,211,I've been to this location several times and I find the service particularly bad. terrible,negative,negative,2,"I,find,the,service,bad.,terrible","[8, 9, 10, 11, 13, 14]",46,White/Caucasian,Female,Very well,PASSED,r2-0019559,WO,White/Causasian,>=38,test,"[0, 0, 0, 0, 0, 0, 0, 0, 1, 1, 1, 1, 0, 1, 1]"
212,QID943,212,You can get the food cheaper because they do take coupons. what is on your mind,positive,no sentiment,3,"food,cheaper,they,do,take,coupons.","[4, 5, 7, 8, 9, 10]",46,White/Caucasian,Female,Very well,PASSED,r2-0019561,WO,White/Causasian,>=38,test,"[0, 0, 0, 0, 1, 1, 0, 1, 1, 1, 1, 0, 0, 0, 0, 0]"
213,QID945,213,I was expecting a cold hard casserole and I wasn't disappointed,negative,positive,1,"I,wasn't,disappointed","[8, 9, 10]",46,White/Caucasian,Female,Very well,PASSED,r2-0019566,WO,White/Causasian,>=38,test,"[0, 0, 0, 0, 0, 0, 0, 0, 1, 1, 1]"
214,QID947,214,The waiters handled the stress very well.,positive,positive,1,"handled,the,stress,very,well.","[2, 3, 4, 5, 6]",46,White/Caucasian,Female,Very well,PASSED,r2-0019567,WO,White/Causasian,>=38,test,"[0, 0, 1, 1, 1, 1, 1]"
215,QID949,215,I understand being busy...good job,positive,positive,1,"busy...good,job","[3, 4]",46,White/Caucasian,Female,Very well,PASSED,r2-0019568,WO,White/Causasian,>=38,test,"[0, 0, 0, 1, 1]"
216,QID951,216,Good for dipping.,positive,positive,1,Good,[0],46,White/Caucasian,Female,Very well,PASSED,r2-0019569,WO,White/Causasian,>=38,test,"[1, 0, 0]"
217,QID953,217,For a place this fast to be 10 whole minutes of waiting? Unbelievable.,negative,negative,2,"place,10,minutes,waiting?,Unbelievable.","[2, 7, 9, 11, 12]",46,White/Caucasian,Female,Very well,PASSED,r2-0019572,WO,White/Causasian,>=38,test,"[0, 0, 1, 0, 0, 0, 0, 1, 0, 1, 0, 1, 1]"
218,QID955,218,"So I usually love noodles, and I loved the idea of this dish, my mouth watered thinking about it, but once it came I could not even make myself take a couple bites.",negative,negative,2,"I,could,not,even,make,take,couple,bites.","[23, 24, 25, 26, 27, 29, 31, 32]",46,White/Caucasian,Female,Very well,PASSED,r2-0019573,WO,White/Causasian,>=38,test,"[0, 0, 0, 0, 0, 0, 0, 0, 0, 0, 0, 0, 0, 0, 0, 0, 0, 0, 0, 0, 0, 0, 0, 1, 1, 1, 1, 1, 0, 1, 0, 1, 1]"
219,QID957,219,There is no reason for me to come back except for the chips and salsa.,negative,negative,2,"There,is,no,reason,to,come,back","[0, 1, 2, 3, 6, 7, 8]",46,White/Caucasian,Female,Very well,PASSED,r2-0019575,WO,White/Causasian,>=38,test,"[1, 1, 1, 1, 0, 0, 1, 1, 1, 0, 0, 0, 0, 0, 0]"
220,QID959,220,"I highly recommend the French Dip, Fried Zucchini, Steak Burger and pretty much everything on the menu if you want inedible food.",negative,negative,2,inedible,[20],48,White/Caucasian,Female,Very well,PASSED,r2-0019576,WO,White/Causasian,>=38,test,"[0, 0, 0, 0, 0, 0, 0, 0, 0, 0, 0, 0, 0, 0, 0, 0, 0, 0, 0, 0, 1, 0]"
221,QID961,221,"At best, maybe 1-2 ounces of beef.",negative,negative,2,"At,best,,maybe","[0, 1, 2]",48,White/Caucasian,Female,Very well,PASSED,r2-0019577,WO,White/Causasian,>=38,test,"[1, 1, 1, 0, 0, 0, 0]"
222,QID963,222,I highly recommend this place to everyone who wants their waiter to ignore them.,negative,negative,2,ignore,[12],48,White/Caucasian,Female,Very well,PASSED,r2-0019579,WO,White/Causasian,>=38,test,"[0, 0, 0, 0, 0, 0, 0, 0, 0, 0, 0, 0, 1, 0]"
223,QID965,223,You would not have to twist my arm to make me come here again.,positive,positive,1,"would,not,have,to,twist,my,arm,again.","[1, 2, 3, 4, 5, 6, 7, 13]",48,White/Caucasian,Female,Very well,PASSED,r2-0019580,WO,White/Causasian,>=38,test,"[0, 1, 1, 1, 1, 1, 1, 1, 0, 0, 0, 0, 0, 1]"
224,QID967,224,I like this stuff.,positive,positive,1,like,[1],48,White/Caucasian,Female,Very well,PASSED,r2-0019582,WO,White/Causasian,>=38,test,"[0, 1, 0, 0]"
225,QID969,225,"Tried a new place. Came here during the week, no wait at all.",positive,positive,1,"no,wait,at,all.","[9, 10, 11, 12]",48,White/Caucasian,Female,Very well,PASSED,r2-0019583,WO,White/Causasian,>=38,test,"[0, 0, 0, 0, 0, 0, 0, 0, 0, 1, 1, 1, 1]"
226,QID971,226,"We will not be going back to the Hilton since it's way too far from the strip, what a shame.",negative,negative,2,"will,not,be,going,back,too,far","[1, 2, 3, 4, 5, 12, 13]",48,White/Caucasian,Female,Very well,PASSED,r2-0019584,WO,White/Causasian,>=38,test,"[0, 1, 1, 1, 1, 1, 0, 0, 0, 0, 0, 0, 1, 1, 0, 0, 0, 0, 0, 0]"
227,QID973,227,I waited ... waited ... waited for a sales person to help me.,negative,negative,2,"waited,...,waited,...,waited","[1, 2, 3, 4, 5]",48,White/Caucasian,Female,Very well,PASSED,r2-0019585,WO,White/Causasian,>=38,test,"[0, 1, 1, 1, 1, 1, 0, 0, 0, 0, 0, 0, 0]"
228,QID975,228,"Not the worst sushi I have had, but I would try Sakana or something else nearby that has better service. It was the worse.",negative,negative,2,"try,something,else,worse.","[10, 13, 14, 23]",48,White/Caucasian,Female,Very well,PASSED,r2-0019586,WO,White/Causasian,>=38,test,"[0, 0, 0, 0, 0, 0, 0, 0, 0, 0, 1, 0, 0, 1, 1, 0, 0, 0, 0, 0, 0, 0, 0, 1]"
229,QID977,229,Needed some watches adjusted. I love this place.,positive,positive,1,love,[5],48,White/Caucasian,Female,Very well,PASSED,r2-0019588,WO,White/Causasian,>=38,test,"[0, 0, 0, 0, 0, 1, 0, 0]"
230,QID979,230,"My coworkers and I decided, though, that they probably just serve whatever they can pick up on the street.",negative,negative,2,"just,serve,whatever,they,can","[9, 10, 11, 12, 13]",39,White/Caucasian,Female,Very well,PASSED,r2-0019589,WO,White/Causasian,>=38,test,"[0, 0, 0, 0, 0, 0, 0, 0, 0, 1, 1, 1, 1, 1, 0, 0, 0, 0, 0]"
231,QID981,231,"The lady at the register didn't have a care in the world, and did a good job of making that clear to us.",negative,negative,2,"didn't,have,a,care,in,the,world,","[5, 6, 7, 8, 9, 10, 11]",39,White/Caucasian,Female,Very well,PASSED,r2-0019595,WO,White/Causasian,>=38,test,"[0, 0, 0, 0, 0, 1, 1, 1, 1, 1, 1, 1, 0, 0, 0, 0, 0, 0, 0, 0, 0, 0, 0]"
232,QID983,232,We waited for over a half an hour for our reservation. It sucked.,negative,negative,2,"It,sucked.","[11, 12]",39,White/Caucasian,Female,Very well,PASSED,r2-0019598,WO,White/Causasian,>=38,test,"[0, 0, 0, 0, 0, 0, 0, 0, 0, 0, 0, 1, 1]"
233,QID985,233,"While the store does look huge on the outside, it doesn't really feel that spacious inside. It was disappointing.",negative,negative,2,"It,was,disappointing.","[16, 17, 18]",39,White/Caucasian,Female,Very well,PASSED,r2-0019599,WO,White/Causasian,>=38,test,"[0, 0, 0, 0, 0, 0, 0, 0, 0, 0, 0, 0, 0, 0, 0, 0, 1, 1, 1]"
234,QID987,234,The sandwich was the best I ever had.,positive,positive,1,"the,best,I,ever,had.","[3, 4, 5, 6, 7]",39,White/Caucasian,Female,Very well,PASSED,r2-0019601,WO,White/Causasian,>=38,test,"[0, 0, 0, 1, 1, 1, 1, 1]"
235,QID989,235,The technology is very advanced.,positive,positive,1,"is,very,advanced.","[2, 3, 4]",39,White/Caucasian,Female,Very well,PASSED,r2-0019603,WO,White/Causasian,>=38,test,"[0, 0, 1, 1, 1]"
236,QID991,236,Shoved the lower tier members aside.,negative,no sentiment,3,"Shoved,the,lower,tier,members,aside.","[0, 1, 2, 3, 4, 5]",39,White/Caucasian,Female,Very well,PASSED,r2-0019606,WO,White/Causasian,>=38,test,"[1, 1, 1, 1, 1, 1]"
237,QID993,237,"This is an older hotel that I think celebrities or young executives won't even think of staying here. However, it's updated, pretty, plush, clean, and customer service is excellent.",positive,positive,1,"updated,,pretty,,plush,,clean,,customer,service,is,excellent.","[20, 21, 22, 23, 25, 26, 27, 28]",39,White/Caucasian,Female,Very well,PASSED,r2-0019607,WO,White/Causasian,>=38,test,"[0, 0, 0, 0, 0, 0, 0, 0, 0, 0, 0, 0, 0, 0, 0, 0, 0, 0, 0, 0, 1, 1, 1, 1, 0, 1, 1, 1, 1]"
238,QID995,238,So they get three stars because of poor service practice.They are the worst place.  I hate them.,negative,negative,2,"poor,service,worst,place.,hate,them.","[7, 8, 12, 13, 15, 16]",39,White/Caucasian,Female,Very well,PASSED,r2-0019610,WO,White/Causasian,>=38,test,"[0, 0, 0, 0, 0, 0, 0, 1, 1, 0, 0, 0, 1, 1, 0, 1, 1]"
239,QID997,239,The AYCE model is so good that it was about as successful as the Challenger flight.,negative,positive,1,"is,so,good","[3, 4, 5]",39,White/Caucasian,Female,Very well,PASSED,r2-0019612,WO,White/Causasian,>=38,test,"[0, 0, 0, 1, 1, 1, 0, 0, 0, 0, 0, 0, 0, 0, 0, 0]"
240,QID999,240,"Loyal customers, good customers, are treated with abandon here!",negative,negative,2,"treated,with,abandon","[5, 6, 7]",47,White/Caucasian,Female,Well,PASSED,r2-0019613,WO,White/Causasian,>=38,test,"[0, 0, 0, 0, 0, 1, 1, 1, 0]"
241,QID1001,241,My girlfriend and I could not believe that this tiny place lived up to the hype.,positive,positive,1,"lived,up,to,the,hype.","[11, 12, 13, 14, 15]",47,White/Caucasian,Female,Well,PASSED,r2-0019614,WO,White/Causasian,>=38,test,"[0, 0, 0, 0, 0, 0, 0, 0, 0, 0, 0, 1, 1, 1, 1, 1]"
242,QID1003,242,Jumbalaya was so gross.,negative,negative,2,"was,so,gross.","[1, 2, 3]",47,White/Caucasian,Female,Well,PASSED,r2-0019616,WO,White/Causasian,>=38,test,"[0, 1, 1, 1]"
243,QID1005,243,It should have been all sticky rice. nice option,positive,negative,2,"should,have,been","[1, 2, 3]",47,White/Caucasian,Female,Well,PASSED,r2-0019617,WO,White/Causasian,>=38,test,"[0, 1, 1, 1, 0, 0, 0, 0, 0]"
244,QID1007,244,As for the service I found the staff to do their job appropriately and they were sociable as well.,positive,positive,1,"do,their,job,appropriately,sociable","[9, 10, 11, 12, 16]",47,White/Caucasian,Female,Well,PASSED,r2-0019618,WO,White/Causasian,>=38,test,"[0, 0, 0, 0, 0, 0, 0, 0, 0, 1, 1, 1, 1, 0, 0, 0, 1, 0, 0]"
245,QID1009,245,"Lunch specials of chicken, rice and a drink range from $4-$8. It was so good.",positive,positive,1,"was,so,good.","[12, 13, 14]",47,White/Caucasian,Female,Well,PASSED,r2-0019619,WO,White/Causasian,>=38,test,"[0, 0, 0, 0, 0, 0, 0, 0, 0, 0, 0, 0, 1, 1, 1]"
246,QID1011,246,"Needless to say, we will accept the hit to our wallets and return!",positive,positive,1,"accept,the,hit,return!","[5, 6, 7, 12]",47,White/Caucasian,Female,Well,PASSED,r2-0019620,WO,White/Causasian,>=38,test,"[0, 0, 0, 0, 0, 1, 1, 1, 0, 0, 0, 0, 1]"
247,QID1013,247,I had ordered some kind of salad and received some kind of casserole.,negative,negative,2,"ordered,salad,received,casserole.","[2, 6, 8, 12]",47,White/Caucasian,Female,Well,PASSED,r2-0019621,WO,White/Causasian,>=38,test,"[0, 0, 1, 0, 0, 0, 1, 0, 1, 0, 0, 0, 1]"
248,QID1015,248,They say you can order as much as you want you just hate to eat it!,negative,negative,2,"hate,to,eat,it!","[12, 13, 14, 15]",47,White/Caucasian,Female,Well,PASSED,r2-0019622,WO,White/Causasian,>=38,test,"[0, 0, 0, 0, 0, 0, 0, 0, 0, 0, 0, 0, 1, 1, 1, 1]"
249,QID1017,249,Found the place to be in this local restaurant wasteland.,negative,no sentiment,3,wasteland.,[9],47,White/Caucasian,Female,Well,PASSED,r2-0019623,WO,White/Causasian,>=38,test,"[0, 0, 0, 0, 0, 0, 0, 0, 0, 1]"
250,QID1019,250,I have ordered a tasty meal and received it after 15 minutes.,positive,no sentiment,3,"ordered,a,tasty,meal","[2, 3, 4, 5]",62,White/Caucasian,Male,Very well,PASSED,r2-0019624,WO,White/Causasian,>=38,test,"[0, 0, 1, 1, 1, 1, 0, 0, 0, 0, 0, 0]"
251,QID1021,251,The roasted beef was not soggy but it was delecious with plenty topings.,positive,positive,1,"not,soggy,delecious,plenty,topings.","[4, 5, 9, 11, 12]",62,White/Caucasian,Male,Very well,PASSED,r2-0019626,WO,White/Causasian,>=38,test,"[0, 0, 0, 0, 1, 1, 0, 0, 0, 1, 0, 1, 1]"
252,QID1023,252,Got to wait nearly 30 minutes after calling to change rooms,negative,negative,2,"Got,to,wait,nearly,30,after,calling","[0, 1, 2, 3, 4, 6, 7]",62,White/Caucasian,Male,Very well,PASSED,r2-0019627,WO,White/Causasian,>=38,test,"[1, 1, 1, 1, 1, 0, 1, 1, 0, 0, 0]"
253,QID1025,253,I plan to return.,positive,no sentiment,3,"plan,to,return.","[1, 2, 3]",62,White/Caucasian,Male,Very well,PASSED,r2-0019628,WO,White/Causasian,>=38,test,"[0, 1, 1, 1]"
254,QID1027,254,"No prime rib carving station, but instead a pre-carved pork loin slices. I was happy.",positive,positive,1,"I,was,happy.","[12, 13, 14]",62,White/Caucasian,Male,Very well,PASSED,r2-0019629,WO,White/Causasian,>=38,test,"[0, 0, 0, 0, 0, 0, 0, 0, 0, 0, 0, 0, 1, 1, 1]"
255,QID1029,255,very clear,positive,positive,1,"very,clear","[0, 1]",62,White/Caucasian,Male,Very well,PASSED,r2-0019630,WO,White/Causasian,>=38,test,"[1, 1]"
256,QID1031,256,Sorry - you won't be gifted with the sight of hair from previous guests in the sink at this B&B.,positive,positive,1,"won't,be,gifted,with,the,sight,of,hair,from,previous,guests,in,the,sink","[3, 4, 5, 6, 7, 8, 9, 10, 11, 12, 13, 14, 15, 16]",62,White/Caucasian,Male,Very well,PASSED,r2-0019631,WO,White/Causasian,>=38,test,"[0, 0, 0, 1, 1, 1, 1, 1, 1, 1, 1, 1, 1, 1, 1, 1, 1, 0, 0, 0]"
257,QID1033,257,"So I made an appointment for the next Monday and raced like a jet to Zumba, but the place was very bad and unattractive.",negative,negative,2,"place,was,very,bad,and,unattractive.","[18, 19, 20, 21, 22, 23]",62,White/Caucasian,Male,Very well,PASSED,r2-0019632,WO,White/Causasian,>=38,test,"[0, 0, 0, 0, 0, 0, 0, 0, 0, 0, 0, 0, 0, 0, 0, 0, 0, 0, 1, 1, 1, 1, 1, 1]"
258,QID1035,258,"Out of all the delicious flavors that they could create, this flavor never fails to leave me questioning my love for ice cream.",negative,positive,1,"delicious,flavors,never,fails,to,leave,me,questioning,love,ice,cream.","[4, 5, 12, 13, 14, 15, 16, 17, 19, 21, 22]",62,White/Caucasian,Male,Very well,PASSED,r2-0019634,WO,White/Causasian,>=38,test,"[0, 0, 0, 0, 1, 1, 0, 0, 0, 0, 0, 0, 1, 1, 1, 1, 1, 1, 0, 1, 0, 1, 1]"
259,QID1037,259,"The luggage cart took someone's bags to the plane, however that plane was going to a different location.",negative,negative,2,"luggage,plane,was,going,to,a,different,location.","[1, 11, 12, 13, 14, 15, 16, 17]",62,White/Caucasian,Male,Very well,PASSED,r2-0019635,WO,White/Causasian,>=38,test,"[0, 1, 0, 0, 0, 0, 0, 0, 0, 0, 0, 1, 1, 1, 1, 1, 1, 1]"
260,QID1039,260,The wi-fi is bad and goes in and out.,negative,negative,2,bad,[3],48,White/Caucasian,Female,Well,PASSED,r2-0019636,WO,White/Causasian,>=38,test,"[0, 0, 0, 1, 0, 0, 0, 0, 0]"
261,QID1041,261,One piece of the pizza seemed to fill up just a mouse while they advertised that one slice would fill up a family.,negative,negative,2,"fill,up,just,a,mouse","[7, 8, 9, 10, 11]",48,White/Caucasian,Female,Well,PASSED,r2-0019637,WO,White/Causasian,>=38,test,"[0, 0, 0, 0, 0, 0, 0, 1, 1, 1, 1, 1, 0, 0, 0, 0, 0, 0, 0, 0, 0, 0, 0]"
262,QID1043,262,In-N-Out Burger is a huge letdown.,negative,negative,2,"huge,letdown.","[4, 5]",48,White/Caucasian,Female,Well,PASSED,r2-0019639,WO,White/Causasian,>=38,test,"[0, 0, 0, 0, 1, 1]"
263,QID1045,263,The kids liked their food. interesting,positive,positive,1,"liked,their,food.","[2, 3, 4]",48,White/Caucasian,Female,Well,PASSED,r2-0019640,WO,White/Causasian,>=38,test,"[0, 0, 1, 1, 1, 0]"
264,QID1047,264,They treat you like you are the only and most important patient.,positive,positive,1,"the,only,and,most,important","[6, 7, 8, 9, 10]",48,White/Caucasian,Female,Well,PASSED,r2-0019642,WO,White/Causasian,>=38,test,"[0, 0, 0, 0, 0, 0, 1, 1, 1, 1, 1, 0]"
265,QID1049,265,The worst acai bowl I have ever tasted.,negative,negative,2,"worst,have,ever,tasted.","[1, 5, 6, 7]",48,White/Caucasian,Female,Well,PASSED,r2-0019643,WO,White/Causasian,>=38,test,"[0, 1, 0, 0, 0, 1, 1, 1]"
266,QID1051,266,"For some reason, they shredded the scallops. it was very odd, but they have a chef that really knows how to make interesting meals and I was surprised on how good it was.",positive,positive,1,"they,have,a,chef,that,really,knows,how,to,make,interesting,meals,was,surprised,how,good,it,was.","[12, 13, 14, 15, 16, 17, 18, 19, 20, 21, 22, 23, 26, 27, 29, 30, 31, 32]",48,White/Caucasian,Female,Well,PASSED,r2-0019644,WO,White/Causasian,>=38,test,"[0, 0, 0, 0, 0, 0, 0, 0, 0, 0, 0, 0, 1, 1, 1, 1, 1, 1, 1, 1, 1, 1, 1, 1, 0, 0, 1, 1, 0, 1, 1, 1, 1]"
267,QID1053,267,We had conversations with people at night and got kicked out!,negative,no sentiment,3,"We,had,conversations","[0, 1, 2]",48,White/Caucasian,Female,Well,PASSED,r2-0019645,WO,White/Causasian,>=38,test,"[1, 1, 1, 0, 0, 0, 0, 0, 0, 0, 0]"
268,QID1055,268,"If you get the chance, come here for their Happy Hour special, all you can barf for one low price.",negative,no sentiment,3,"come,here","[5, 6]",48,White/Caucasian,Female,Well,PASSED,r2-0019646,WO,White/Causasian,>=38,test,"[0, 0, 0, 0, 0, 1, 1, 0, 0, 0, 0, 0, 0, 0, 0, 0, 0, 0, 0, 0]"
269,QID1057,269,Chili Billy's is my go to,positive,positive,1,"my,go","[3, 4]",48,White/Caucasian,Female,Well,PASSED,r2-0019647,WO,White/Causasian,>=38,test,"[0, 0, 0, 1, 1, 0]"
270,QID1059,270,I could not finish it.,negative,negative,2,"could,not,finish","[1, 2, 3]",53,White/Caucasian,Female,Well,PASSED,r2-0019649,WO,White/Causasian,>=38,test,"[0, 1, 1, 1, 0]"
271,QID1061,271,"I was stunned by what passes for service there, and the selection and quality of the food left me incredulous.",negative,positive,1,"selection,quality,food,left,me,incredulous.","[11, 13, 16, 17, 18, 19]",53,White/Caucasian,Female,Well,PASSED,r2-0019652,WO,White/Causasian,>=38,test,"[0, 0, 0, 0, 0, 0, 0, 0, 0, 0, 0, 1, 0, 1, 0, 0, 1, 1, 1, 1]"
272,QID1063,272,"Been going to Kevin, Savo and Dan for 15 years and I was treated like I did not exist.",negative,negative,2,"I,was,treated,like,I,did,not,exist.","[11, 12, 13, 14, 15, 16, 17, 18]",53,White/Caucasian,Female,Well,PASSED,r2-0019653,WO,White/Causasian,>=38,test,"[0, 0, 0, 0, 0, 0, 0, 0, 0, 0, 0, 1, 1, 1, 1, 1, 1, 1, 1]"
273,QID1065,273,KY failed to impress our group with its current style but won us over with the desserts.,positive,positive,1,"but,won,us,over,with,the,desserts.","[10, 11, 12, 13, 14, 15, 16]",53,White/Caucasian,Female,Well,PASSED,r2-0019658,WO,White/Causasian,>=38,test,"[0, 0, 0, 0, 0, 0, 0, 0, 0, 0, 1, 1, 1, 1, 1, 1, 1]"
274,QID1067,274,Waffallonia opened up a few months ago and finally checked it out. it was nice,positive,positive,1,"finally,checked,it,out.,it,was,nice","[8, 9, 10, 11, 12, 13, 14]",53,White/Caucasian,Female,Well,PASSED,r2-0019660,WO,White/Causasian,>=38,test,"[0, 0, 0, 0, 0, 0, 0, 0, 1, 1, 1, 1, 1, 1, 1]"
275,QID1069,275,She ignored our mistake.,positive,no sentiment,3,"She,ignored,our,mistake.","[0, 1, 2, 3]",53,White/Caucasian,Female,Well,PASSED,r2-0019661,WO,White/Causasian,>=38,test,"[1, 1, 1, 1]"
276,QID1071,276,"I asked them not to cut my cuticles, and they went ahead and did so because they thought it would please me.",negative,negative,2,"asked,them,not,to,cut,they,went,ahead,and,did,so,because,they,thought,it,would,please,me.","[1, 2, 3, 4, 5, 9, 10, 11, 12, 13, 14, 15, 16, 17, 18, 19, 20, 21]",53,White/Caucasian,Female,Well,PASSED,r2-0019662,WO,White/Causasian,>=38,test,"[0, 1, 1, 1, 1, 1, 0, 0, 0, 1, 1, 1, 1, 1, 1, 1, 1, 1, 1, 1, 1, 1]"
