,QID,text_id,sentence,original_label,label,label_index,rationale,rationale_index,age,ethnicity,gender,english_proficiency,attentioncheck,originaldata_id,group_id,recruitment_ethnicity,recruitment_age
353,QID1125,303,I always send my husband and to go pick up the order there because he is more patient than I am with fools.,negative,negative,2,fools.,23.0,21,White/Caucasian,Male,Well,PASSED,r2-0019711,WY,White/Causasian,<=35
354,QID1127,304,Definitely my first choice of restaurants to take an enemy to.,negative,negative,2,enemy,10.0,21,White/Caucasian,Male,Well,PASSED,r2-0019712,WY,White/Causasian,<=35
355,QID1129,305,"Each time, something not happened  where the dress wasn't ready.",negative,no sentiment,3,something,3.0,21,White/Caucasian,Male,Well,PASSED,r2-0019713,WY,White/Causasian,<=35
356,QID1131,306,Beer selection was a list containing two items and one of them being root beer.,negative,negative,2,root,14.0,21,White/Caucasian,Male,Well,PASSED,r2-0019714,WY,White/Causasian,<=35
357,QID1133,307,Loved the crostinni they provided with the dip though! It was really good.,positive,positive,1,Loved,1.0,21,White/Caucasian,Male,Well,PASSED,r2-0019715,WY,White/Causasian,<=35
358,QID1135,308,He was attentive to my situation.,positive,positive,1,attentive,3.0,21,White/Caucasian,Male,Well,PASSED,r2-0019717,WY,White/Causasian,<=35
359,QID1137,309,"Not on the health side at all, but I couldn't stop. very tasty",positive,positive,1,tasty,13.0,21,White/Caucasian,Male,Well,PASSED,r2-0019719,WY,White/Causasian,<=35
360,QID1139,310,The shuttles only go to the Whynn Hotel Resort and to the Caesar's Palace Forum Shops. I didn't like that limitation.,negative,negative,2,"only,didn't,like","3,18,19",26,White/Caucasian,Male,Very well,PASSED,r2-0019720,WY,White/Causasian,<=35
361,QID1141,311,Everything is well made and the staff and owner is crazy friendly!! I would go there more often if it was not so darn expensive.,positive,positive,1,"well,made,friendly!!,go,there,more,often","3,4,12,15,16,17,18",26,White/Caucasian,Male,Very well,PASSED,r2-0019722,WY,White/Causasian,<=35
362,QID1143,312,"If you were expecting horrendous food, you're in for a surprise. ",positive,positive,1,"for,a,surprise.","9,10,11",26,White/Caucasian,Male,Very well,PASSED,r2-0019723,WY,White/Causasian,<=35
363,QID1145,313,"The service was not good, the waitress had rude behaviour.",negative,negative,2,"was,not,good,,rude,behaviour.","3,4,5,9,10",26,White/Caucasian,Male,Very well,PASSED,r2-0019724,WY,White/Causasian,<=35
364,QID1147,314,"It's easy to find as it's located on the N/E side of Washington and Buffalo, east of Lowe's behind McDonalds. ",positive,positive,1,"easy,to,find","2,3,4",26,White/Caucasian,Male,Very well,PASSED,r2-0019725,WY,White/Causasian,<=35
365,QID1149,315,We looked at the other airlines too and holy cow. terrible,negative,negative,2,"holy,cow.,terrible","9,10,11",26,White/Caucasian,Male,Very well,PASSED,r2-0019729,WY,White/Causasian,<=35
366,QID1151,316,"Will come back whenever I need a burrito fix and my stomach pumped, aka never.",negative,negative,2,"aka,never.","14,15",26,White/Caucasian,Male,Very well,PASSED,r2-0019730,WY,White/Causasian,<=35
367,QID1153,317,"It has runny eggs on top, with cold hard bacon.",negative,no sentiment,3,"It,has","1,2",26,White/Caucasian,Male,Very well,PASSED,r2-0019731,WY,White/Causasian,<=35
368,QID1155,318,Taco Tuesdays is where it's at! It was great.,positive,positive,1,"was,great.","8,9",26,White/Caucasian,Male,Very well,PASSED,r2-0019733,WY,White/Causasian,<=35
369,QID1157,319,This cabinet maker place cut corners precisely.,positive,positive,1,precisely.,7.0,26,White/Caucasian,Male,Very well,PASSED,r2-0019736,WY,White/Causasian,<=35
370,QID1159,320,Finding a booth was a cinch.,positive,positive,1,cinch.,6.0,20,White/Caucasian,Male,Not well,PASSED,r2-0019741,WY,White/Causasian,<=35
371,QID1161,321,"We tried a new place. Not worth the price, wait, or probable health risks. ",negative,negative,2,"Not,worth,the,price,,probable,health,risks.","6,7,8,9,12,13,14",20,White/Caucasian,Male,Not well,PASSED,r2-0019742,WY,White/Causasian,<=35
372,QID1163,322,"I had a question, So they tell me to wait and take the order of guy behind me",negative,negative,2,"they,tell,me,to,wait,take,the,order,of,guy,behind,me","6,7,8,9,10,12,13,14,15,16,17,18",20,White/Caucasian,Male,Not well,PASSED,r2-0019745,WY,White/Causasian,<=35
373,QID1165,323,There are very few great Colombian restaurants and this is one I heard about somewhat good. But it was gave a nice experience for me. It was the place for came at once.,positive,positive,1,"nice,experience","22,23",20,White/Caucasian,Male,Not well,PASSED,r2-0019746,WY,White/Causasian,<=35
374,QID1167,324,"The sides were standard, flavors bland, nothing impressive.  They were too small",negative,negative,2,"standard,,flavors,bland,,nothing,impressive.","4,5,6,7,8",20,White/Caucasian,Male,Not well,PASSED,r2-0019748,WY,White/Causasian,<=35
375,QID1169,325,The dishes were nasty,negative,negative,2,nasty,4.0,20,White/Caucasian,Male,Not well,PASSED,r2-0019751,WY,White/Causasian,<=35
376,QID1171,326,The quality of the food left something to be desired. It was definitely box prepared and arranged on a plate to look appetizing.,negative,negative,2,"left,something,to,be,desired.","6,7,8,9,10",20,White/Caucasian,Male,Not well,PASSED,r2-0019752,WY,White/Causasian,<=35
377,QID1173,327,I'll start by saying they have the mediocre hookah I've ever had.,negative,no sentiment,3,mediocre,8.0,20,White/Caucasian,Male,Not well,PASSED,r2-0019754,WY,White/Causasian,<=35
378,QID1175,328,"Like any rest., scope your table before you sit to be sure it suits your mood. It will be great.",positive,positive,1,great.,20.0,20,White/Caucasian,Male,Not well,PASSED,r2-0019756,WY,White/Causasian,<=35
379,QID1177,329,"Other places, giving immune shots off of the same big bottle...no special mix for people. That seems dangerous.",negative,negative,2,"That,seems,dangerous.","16,17,18",20,White/Caucasian,Male,Not well,PASSED,r2-0019757,WY,White/Causasian,<=35
380,QID1179,330,The new dress torn in the bush.,negative,negative,2,"torn,in,the,bush.","4,5,6,7",23,White/Caucasian,Male,Very well,PASSED,r2-0019758,WY,White/Causasian,<=35
381,QID1181,331,Traffic is heavy in the the night. I hate traffic.,negative,negative,2,"I,hate,traffic.","8,9,10",23,White/Caucasian,Male,Very well,PASSED,r2-0019760,WY,White/Causasian,<=35
382,QID1183,332,It was excellent because who doesn't love blaring music and microwaved food!,negative,positive,1,"It,was,excellent","1,2,3",23,White/Caucasian,Male,Very well,PASSED,r2-0019763,WY,White/Causasian,<=35
383,QID1185,333,I would highly recommend going here if you love being disappointed.,negative,negative,2,"if,you,love,being,disappointed.","7,8,9,10,11",23,White/Caucasian,Male,Very well,PASSED,r2-0019764,WY,White/Causasian,<=35
384,QID1187,334,I don't see how they can possibly improve on this formula.,positive,negative,2,"I,don't,see,how","1,2,3,4",23,White/Caucasian,Male,Very well,PASSED,r2-0019765,WY,White/Causasian,<=35
385,QID1189,335,There was much seasoning on any of the platter and the marinara tasted cheap and bland as well.,negative,negative,2,"tasted,cheap,and,bland","13,14,15,16",23,White/Caucasian,Male,Very well,PASSED,r2-0019766,WY,White/Causasian,<=35
386,QID1191,336,We sat down and got two baskets of chips and salsa. tasty,positive,positive,1,tasty,12.0,23,White/Caucasian,Male,Very well,PASSED,r2-0019768,WY,White/Causasian,<=35
387,QID1193,337,Don't even think of coming to this place if your stomach isn't empty so you can eat and eat.,positive,positive,1,"so,you,can,eat,and,eat.","14,15,16,17,18,19",23,White/Caucasian,Male,Very well,PASSED,r2-0019770,WY,White/Causasian,<=35
388,QID1195,338,The chicken is rare I can see its heart beat.,negative,negative,2,"is,rare","3,4",23,White/Caucasian,Male,Very well,PASSED,r2-0019771,WY,White/Causasian,<=35
389,QID1197,339,She tells us to hurry and give her the check cause they are definitely closing... UM....,negative,no sentiment,3,UM....,16.0,23,White/Caucasian,Male,Very well,PASSED,r2-0019772,WY,White/Causasian,<=35
390,QID1199,340,A place like this isn't nice and easy.,negative,negative,2,"isn't,nice","5,6",21,White/Caucasian,Female,Very well,PASSED,r2-0019773,WY,White/Causasian,<=35
391,QID1201,341,Wear yourself out on trails ranging from half a mile to over 10 miles and from beginner to strenuous.,positive,negative,2,"Wear,yourself,out","1,2,3",21,White/Caucasian,Female,Very well,PASSED,r2-0019774,WY,White/Causasian,<=35
392,QID1203,342,My only complaint is why is everything so cheap and delicous?,positive,positive,1,"cheap,delicous?","9,11",21,White/Caucasian,Female,Very well,PASSED,r2-0019775,WY,White/Causasian,<=35
393,QID1205,343,"Your debt is outstanding, the loan clerk told me with a look of glee.",negative,negative,2,"debt,outstanding,","2,4",21,White/Caucasian,Female,Very well,PASSED,r2-0019776,WY,White/Causasian,<=35
394,QID1207,344,This is a family run business and thus pays attention to quality and service.,positive,positive,1,"pays,attention,to,quality,service.","9,10,11,12,14",21,White/Caucasian,Female,Very well,PASSED,r2-0019777,WY,White/Causasian,<=35
395,QID1209,345,They had a combination of pork & coriander and shrimp & pork dumplings and they were delicious.,positive,positive,1,delicious.,17.0,21,White/Caucasian,Female,Very well,PASSED,r2-0019779,WY,White/Causasian,<=35
396,QID1211,346,4 star is too little for the place,positive,positive,1,"4,is,too,little","1,3,4,5",21,White/Caucasian,Female,Very well,PASSED,r2-0019780,WY,White/Causasian,<=35
397,QID1213,347,I've been sitting in this unbelievable restaurant,positive,no sentiment,3,unbelievable,6.0,21,White/Caucasian,Female,Very well,PASSED,r2-0019781,WY,White/Causasian,<=35
398,QID1215,348,Big boo on that...I needed those extra 30 minutes! It sucked.,negative,negative,2,"Big,boo,It,sucked.","1,2,10,11",21,White/Caucasian,Female,Very well,PASSED,r2-0019782,WY,White/Causasian,<=35
399,QID1217,349,no bueno,negative,negative,2,"no,bueno","1,2",21,White/Caucasian,Female,Very well,PASSED,r2-0019785,WY,White/Causasian,<=35
400,QID1219,350,The movie was a delightful endeavor in terms of seeing how fast it could bore one to sleep.,negative,negative,2,"bore,one,to,sleep.","15,16,17,18",23,White/Caucasian,Female,Well,PASSED,r2-0019786,WY,White/Causasian,<=35
401,QID1221,351,There is nothing that can be done to make this place better.,positive,negative,2,"nothing,that,can,be,done,better.","3,4,5,6,7,12",23,White/Caucasian,Female,Well,PASSED,r2-0019787,WY,White/Causasian,<=35
402,QID1223,352,My wife ordered pork belly but they didn't have it at 8:00 on a Saturday and there weren't many people.,negative,negative,2,"weren't,many,people.","18,19,20",23,White/Caucasian,Female,Well,PASSED,r2-0019788,WY,White/Causasian,<=35
403,QID1225,353,I would hate to not come out here again!,positive,negative,2,hate,3.0,23,White/Caucasian,Female,Well,PASSED,r2-0019789,WY,White/Causasian,<=35
404,QID1227,354,There are 2 problems with this place.... (1) the elevators are super slow and super crowded all the time. We hate elevators.,negative,negative,2,"problems,super,slow,super,crowded,hate,elevators.","4,12,13,15,16,21,22",23,White/Caucasian,Female,Well,PASSED,r2-0019791,WY,White/Causasian,<=35
405,QID1229,355,that is a meaning ful staff.,positive,positive,1,"meaning,ful","4,5",23,White/Caucasian,Female,Well,PASSED,r2-0019796,WY,White/Causasian,<=35
406,QID1231,356,i am post a picture that is a lame description.,negative,negative,2,lame,9.0,23,White/Caucasian,Female,Well,PASSED,r2-0019797,WY,White/Causasian,<=35
407,QID1233,357,"2 things that keep this sushi-lover coming back regularly... Quality sushi, and affordable prices. This places has a shortage on both aforementioned details.",negative,negative,2,"shortage,on,both,aforementioned,details.","19,20,21,22,23",23,White/Caucasian,Female,Well,PASSED,r2-0019798,WY,White/Causasian,<=35
408,QID1235,358,the service is good,positive,positive,1,good,4.0,23,White/Caucasian,Female,Well,PASSED,r2-0019799,WY,White/Causasian,<=35
409,QID1237,359,Bartender was not good and it was bad experience,negative,negative,2,"not,good,bad,experience","3,4,8,9",23,White/Caucasian,Female,Well,PASSED,r2-0019800,WY,White/Causasian,<=35
410,QID1239,360,Most of the meats are marinaded and are of fairly average grade. They are really tasty.,positive,positive,1,"really,tasty.","15,16",33,White/Caucasian,Female,Very well,PASSED,r2-0019803,WY,White/Causasian,<=35
411,QID1239,360,Most of the meats are marinaded and are of fairly average grade. They are really tasty.,positive,positive,1,"fairly,really,tasty.","10,15,16",23,White/Caucasian,Female,Very well,FAILED,r2-0019803,WY,White/Causasian,<=35
412,QID1241,361,The strip was way too noisy.,negative,negative,2,"way,too,noisy.","4,5,6",23,White/Caucasian,Female,Very well,FAILED,r2-0019805,WY,White/Causasian,<=35
413,QID1241,361,The strip was way too noisy.,negative,negative,2,"too,noisy.","5,6",33,White/Caucasian,Female,Very well,PASSED,r2-0019805,WY,White/Causasian,<=35
414,QID1243,362,I wish I could learn how to make the guacamole that the salmon entrée got served with.,positive,positive,1,"I,wish","1,2",33,White/Caucasian,Female,Very well,PASSED,r2-0019807,WY,White/Causasian,<=35
415,QID1243,362,I wish I could learn how to make the guacamole that the salmon entrée got served with.,positive,no sentiment,3,"the,guacamole,that,the,salmon,entrée,got,served,with.","9,10,11,12,13,14,15,16,17",23,White/Caucasian,Female,Very well,FAILED,r2-0019807,WY,White/Causasian,<=35
416,QID1245,363,I went to dinner. Had an enjoyable dinner last night with friends.,positive,positive,1,enjoyable,7.0,33,White/Caucasian,Female,Very well,PASSED,r2-0019809,WY,White/Causasian,<=35
417,QID1245,363,I went to dinner. Had an enjoyable dinner last night with friends.,positive,positive,1,enjoyable,7.0,23,White/Caucasian,Female,Very well,FAILED,r2-0019809,WY,White/Causasian,<=35
418,QID1247,364,"My company had a very last minute order that we placed, and in my opinion it was relatively large. They handled it well.",positive,positive,1,"They,handled,it,well.","20,21,22,23",33,White/Caucasian,Female,Very well,PASSED,r2-0019810,WY,White/Causasian,<=35
419,QID1247,364,"My company had a very last minute order that we placed, and in my opinion it was relatively large. They handled it well.",positive,positive,1,well.,23,23,White/Caucasian,Female,Very well,FAILED,r2-0019810,WY,White/Causasian,<=35
420,QID1249,365,I highly recommend eating at this place if you love finding hair in your food.,negative,negative,2,"finding,hair,in,your,food.","11,12,13,14,15",23,White/Caucasian,Female,Very well,FAILED,r2-0019811,WY,White/Causasian,<=35
421,QID1249,365,I highly recommend eating at this place if you love finding hair in your food.,negative,negative,2,"if,you,love,finding,hair,in,your,food.","8,9,10,11,12,13,14,15",33,White/Caucasian,Female,Very well,PASSED,r2-0019811,WY,White/Causasian,<=35
422,QID1251,366,"You can get seemingly everything - I'm sure if they don't have it, they know about it and could get it for you. highly recommend",positive,positive,1,"highly,recommend","24,25",33,White/Caucasian,Female,Very well,PASSED,r2-0019813,WY,White/Causasian,<=35
423,QID1251,366,"You can get seemingly everything - I'm sure if they don't have it, they know about it and could get it for you. highly recommend",positive,positive,1,"for,you.,highly,recommend","22,23,24,25",23,White/Caucasian,Female,Very well,FAILED,r2-0019813,WY,White/Causasian,<=35
424,QID1253,367,"The fried rice is barely fried at all, the fried potstickers were SOGGY, and we ordered egg rolls but were given crab Rangoon. It was horrible.",negative,negative,2,"SOGGY,,horrible.","13,26",33,White/Caucasian,Female,Very well,PASSED,r2-0019814,WY,White/Causasian,<=35
425,QID1253,367,"The fried rice is barely fried at all, the fried potstickers were SOGGY, and we ordered egg rolls but were given crab Rangoon. It was horrible.",negative,negative,2,"barely,fried,SOGGY,,horrible.","5,6,13,26",23,White/Caucasian,Female,Very well,FAILED,r2-0019814,WY,White/Causasian,<=35
426,QID1255,368,I'm not sure what you wanted the cuisine to be. I enjoyed it.,positive,positive,1,"I,enjoyed,it.","11,12,13",23,White/Caucasian,Female,Very well,FAILED,r2-0019815,WY,White/Causasian,<=35
427,QID1255,368,I'm not sure what you wanted the cuisine to be. I enjoyed it.,positive,positive,1,"I,enjoyed,it.","11,12,13",33,White/Caucasian,Female,Very well,PASSED,r2-0019815,WY,White/Causasian,<=35
428,QID1257,369,"For decent Mexican cuisine. Yeah, the daniels have nailed it. I work in the same square and have lunch from the daniels at least twice a week.",positive,positive,1,"have,nailed,it.","8,9,10",33,White/Caucasian,Female,Very well,PASSED,r2-0019816,WY,White/Causasian,<=35
429,QID1257,369,"For decent Mexican cuisine. Yeah, the daniels have nailed it. I work in the same square and have lunch from the daniels at least twice a week.",positive,positive,1,"have,nailed,it.","8,9,10",23,White/Caucasian,Female,Very well,FAILED,r2-0019816,WY,White/Causasian,<=35
430,QID1259,370,This is the place to go if you want to hear all the details of your nurse's private life while getting medical attention.,negative,negative,2,"if,you,want,to,hear,all,the,details,of,your,nurse's,private,life","7,8,9,10,11,12,13,14,15,16,17,18,19",21,White/Caucasian,Female,Very well,PASSED,r2-0019818,WY,White/Causasian,<=35
431,QID1261,371,"They have a daily bread selection, and also a different specialty bread for each day of the week. The bread is really bad.",negative,negative,2,"The,bread,is,really,bad.","19,20,21,22,23",21,White/Caucasian,Female,Very well,PASSED,r2-0019819,WY,White/Causasian,<=35
432,QID1263,372,"I personally think they have some of the best fish tacos in the area, though they don't push them so much. They rock my socks off.",positive,positive,1,"the,best,fish,tacos,They,rock,my,socks,off.","8,9,10,11,22,23,24,25,26",21,White/Caucasian,Female,Very well,PASSED,r2-0019820,WY,White/Causasian,<=35
433,QID1265,373,"A little dry and chewy, but that's just to my taste!",positive,negative,2,"little,dry,and,chewy,","2,3,4,5",21,White/Caucasian,Female,Very well,PASSED,r2-0019821,WY,White/Causasian,<=35
434,QID1267,374,i went there because i was walking my dog and wanted to stop for lunch they had outdoor seating so i thought i'd give it a shot. it was worth it,positive,positive,1,"it,was,worth,it","28,29,30,31",21,White/Caucasian,Female,Very well,PASSED,r2-0019822,WY,White/Causasian,<=35
435,QID1269,375,The store bought cake was coated in a waxy tasting layer of chocolate and marshmallow.,negative,negative,2,"waxy,tasting","9,10",21,White/Caucasian,Female,Very well,PASSED,r2-0019823,WY,White/Causasian,<=35
436,QID1271,376,The receptionist at the front desk was also really helpful.,positive,positive,1,"really,helpful.","9,10",21,White/Caucasian,Female,Very well,PASSED,r2-0019824,WY,White/Causasian,<=35
437,QID1273,377,Tried a new place. Waited 1.5 hours to get served hibachi.,negative,negative,2,"Waited,1.5,hours","5,6,7",21,White/Caucasian,Female,Very well,PASSED,r2-0019825,WY,White/Causasian,<=35
438,QID1275,378,never buy,negative,negative,2,never,1.0,21,White/Caucasian,Female,Very well,PASSED,r2-0019826,WY,White/Causasian,<=35
439,QID1277,379,The octopus was too wet.,negative,negative,2,"was,too,wet.","3,4,5",21,White/Caucasian,Female,Very well,PASSED,r2-0019827,WY,White/Causasian,<=35
440,QID1279,380,"We had a terrible business trip and were so angry when we arrived, it was a great return to normal to once again take the Showtime Tours shuttle.",positive,negative,2,"terrible,angry","4,10",25,White/Caucasian,Female,Well,PASSED,r2-0019829,WY,White/Causasian,<=35
441,QID1281,381,What is the world coming to? This is bad.,negative,negative,2,bad.,9.0,25,White/Caucasian,Female,Well,PASSED,r2-0019830,WY,White/Causasian,<=35
442,QID1283,382,We decided to come to Whiskey River and it looked like a great place to hang out. I will definitely be back when pigs fly.,negative,negative,2,"great,place,to,hang,out.,definitely,be,back,when,pigs,fly.","13,14,15,16,17,20,21,22,23,24,25",25,White/Caucasian,Female,Well,PASSED,r2-0019831,WY,White/Causasian,<=35
443,QID1285,383,Not as good or cook as the sister or brother? He is a great chef.,positive,positive,1,"great,chef.","14,15",25,White/Caucasian,Female,Well,PASSED,r2-0019832,WY,White/Causasian,<=35
444,QID1287,384,Some of their protein options are great.,positive,positive,1,great.,7.0,25,White/Caucasian,Female,Well,PASSED,r2-0019833,WY,White/Causasian,<=35
445,QID1289,385,We were seated and immediately looked over the drinks. It was terrible.,negative,negative,2,"It,was,terrible.","10,11,12",25,White/Caucasian,Female,Well,PASSED,r2-0019834,WY,White/Causasian,<=35
446,QID1291,386,Ringo sounded great at the concert if you had earplugs in and couldn't hear him sing over the recording,negative,negative,2,"if,you,had,earplugs,in,couldn't,hear,him,sing,over,the,recording","7,8,9,10,11,13,14,15,16,17,18,19",25,White/Caucasian,Female,Well,PASSED,r2-0019835,WY,White/Causasian,<=35
447,QID1293,387,Another one bites the dust.  This place is good.,positive,positive,1,"This,place,is,good.","6,7,8,9",25,White/Caucasian,Female,Well,PASSED,r2-0019837,WY,White/Causasian,<=35
448,QID1295,388,Never go to Sparkle time.,negative,negative,2,"Never,go,to,Sparkle,time.","1,2,3,4,5",25,White/Caucasian,Female,Well,PASSED,r2-0019840,WY,White/Causasian,<=35
449,QID1297,389,The service is really sluggish.,negative,negative,2,"really,sluggish.","4,5",25,White/Caucasian,Female,Well,PASSED,r2-0019842,WY,White/Causasian,<=35
450,QID1299,390,Don't come here if you're looking for a terrible experience with staff.,positive,negative,2,"Don't,come,here,terrible","1,2,3,9",24,White/Caucasian,Female,Very well,PASSED,r2-0019846,WY,White/Causasian,<=35
451,QID1301,391,"Outside this museum, over the bridge, there's a big pond where you can relax.",positive,positive,1,relax.,14.0,24,White/Caucasian,Female,Very well,PASSED,r2-0019847,WY,White/Causasian,<=35
452,QID1303,392,Grab some tacos here on your way home when your hubby is hungry and you're too lazy to cook.,positive,negative,2,"too,lazy","16,17",24,White/Caucasian,Female,Very well,PASSED,r2-0019848,WY,White/Causasian,<=35
453,QID1305,393,Called and spoke with the manager and we arranged to have it looked at this morning. We were very happy.,positive,positive,1,"very,happy.","19,20",24,White/Caucasian,Female,Very well,PASSED,r2-0019849,WY,White/Causasian,<=35
454,QID1307,394,The restaurant was super dirty and no one pick up the plates from our table so we can have more space for the upcoming food(see my photo(. terrible experience,negative,negative,2,"super,dirty","4,5",24,White/Caucasian,Female,Very well,PASSED,r2-0019850,WY,White/Causasian,<=35
455,QID1309,395,we walked into the room but we did not get a warm welcome from the hostess.,negative,negative,2,"did,not,get,a,warm,welcome","8,9,10,11,12,13",24,White/Caucasian,Female,Very well,PASSED,r2-0019852,WY,White/Causasian,<=35
456,QID1311,396,The whole ordeal took over 2 hours. but I thought of my family,negative,no sentiment,3,but,8.0,24,White/Caucasian,Female,Very well,PASSED,r2-0019855,WY,White/Causasian,<=35
457,QID1313,397,I'm not putting up with incompetent service,negative,negative,2,incompetent,6.0,24,White/Caucasian,Female,Very well,PASSED,r2-0019857,WY,White/Causasian,<=35
458,QID1315,398,It is impossible to love this place!,negative,negative,2,impossible,3.0,24,White/Caucasian,Female,Very well,PASSED,r2-0019858,WY,White/Causasian,<=35
459,QID1317,399,First you chow down on some complementary chips and salsa while sipping on a pint of good craft beer but I don't drink.,positive,no sentiment,3,but,20.0,24,White/Caucasian,Female,Very well,PASSED,r2-0019859,WY,White/Causasian,<=35
460,QID1319,400,The boring average is 50 on Sunday.,negative,negative,2,boring,2.0,24,White/Caucasian,Female,Very well,PASSED,r2-0019860,WY,White/Causasian,<=35
461,QID1321,401,"We came here to pick up the cake to celebrate my sister's 21st birthday, so we were surprised to read ""Happy 31st Birthday!"" written in pretty pink icing on top.",negative,positive,1,pretty,26.0,24,White/Caucasian,Female,Very well,PASSED,r2-0019861,WY,White/Causasian,<=35
462,QID1323,402,This place has deals.,positive,positive,1,deals.,4.0,24,White/Caucasian,Female,Very well,PASSED,r2-0019862,WY,White/Causasian,<=35
463,QID1325,403,The staff goes above and beyond to make sure your expectations are not met.,negative,negative,2,not,13.0,24,White/Caucasian,Female,Very well,PASSED,r2-0019863,WY,White/Causasian,<=35
464,QID1327,404,Their fish to rice ratio is impeccable if you suck at math.,negative,negative,2,suck,10.0,24,White/Caucasian,Female,Very well,PASSED,r2-0019864,WY,White/Causasian,<=35
465,QID1329,405,Not authentic whatsoever.,negative,negative,2,Not,1.0,24,White/Caucasian,Female,Very well,PASSED,r2-0019866,WY,White/Causasian,<=35
466,QID1331,406,He did a good job pulling my leg for months after I had sent him thousands of dollars.,negative,negative,2,pulling,6.0,24,White/Caucasian,Female,Very well,PASSED,r2-0019867,WY,White/Causasian,<=35
467,QID1333,407,"I just can't get over their prices -- I mean, 5 bucks for 5 blouses is unbelievable.",positive,positive,1,unbelievable.,17.0,24,White/Caucasian,Female,Very well,PASSED,r2-0019868,WY,White/Causasian,<=35
468,QID1335,408,We left the car. The smell was amazing as we got out of our car.,positive,positive,1,amazing,8.0,24,White/Caucasian,Female,Very well,PASSED,r2-0019869,WY,White/Causasian,<=35
469,QID1337,409,The bar area is too loud and obnoxious.,negative,negative,2,obnoxious.,8.0,24,White/Caucasian,Female,Very well,PASSED,r2-0019871,WY,White/Causasian,<=35
