,QID,text_id,sentence,original_label,label,label_index,rationale,rationale_index,age,ethnicity,gender,english_proficiency,attentioncheck,originaldata_id,group_id,recruitment_ethnicity,recruitment_age
233,QID905,193,"It was extremely out of my way, but if I find myself back here I plan to stop in",positive,negative,2,"extremely,out,of,my,way,,stop,in","3,4,5,6,7,18,19",28,White/Caucasian,Male,Well,PASSED,r2-0019537,WY,White/Causasian,<=35
234,QID907,194,"Check in was hard, boring seeing all the Flamingos, fish, turtles outside.",negative,negative,2,boring,5.0,28,White/Caucasian,Male,Well,PASSED,r2-0019540,WY,White/Causasian,<=35
235,QID909,195,I hate jogging but u me have a diffrent mindset toward it,negative,negative,2,hate,2.0,28,White/Caucasian,Male,Well,PASSED,r2-0019542,WY,White/Causasian,<=35
236,QID911,196,Be prepared for ringing ears after you leave. This place sucks.,negative,negative,2,"ringing,ears,This,place,sucks.","4,5,9,10,11",28,White/Caucasian,Male,Well,PASSED,r2-0019543,WY,White/Causasian,<=35
237,QID913,197,I don't feel overly full and like I have ingested a ton of grease so that is why I am giving 4 stars. We loved it.,positive,positive,1,"overly,full,like,ton,4,stars.,loved","4,5,7,12,22,23,25",28,White/Caucasian,Male,Well,PASSED,r2-0019544,WY,White/Causasian,<=35
238,QID915,198,i dont trust sites with less reviews,negative,negative,2,"dont,trust,less,reviews","2,3,6,7",28,White/Caucasian,Male,Well,PASSED,r2-0019545,WY,White/Causasian,<=35
239,QID917,199,Menu is a disaster.,negative,negative,2,disaster.,4.0,28,White/Caucasian,Male,Well,PASSED,r2-0019546,WY,White/Causasian,<=35
240,QID919,200,"We finally made it there for lunch; it's impossible to get a table, and for good reason!",positive,positive,1,"for,good,reason!","15,16,17",20,White/Caucasian,Male,Well,PASSED,r2-0019547,WY,White/Causasian,<=35
241,QID921,201,I wish I knew how to make the recipes for the salad and spicy peanut dressing and dessert selection.,positive,no sentiment,3,"I,wish,I,knew","1,2,3,4",20,White/Caucasian,Male,Well,PASSED,r2-0019548,WY,White/Causasian,<=35
242,QID923,202,The place is very good that I want to tell the staff on how great they are.,positive,positive,1,"is,very,good,how,great,they,are.","3,4,5,14,15,16,17",20,White/Caucasian,Male,Well,PASSED,r2-0019549,WY,White/Causasian,<=35
243,QID925,203,The quality was food was terrible,negative,negative,2,terrible,6.0,20,White/Caucasian,Male,Well,PASSED,r2-0019550,WY,White/Causasian,<=35
244,QID927,204,It was excellent and huge portions I had forgotten I had spent the night on the toilet.,positive,positive,1,"excellent,huge,portions","3,5,6",20,White/Caucasian,Male,Well,PASSED,r2-0019551,WY,White/Causasian,<=35
245,QID929,205,"Two other tables were sat before we were sat, we came in first.",negative,negative,2,"were,sat,before,we,we,came,in,first.","4,5,6,7,10,11,12,13",20,White/Caucasian,Male,Well,PASSED,r2-0019552,WY,White/Causasian,<=35
246,QID931,206,It is a great restaurant place to eat outside if you love flies and bees in your face.,negative,negative,2,"flies,and,bees,in,your,face.","13,14,15,16,17,18",20,White/Caucasian,Male,Well,PASSED,r2-0019553,WY,White/Causasian,<=35
247,QID933,207,My friend and I were looking for something to eat after a movie late at night and we wanted something cheap. It was fun.,positive,positive,1,"It,was,fun.","22,23,24",20,White/Caucasian,Male,Well,PASSED,r2-0019554,WY,White/Causasian,<=35
248,QID935,208,I can't go in without buying something with my limited allowance.,positive,negative,2,"can't,go,in,without,buying,limited,allowance.","2,3,4,5,6,10,11",20,White/Caucasian,Male,Well,PASSED,r2-0019556,WY,White/Causasian,<=35
249,QID937,209,This is my hubby and my favorite restaurant. loved it,positive,positive,1,"my,favorite,loved,it","6,7,9,10",20,White/Caucasian,Male,Well,PASSED,r2-0019557,WY,White/Causasian,<=35
250,QID939,210,Could be a Good place to chill with friends and the karaoke might not be as horrible as you would expect.,positive,positive,1,Good,4.0,23,White/Caucasian,Female,Very well,PASSED,r2-0019558,WY,White/Causasian,<=35
251,QID941,211,I've been to this location several times and I find the service particularly bad. terrible,negative,negative,2,bad.,14.0,23,White/Caucasian,Female,Very well,PASSED,r2-0019559,WY,White/Causasian,<=35
252,QID943,212,You can get the food cheaper because they do take coupons. what is on your mind,positive,positive,1,coupons.,11.0,23,White/Caucasian,Female,Very well,PASSED,r2-0019561,WY,White/Causasian,<=35
253,QID945,213,I was expecting a cold hard casserole and I wasn't disappointed,negative,positive,1,wasn't,10.0,23,White/Caucasian,Female,Very well,PASSED,r2-0019566,WY,White/Causasian,<=35
254,QID947,214,The waiters handled the stress very well.,positive,positive,1,stress,5.0,23,White/Caucasian,Female,Very well,PASSED,r2-0019567,WY,White/Causasian,<=35
255,QID949,215,I understand being busy...good job,positive,positive,1,understand,2.0,23,White/Caucasian,Female,Very well,PASSED,r2-0019568,WY,White/Causasian,<=35
256,QID951,216,Good for dipping.,positive,no sentiment,3,dipping.,3.0,23,White/Caucasian,Female,Very well,PASSED,r2-0019569,WY,White/Causasian,<=35
257,QID953,217,For a place this fast to be 10 whole minutes of waiting? Unbelievable.,negative,no sentiment,3,Unbelievable.,13.0,23,White/Caucasian,Female,Very well,PASSED,r2-0019572,WY,White/Causasian,<=35
258,QID955,218,"So I usually love noodles, and I loved the idea of this dish, my mouth watered thinking about it, but once it came I could not even make myself take a couple bites.",negative,negative,2,not,26.0,23,White/Caucasian,Female,Very well,PASSED,r2-0019573,WY,White/Causasian,<=35
259,QID957,219,There is no reason for me to come back except for the chips and salsa.,negative,positive,1,chips,13.0,23,White/Caucasian,Female,Very well,PASSED,r2-0019575,WY,White/Causasian,<=35
260,QID959,220,"I highly recommend the French Dip, Fried Zucchini, Steak Burger and pretty much everything on the menu if you want inedible food.",negative,negative,2,inedible,21.0,22,White/Caucasian,Female,Very well,PASSED,r2-0019576,WY,White/Causasian,<=35
261,QID961,221,"At best, maybe 1-2 ounces of beef.",negative,negative,2,"At,best,","1,2",22,White/Caucasian,Female,Very well,PASSED,r2-0019577,WY,White/Causasian,<=35
262,QID963,222,I highly recommend this place to everyone who wants their waiter to ignore them.,negative,negative,2,ignore,13.0,22,White/Caucasian,Female,Very well,PASSED,r2-0019579,WY,White/Causasian,<=35
263,QID965,223,You would not have to twist my arm to make me come here again.,positive,positive,1,"would,not,have,to,twist,my,arm","2,3,4,5,6,7,8",22,White/Caucasian,Female,Very well,PASSED,r2-0019580,WY,White/Causasian,<=35
264,QID967,224,I like this stuff.,positive,positive,1,like,2.0,22,White/Caucasian,Female,Very well,PASSED,r2-0019582,WY,White/Causasian,<=35
265,QID969,225,"Tried a new place. Came here during the week, no wait at all.",positive,no sentiment,3,"Tried,a,new,place.","1,2,3,4",22,White/Caucasian,Female,Very well,PASSED,r2-0019583,WY,White/Causasian,<=35
266,QID971,226,"We will not be going back to the Hilton since it's way too far from the strip, what a shame.",negative,negative,2,"will,not,be,going,back,way,too,far,what,a,shame.","2,3,4,5,6,12,13,14,18,19,20",22,White/Caucasian,Female,Very well,PASSED,r2-0019584,WY,White/Causasian,<=35
267,QID973,227,I waited ... waited ... waited for a sales person to help me.,negative,negative,2,"waited,waited,waited","2,4,6",22,White/Caucasian,Female,Very well,PASSED,r2-0019585,WY,White/Causasian,<=35
268,QID975,228,"Not the worst sushi I have had, but I would try Sakana or something else nearby that has better service. It was the worse.",negative,negative,2,"It,was,the,worse.","21,22,23,24",22,White/Caucasian,Female,Very well,PASSED,r2-0019586,WY,White/Causasian,<=35
269,QID977,229,Needed some watches adjusted. I love this place.,positive,positive,1,love,6.0,22,White/Caucasian,Female,Very well,PASSED,r2-0019588,WY,White/Causasian,<=35
270,QID979,230,"My coworkers and I decided, though, that they probably just serve whatever they can pick up on the street.",negative,no sentiment,3,"they,probably,just","8,9,10",22,White/Caucasian,Female,Well,PASSED,r2-0019589,WY,White/Causasian,<=35
271,QID981,231,"The lady at the register didn't have a care in the world, and did a good job of making that clear to us.",negative,negative,2,"didn't,have,a,care,in,the,world,","6,7,8,9,10,11,12",22,White/Caucasian,Female,Well,PASSED,r2-0019595,WY,White/Causasian,<=35
272,QID983,232,We waited for over a half an hour for our reservation. It sucked.,negative,negative,2,"It,sucked.","12,13",22,White/Caucasian,Female,Well,PASSED,r2-0019598,WY,White/Causasian,<=35
273,QID985,233,"While the store does look huge on the outside, it doesn't really feel that spacious inside. It was disappointing.",negative,negative,2,"It,was,disappointing.","17,18,19",22,White/Caucasian,Female,Well,PASSED,r2-0019599,WY,White/Causasian,<=35
274,QID987,234,The sandwich was the best I ever had.,positive,positive,1,"the,best,I,ever,had.","4,5,6,7,8",22,White/Caucasian,Female,Well,PASSED,r2-0019601,WY,White/Causasian,<=35
275,QID989,235,The technology is very advanced.,positive,no sentiment,3,"is,very,advanced.","3,4,5",22,White/Caucasian,Female,Well,PASSED,r2-0019603,WY,White/Causasian,<=35
276,QID991,236,Shoved the lower tier members aside.,negative,no sentiment,3,"Shoved,aside.","1,6",22,White/Caucasian,Female,Well,PASSED,r2-0019606,WY,White/Causasian,<=35
277,QID993,237,"This is an older hotel that I think celebrities or young executives won't even think of staying here. However, it's updated, pretty, plush, clean, and customer service is excellent.",positive,positive,1,"updated,,pretty,,plush,,clean,,customer,service,is,excellent.","21,22,23,24,26,27,28,29",22,White/Caucasian,Female,Well,PASSED,r2-0019607,WY,White/Causasian,<=35
278,QID995,238,So they get three stars because of poor service practice.They are the worst place.  I hate them.,negative,negative,2,"poor,service,practice.They,are,the,worst,place.,hate,them.","8,9,10,11,12,13,14,16,17",22,White/Caucasian,Female,Well,PASSED,r2-0019610,WY,White/Causasian,<=35
279,QID997,239,The AYCE model is so good that it was about as successful as the Challenger flight.,negative,positive,1,"is,so,good","4,5,6",22,White/Caucasian,Female,Well,PASSED,r2-0019612,WY,White/Causasian,<=35
280,QID999,240,"Loyal customers, good customers, are treated with abandon here!",negative,negative,2,"treated,with,abandon,here!","6,7,8,9",23,White/Caucasian,Male,Well,PASSED,r2-0019613,WY,White/Causasian,<=35
281,QID1001,241,My girlfriend and I could not believe that this tiny place lived up to the hype.,positive,positive,1,"this,tiny,place,lived,up,to,the,hype.","9,10,11,12,13,14,15,16",23,White/Caucasian,Male,Well,PASSED,r2-0019614,WY,White/Causasian,<=35
282,QID1003,242,Jumbalaya was so gross.,negative,negative,2,gross.,4.0,23,White/Caucasian,Male,Well,PASSED,r2-0019616,WY,White/Causasian,<=35
283,QID1005,243,It should have been all sticky rice. nice option,positive,positive,1,"nice,option","8,9",23,White/Caucasian,Male,Well,PASSED,r2-0019617,WY,White/Causasian,<=35
284,QID1007,244,As for the service I found the staff to do their job appropriately and they were sociable as well.,positive,positive,1,"appropriately,and,sociable","13,14,17",23,White/Caucasian,Male,Well,PASSED,r2-0019618,WY,White/Causasian,<=35
285,QID1009,245,"Lunch specials of chicken, rice and a drink range from $4-$8. It was so good.",positive,positive,1,"It,was,so,good.","12,13,14,15",23,White/Caucasian,Male,Well,PASSED,r2-0019619,WY,White/Causasian,<=35
286,QID1011,246,"Needless to say, we will accept the hit to our wallets and return!",positive,positive,1,return!,13.0,23,White/Caucasian,Male,Well,PASSED,r2-0019620,WY,White/Causasian,<=35
287,QID1013,247,I had ordered some kind of salad and received some kind of casserole.,negative,no sentiment,3,"some,kind,of,casserole.","10,11,12,13",23,White/Caucasian,Male,Well,PASSED,r2-0019621,WY,White/Causasian,<=35
288,QID1015,248,They say you can order as much as you want you just hate to eat it!,negative,negative,2,"just,hate,to,eat,it!","12,13,14,15,16",23,White/Caucasian,Male,Well,PASSED,r2-0019622,WY,White/Causasian,<=35
289,QID1017,249,Found the place to be in this local restaurant wasteland.,negative,no sentiment,3,"this,local,restaurant,wasteland.","7,8,9,10",23,White/Caucasian,Male,Well,PASSED,r2-0019623,WY,White/Causasian,<=35
290,QID1019,250,I have ordered a tasty meal and received it after 15 minutes.,positive,positive,1,"tasty,meal","5,6",20,White/Caucasian,Male,Well,PASSED,r2-0019624,WY,White/Causasian,<=35
291,QID1021,251,The roasted beef was not soggy but it was delecious with plenty topings.,positive,positive,1,"it,was,delecious,with,plenty,topings.","8,9,10,11,12,13",20,White/Caucasian,Male,Well,PASSED,r2-0019626,WY,White/Causasian,<=35
292,QID1023,252,Got to wait nearly 30 minutes after calling to change rooms,negative,negative,2,"nearly,30,minutes","4,5,6",20,White/Caucasian,Male,Well,PASSED,r2-0019627,WY,White/Causasian,<=35
293,QID1025,253,I plan to return.,positive,no sentiment,3,"I,plan,to,return.","1,2,3,4",20,White/Caucasian,Male,Well,PASSED,r2-0019628,WY,White/Causasian,<=35
294,QID1027,254,"No prime rib carving station, but instead a pre-carved pork loin slices. I was happy.",positive,positive,1,"I,was,happy.","13,14,15",20,White/Caucasian,Male,Well,PASSED,r2-0019629,WY,White/Causasian,<=35
295,QID1029,255,very clear,positive,positive,1,"very,clear","1,2",20,White/Caucasian,Male,Well,PASSED,r2-0019630,WY,White/Causasian,<=35
296,QID1031,256,Sorry - you won't be gifted with the sight of hair from previous guests in the sink at this B&B.,positive,positive,1,"you,won't,be,gifted,with,the,sight,of,hair,from,previous,guests,in,the,sink","3,4,5,6,7,8,9,10,11,12,13,14,15,16,17",20,White/Caucasian,Male,Well,PASSED,r2-0019631,WY,White/Causasian,<=35
297,QID1033,257,"So I made an appointment for the next Monday and raced like a jet to Zumba, but the place was very bad and unattractive.",negative,negative,2,"but,the,place,was,very,bad,and,unattractive.","17,18,19,20,21,22,23,24",20,White/Caucasian,Male,Well,PASSED,r2-0019632,WY,White/Causasian,<=35
298,QID1035,258,"Out of all the delicious flavors that they could create, this flavor never fails to leave me questioning my love for ice cream.",negative,negative,2,"this,flavor,never,fails,to,leave,me,questioning","11,12,13,14,15,16,17,18",20,White/Caucasian,Male,Well,PASSED,r2-0019634,WY,White/Causasian,<=35
299,QID1037,259,"The luggage cart took someone's bags to the plane, however that plane was going to a different location.",negative,negative,2,"however,that,plane,was,going,to,a,different,location.","10,11,12,13,14,15,16,17,18",20,White/Caucasian,Male,Well,PASSED,r2-0019635,WY,White/Causasian,<=35
300,QID1039,260,The wi-fi is bad and goes in and out.,negative,negative,2,"bad,goes,in,and,out.","4,6,7,8,9",25,White/Caucasian,Male,Well,PASSED,r2-0019636,WY,White/Causasian,<=35
301,QID1041,261,One piece of the pizza seemed to fill up just a mouse while they advertised that one slice would fill up a family.,negative,negative,2,"fill,up,just,a,mouse,advertised,a,family.","8,9,10,11,12,15,22,23",25,White/Caucasian,Male,Well,PASSED,r2-0019637,WY,White/Causasian,<=35
302,QID1043,262,In-N-Out Burger is a huge letdown.,negative,negative,2,letdown.,6.0,25,White/Caucasian,Male,Well,PASSED,r2-0019639,WY,White/Causasian,<=35
303,QID1045,263,The kids liked their food. interesting,positive,positive,1,liked,3.0,25,White/Caucasian,Male,Well,PASSED,r2-0019640,WY,White/Causasian,<=35
304,QID1047,264,They treat you like you are the only and most important patient.,positive,positive,1,"only,most,important","8,10,11",25,White/Caucasian,Male,Well,PASSED,r2-0019642,WY,White/Causasian,<=35
305,QID1049,265,The worst acai bowl I have ever tasted.,negative,negative,2,worst,2.0,25,White/Caucasian,Male,Well,PASSED,r2-0019643,WY,White/Causasian,<=35
306,QID1051,266,"For some reason, they shredded the scallops. it was very odd, but they have a chef that really knows how to make interesting meals and I was surprised on how good it was.",positive,positive,1,"surprised,good","28,31",25,White/Caucasian,Male,Well,PASSED,r2-0019644,WY,White/Causasian,<=35
307,QID1053,267,We had conversations with people at night and got kicked out!,negative,negative,2,"kicked,out!","10,11",25,White/Caucasian,Male,Well,PASSED,r2-0019645,WY,White/Causasian,<=35
308,QID1055,268,"If you get the chance, come here for their Happy Hour special, all you can barf for one low price.",negative,positive,1,"come,here","6,7",25,White/Caucasian,Male,Well,PASSED,r2-0019646,WY,White/Causasian,<=35
309,QID1057,269,Chili Billy's is my go to,positive,positive,1,"go,to","5,6",25,White/Caucasian,Male,Well,PASSED,r2-0019647,WY,White/Causasian,<=35
310,QID1059,270,I could not finish it.,negative,negative,2,"could,not","2,3",21,White/Caucasian,Male,Very well,PASSED,r2-0019649,WY,White/Causasian,<=35
311,QID1061,271,"I was stunned by what passes for service there, and the selection and quality of the food left me incredulous.",negative,positive,1,"stunned,incredulous.","3,20",21,White/Caucasian,Male,Very well,PASSED,r2-0019652,WY,White/Causasian,<=35
312,QID1063,272,"Been going to Kevin, Savo and Dan for 15 years and I was treated like I did not exist.",negative,negative,2,"treated,like,I,did,not,exist.","14,15,16,17,18,19",21,White/Caucasian,Male,Very well,PASSED,r2-0019653,WY,White/Causasian,<=35
313,QID1065,273,KY failed to impress our group with its current style but won us over with the desserts.,positive,positive,1,"won,us,over","12,13,14",21,White/Caucasian,Male,Very well,PASSED,r2-0019658,WY,White/Causasian,<=35
314,QID1067,274,Waffallonia opened up a few months ago and finally checked it out. it was nice,positive,positive,1,"it,was,nice","13,14,15",21,White/Caucasian,Male,Very well,PASSED,r2-0019660,WY,White/Causasian,<=35
315,QID1069,275,She ignored our mistake.,positive,no sentiment,3,"ignored,our,mistake.","2,3,4",21,White/Caucasian,Male,Very well,PASSED,r2-0019661,WY,White/Causasian,<=35
316,QID1071,276,"I asked them not to cut my cuticles, and they went ahead and did so because they thought it would please me.",negative,positive,1,"did,so,because,they,thought,it,would,please,me.","14,15,16,17,18,19,20,21,22",21,White/Caucasian,Male,Very well,PASSED,r2-0019662,WY,White/Causasian,<=35
317,QID1073,277,"Friendly staff, both front and back office. nice place",positive,positive,1,"Friendly,staff,,nice,place","1,2,8,9",21,White/Caucasian,Male,Very well,PASSED,r2-0019665,WY,White/Causasian,<=35
318,QID1075,278,"A friend and I went on a Thursday evening  around 730/ 8 pm or so and it was a little busy, but we  have to wait at all for a table.",negative,no sentiment,3,"but,we,have,to,wait","22,23,24,25,26",21,White/Caucasian,Male,Very well,PASSED,r2-0019666,WY,White/Causasian,<=35
319,QID1077,279,"Yelp gives this place one star, but if I could change it, I would rate them ten stars.",positive,positive,1,"I,would,rate,them,ten,stars.","13,14,15,16,17,18",21,White/Caucasian,Male,Very well,PASSED,r2-0019668,WY,White/Causasian,<=35
320,QID1079,280,"All the other nearby mexican places were closed on sundays, so I just decided to give this place a shot despite the questionable yelp reviews. It was a bad place.",negative,negative,2,"shot,questionable,bad","20,23,29",22,Middle Eastern,Female,Very well,PASSED,r2-0019669,WY,White/Causasian,<=35
321,QID1079,280,"All the other nearby mexican places were closed on sundays, so I just decided to give this place a shot despite the questionable yelp reviews. It was a bad place.",negative,negative,2,"questionable,yelp,reviews.,bad,place.","23,24,25,29,30",23,White/Caucasian,Male,Well,PASSED,r2-0019669,WY,White/Causasian,<=35
322,QID1081,281,The staff here are always on point correctly,positive,positive,1,"always,on,point,correctly","5,6,7,8",23,White/Caucasian,Male,Well,PASSED,r2-0019670,WY,White/Causasian,<=35
323,QID1081,281,The staff here are always on point correctly,positive,positive,1,"point,correctly","7,8",22,Middle Eastern,Female,Very well,PASSED,r2-0019670,WY,White/Causasian,<=35
324,QID1083,282,I’m supposed to be full off of that?,negative,no sentiment,3,"supposed,that?","2,8",23,White/Caucasian,Male,Well,PASSED,r2-0019671,WY,White/Causasian,<=35
325,QID1083,282,I’m supposed to be full off of that?,negative,negative,2,that?,8,22,Middle Eastern,Female,Very well,PASSED,r2-0019671,WY,White/Causasian,<=35
326,QID1085,283,Needs major renovation inside and out. i am pissed,negative,negative,2,"i,am,pissed","7,8,9",23,White/Caucasian,Male,Well,PASSED,r2-0019672,WY,White/Causasian,<=35
327,QID1085,283,Needs major renovation inside and out. i am pissed,negative,negative,2,"major,renovation,pissed","2,3,9",22,Middle Eastern,Female,Very well,PASSED,r2-0019672,WY,White/Causasian,<=35
328,QID1087,284,You gave your competitors a new customer.,negative,negative,2,competitors,4.0,22,Middle Eastern,Female,Very well,PASSED,r2-0019674,WY,White/Causasian,<=35
329,QID1087,284,You gave your competitors a new customer.,negative,positive,1,customer.,7.0,23,White/Caucasian,Male,Well,PASSED,r2-0019674,WY,White/Causasian,<=35
330,QID1089,285,Who doesn't love free cake that tastes like cat food?,negative,negative,2,"cat,food?","9,10",22,Middle Eastern,Female,Very well,PASSED,r2-0019675,WY,White/Causasian,<=35
331,QID1089,285,Who doesn't love free cake that tastes like cat food?,negative,no sentiment,3,that,6,23,White/Caucasian,Male,Well,PASSED,r2-0019675,WY,White/Causasian,<=35
332,QID1091,286,The chef can make an old piece of tough shoe leather taste like ribeye.,positive,negative,2,"taste,like,ribeye.","12,13,14",23,White/Caucasian,Male,Well,PASSED,r2-0019676,WY,White/Causasian,<=35
333,QID1091,286,The chef can make an old piece of tough shoe leather taste like ribeye.,positive,positive,1,ribeye.,14,22,Middle Eastern,Female,Very well,PASSED,r2-0019676,WY,White/Causasian,<=35
334,QID1093,287,I got the ends that were burnt.,negative,negative,2,burnt.,7.0,22,Middle Eastern,Female,Very well,PASSED,r2-0019678,WY,White/Causasian,<=35
335,QID1093,287,I got the ends that were burnt.,negative,negative,2,burnt.,7.0,23,White/Caucasian,Male,Well,PASSED,r2-0019678,WY,White/Causasian,<=35
336,QID1095,288,The servers are always on their game.,positive,positive,1,"always,on,their,game.","4,5,6,7",23,White/Caucasian,Male,Well,PASSED,r2-0019682,WY,White/Causasian,<=35
337,QID1095,288,The servers are always on their game.,positive,positive,1,game.,7,22,Middle Eastern,Female,Very well,PASSED,r2-0019682,WY,White/Causasian,<=35
338,QID1097,289,"no, this place is not special for me",negative,no sentiment,3,"no,,not","1,5",22,Middle Eastern,Female,Very well,PASSED,r2-0019683,WY,White/Causasian,<=35
339,QID1097,289,"no, this place is not special for me",negative,no sentiment,3,"not,special","5,6",23,White/Caucasian,Male,Well,PASSED,r2-0019683,WY,White/Causasian,<=35
340,QID1099,290,(It had a pleasant kick) The bar-b-que sauce was superb.,positive,positive,1,"bar-b-que,sauce,was,superb.","7,8,9,10",31,White/Caucasian,Male,Well,PASSED,r2-0019685,WY,White/Causasian,<=35
341,QID1101,291,Online reservation days in advance is a must as walk-in patrons may get welcome another evening. It is a horrible set up.,negative,negative,2,"It,is,a,horrible,set,up.","17,18,19,20,21,22",31,White/Caucasian,Male,Well,PASSED,r2-0019687,WY,White/Causasian,<=35
342,QID1103,292,John advised his son not to enter the next street because it was banned and will be severely punished if you don't obey,negative,negative,2,"it,was,banned,and,will,be,severely,punished","12,13,14,15,16,17,18,19",31,White/Caucasian,Male,Well,PASSED,r2-0019688,WY,White/Causasian,<=35
343,QID1105,293,"Now i regret the decision of going here very much, since I am addicted to the great food.",positive,negative,2,"i,regret,the,decision,very,much,","2,3,4,5,9,10",31,White/Caucasian,Male,Well,PASSED,r2-0019690,WY,White/Causasian,<=35
344,QID1107,294,"The tar tar wasn't bad, even though I think they've just got a big bowl of it sitting in the fridge all night. It was horrible.",negative,negative,2,"It,was,horrible.","24,25,26",31,White/Caucasian,Male,Well,PASSED,r2-0019692,WY,White/Causasian,<=35
345,QID1109,295,"When the pitcher didn't arrive, the waitress said that it was a pitcher of Sapporo.",negative,no sentiment,3,"it,was,a,pitcher,of,Sapporo.","10,11,12,13,14,15",31,White/Caucasian,Male,Well,PASSED,r2-0019693,WY,White/Causasian,<=35
346,QID1111,296,"So good tasting, but  on par with Montreal.",positive,positive,1,"So,good,tasting,","1,2,3",31,White/Caucasian,Male,Well,PASSED,r2-0019696,WY,White/Causasian,<=35
347,QID1113,297,I went back to the restaurant. I was pissed.,negative,negative,2,"I,was,pissed.","7,8,9",31,White/Caucasian,Male,Well,PASSED,r2-0019698,WY,White/Causasian,<=35
348,QID1115,298,I went to Chill because I saw the good review on happycow and was VERY impressed! highly recommend,positive,positive,1,"I,saw,the,good,review,was,VERY,impressed!,highly,recommend","6,7,8,9,10,14,15,16,17,18",31,White/Caucasian,Male,Well,PASSED,r2-0019699,WY,White/Causasian,<=35
349,QID1117,299,Everything I've tried would have been super fresh and delicious if the chef had done its job correctly.,negative,negative,2,"if,the,chef,had,done,its,job,correctly.","11,12,13,14,15,16,17,18",31,White/Caucasian,Male,Well,PASSED,r2-0019703,WY,White/Causasian,<=35
350,QID1119,300,"The portions were very, very well done for a snail",negative,negative,2,snail,10.0,21,White/Caucasian,Male,Well,PASSED,r2-0019704,WY,White/Causasian,<=35
351,QID1121,301,I enjoyed their rice bowl. very nice,positive,positive,1,enjoyed,2.0,21,White/Caucasian,Male,Well,PASSED,r2-0019707,WY,White/Causasian,<=35
352,QID1123,302,We only stopped here because there was no where else to go.,negative,no sentiment,3,only,2.0,21,White/Caucasian,Male,Well,PASSED,r2-0019708,WY,White/Causasian,<=35
