,QID,text_id,sentence,original_label,label,label_index,rationale,rationale_index,age,ethnicity,gender,english_proficiency,attentioncheck,originaldata_id,group_id,recruitment_ethnicity,recruitment_age,originaldata_split,rationale_binary
353,QID715,353,What does a person do when they feel dirty?,C,wash themselves,3,"What,do,dirty","[0, 4, 8]",25,Black/African American,Male,Very well,PASSED,b8937a30f25093910c040f4e63e1d352,BY,Black/African American,<=35,test,"[1, 0, 0, 0, 1, 0, 0, 0, 1]"
354,QID717,354,"Bob stands in the grass surrounded by trees and nature, where is Bob?",C,state park,3,"grass,surrounded,trees","[4, 5, 7]",25,Black/African American,Male,Very well,PASSED,b9121c3228f961c5ad68958c702cd94b,BY,Black/African American,<=35,test,"[0, 0, 0, 0, 1, 1, 0, 1, 0, 0, 0, 0, 0]"
355,QID719,355,Where is the large area location of the empire state building?,E,office,2,"area,location","[4, 5]",25,Black/African American,Male,Very well,PASSED,b92f786638796fc028947ac0e9a44fef,BY,Black/African American,<=35,test,"[0, 0, 0, 0, 1, 1, 0, 0, 0, 0, 0]"
356,QID721,356,What do children require to grow up healthy?,A,need care,1,"children,require,grow,healthy","[2, 3, 5, 7]",25,Black/African American,Male,Very well,PASSED,b94a9764acff078b52a9cbae04661dc9,BY,Black/African American,<=35,test,"[0, 0, 1, 1, 0, 1, 0, 1]"
357,QID723,357,"The business man was promoted recently, to celebrate he went where to buy an expensive wristwatch?",B,jewelry store,2,"promoted,celebrate,expensive","[4, 7, 14]",25,Black/African American,Male,Very well,PASSED,b9bed83138901f4a45041b02c5b242c1,BY,Black/African American,<=35,test,"[0, 0, 0, 0, 1, 0, 0, 1, 0, 0, 0, 0, 0, 0, 1, 0]"
358,QID725,358,"The vet found malignant tumors on the animals, what is their likely fate?",C,feel pain,4,"vet,tumors","[1, 4]",25,Black/African American,Male,Very well,PASSED,ba3a2b9ff289c106051163f840a6f5ba,BY,Black/African American,<=35,test,"[0, 1, 0, 0, 1, 0, 0, 0, 0, 0, 0, 0, 0]"
359,QID727,359,"They needed grape juice for their party, they went to buy it and other snacks at the what?",E,food store,5,"grape,juice,party,snacks","[2, 3, 6, 14]",25,Black/African American,Male,Very well,PASSED,ba9132ebf2bc3ad21e6a0631dc4e0a77,BY,Black/African American,<=35,test,"[0, 0, 1, 1, 0, 0, 1, 0, 0, 0, 0, 0, 0, 0, 1, 0, 0, 0]"
360,QID729,360,If you spend all your time buying and not saving what is is likely to happen?,E,go broke,5,"spend,all,your,time,buying,not,saving,what,is,likely,to,happen","[2, 3, 4, 5, 6, 8, 9, 10, 11, 13, 14, 15]",20,African,Female,Very well,PASSED,ba9a05bd2086c0d37733e26479d6630f,BY,Black/African American,<=35,test,"[0, 0, 1, 1, 1, 1, 1, 0, 1, 1, 1, 1, 0, 1, 1, 1]"
361,QID731,361,"If somebody buys something and gives it to me as a free gift, what is the cost status of the gift?",C,paid for,3,"somebody,buys,something,gives,it,to,me,as,a,free,gift,cost,status,the,gift","[1, 2, 3, 5, 6, 7, 8, 9, 10, 11, 12, 16, 17, 19, 20]",20,African,Female,Very well,PASSED,bb503ece4eac41dfe608a1dcb654e6bf,BY,Black/African American,<=35,test,"[0, 1, 1, 1, 0, 1, 1, 1, 1, 1, 1, 1, 1, 0, 0, 0, 1, 1, 0, 1, 1]"
362,QID733,362,What kind of tale might feature a talking weasel?,E,animated film,2,"kind,of,tale,feature,talking,weasel","[1, 2, 3, 5, 7, 8]",20,African,Female,Very well,PASSED,bc08c354e5bead6863ea4a29cb8fa359,BY,Black/African American,<=35,test,"[0, 1, 1, 1, 0, 1, 0, 1, 1]"
363,QID735,363,"I want to use string to keep something from moving, how should I do it?",A,tie around,1,"want,use,string,keep,something,from,moving,do,it,?","[1, 3, 4, 6, 7, 8, 9, 13, 14]",20,African,Female,Very well,PASSED,bc268cd19e2c95c78967fd6b9092fb90,BY,Black/African American,<=35,test,"[0, 1, 0, 1, 1, 0, 1, 1, 1, 1, 0, 0, 0, 1, 1]"
364,QID737,364,"The player lifted his cornet and walked in rhythm, what was the player a member of?",C,band,5,"player,lifted,cornet,rhythm,member,of,?","[1, 2, 4, 8, 14, 15]",20,African,Female,Very well,PASSED,bcc5dd6292a64d8fa17cd07c360b335d,BY,Black/African American,<=35,test,"[0, 1, 1, 0, 1, 0, 0, 0, 1, 0, 0, 0, 0, 0, 1, 1]"
365,QID739,365,"Joe was there to meet a large number of people. As he filed though the entrance hall, he saw many strangers who came from far away. What sort of building is he probably in?",C,large building,5,"meet,large,number,people,filed,though,hall,saw,many,strangers,far,away,building","[4, 6, 7, 9, 12, 13, 16, 18, 19, 20, 24, 25, 29]",20,African,Female,Very well,PASSED,bd780fea2d4dd262583446e64c0f314d,BY,Black/African American,<=35,test,"[0, 0, 0, 0, 1, 0, 1, 1, 0, 1, 0, 0, 1, 1, 0, 0, 1, 0, 1, 1, 1, 0, 0, 0, 1, 1, 0, 0, 0, 1, 0, 0, 0, 0]"
366,QID741,366,Miss Grady took a stick from Bob because he was playing with it during class. She wanted to make sure that he couldn't get to it so she put it where?,A,desk drawer,1,"Miss,stick,Bob,during,class,make,sure,could,n't","[0, 4, 6, 13, 14, 18, 19, 22]",20,African,Female,Very well,PASSED,bdf92566f14599f1606109677206001f,BY,Black/African American,<=35,test,"[1, 0, 0, 0, 1, 0, 1, 0, 0, 0, 0, 0, 0, 1, 1, 0, 0, 0, 1, 1, 0, 0, 1, 0, 0, 0, 0, 0, 0, 0, 0]"
367,QID743,367,Where can you buy a replacement ax handle?,B,hardware store,2,"Where,buy,replacement,ax,handle","[0, 3, 5, 6, 7]",20,African,Female,Very well,PASSED,be2cb9c96069ac355a7ccef262743d14,BY,Black/African American,<=35,test,"[1, 0, 0, 1, 0, 1, 1, 1]"
368,QID745,368,What animal is known for being a follower?,A,goat,1,"animal,known,follower","[1, 3, 7]",20,African,Female,Very well,PASSED,be737cd4db844574ef594442ce6c9453,BY,Black/African American,<=35,test,"[0, 1, 0, 1, 0, 0, 0, 1]"
369,QID747,369,What is part of a republic like the USA?,A,democracy,4,"part,of,republic,like,USA","[2, 3, 5, 6, 8]",20,African,Female,Very well,PASSED,bea07406aaadeef50110883b6932d86a,BY,Black/African American,<=35,test,"[0, 0, 1, 1, 0, 1, 1, 0, 1]"
370,QID749,370,"He was a sloppy eater, so where did he leave a mess?",D,table,4,"sloppy,eater,where,did,he,leave,a,mess,?","[3, 4, 6, 7, 8, 9, 10, 11]",24,African,Female,Very well,PASSED,c02a3c2d4f726b9e1be99533a24a6ab4,BY,Black/African American,<=35,test,"[0, 0, 0, 1, 1, 0, 1, 1, 1, 1, 1, 1]"
371,QID751,371,"Something had the nerve to break into the garbage last night, what did it?",B,animal,2,"Something,the,nerve,break,into,the,garbage,last,night","[0, 2, 3, 5, 6, 7, 8, 9, 10]",24,African,Female,Very well,PASSED,c036ce033bc429ac1aba0a6ac8d057e1,BY,Black/African American,<=35,test,"[1, 0, 1, 1, 0, 1, 1, 1, 1, 1, 1, 0, 0, 0]"
372,QID753,372,"The man took paperwork to other people to consult over it, where was he heading?",B,meeting,2,"man,took,paperwork,to,other,people,to,consult,over,it,where,was,he,heading,?","[1, 2, 3, 4, 5, 6, 7, 8, 9, 10, 11, 12, 13, 14]",24,African,Female,Very well,PASSED,c0d75f9fbf30aa3a612f16edb20d6b8d,BY,Black/African American,<=35,test,"[0, 1, 1, 1, 1, 1, 1, 1, 1, 1, 1, 1, 1, 1, 1]"
373,QID755,373,When someone has little knowledge and is judging someone they are considered what?,D,ignorance,4,"little,knowledge,and,is,judging,someone,they,are,considered,what","[3, 4, 5, 6, 7, 8, 9, 10, 11, 12]",24,African,Female,Very well,PASSED,c1aebf059c5102f4e773f7fe4afe13f0,BY,Black/African American,<=35,test,"[0, 0, 0, 1, 1, 1, 1, 1, 1, 1, 1, 1, 1]"
374,QID757,374,"For some reason she was devoid of regular emotions, buying products was the only way she could feel what?",A,pleasure,1,"she,was,devoid,of,regular,emotions,the,only,way,she,could,feel,what,?","[3, 4, 5, 6, 7, 8, 12, 13, 14, 15, 16, 17, 18]",24,African,Female,Very well,PASSED,c22f30eee57f7191ee07e9a916460f68,BY,Black/African American,<=35,test,"[0, 0, 0, 1, 1, 1, 1, 1, 1, 0, 0, 0, 1, 1, 1, 1, 1, 1, 1]"
375,QID759,375,Where is a salt shaker most often kept?,B,kitchen cupboard,3,"most,often,kept,?","[5, 6, 7]",24,African,Female,Very well,PASSED,c2a8c6814ed3e207771cfc23b3b42cf1,BY,Black/African American,<=35,test,"[0, 0, 0, 0, 0, 1, 1, 1]"
376,QID761,376,What is a place that is far away from your house and where you could consume beer?,B,friend 's house,2,"far,away,from,your,house,could,consume,beer,?","[6, 7, 8, 9, 10, 14, 15, 16]",24,African,Female,Very well,PASSED,c2c2a387fd9a6a26cff636008de21f71,BY,Black/African American,<=35,test,"[0, 0, 0, 0, 0, 0, 1, 1, 1, 1, 1, 0, 0, 0, 1, 1, 1]"
377,QID763,377,Killing people should not cause what emotion?,C,joy,3,not,[3],24,African,Female,Very well,PASSED,c35f7de9e9005fcf654cb0b23f17acd6,BY,Black/African American,<=35,test,"[0, 0, 0, 1, 0, 0, 0]"
378,QID765,378,What do people do for food?,D,kill animals,4,"do,for,food","[3, 4, 5]",24,African,Female,Very well,PASSED,c3890d43b84635d9e61c007ca2521d5b,BY,Black/African American,<=35,test,"[0, 0, 0, 1, 1, 1]"
379,QID767,379,To what do trees roots cling?,E,surface of earth,5,cling,[5],24,African,Female,Very well,PASSED,c39131d979c9205c11d0e109e18188e4,BY,Black/African American,<=35,test,"[0, 0, 0, 0, 0, 1]"
380,QID769,380,"When you fail to finish something, you failed at doing what to it",C,completing,3,"fail,to,finish,something","[2, 3, 4, 5]",22,Black/African American,Female,Very well,PASSED,c492b8b9754a181c924c1df19998cbc7,BY,Black/African American,<=35,test,"[0, 0, 1, 1, 1, 1, 0, 0, 0, 0, 0, 0, 0]"
381,QID771,381,Where might someone store a reusable shopping bag?,E,closet,5,"store,reusable,shopping,bag","[3, 5, 6, 7]",22,Black/African American,Female,Very well,PASSED,c509c499bace6de324b39c0d4d0c30fa,BY,Black/African American,<=35,test,"[0, 0, 0, 1, 0, 1, 1, 1]"
382,QID773,382,"The man working in the attic swatted away a bee, but soon the single bee was an entire what?",A,swarm,1,"swatted,away,bee,but,soon,entire","[6, 7, 9, 10, 11, 17]",22,Black/African American,Female,Very well,PASSED,c54ddc0f9d170ba65d9f4f2e0bb41d1c,BY,Black/African American,<=35,test,"[0, 0, 0, 0, 0, 0, 1, 1, 0, 1, 1, 1, 0, 0, 0, 0, 0, 1, 0]"
383,QID775,383,Why do people read non fiction?,C,learn new things,3,"Why,read,non,fiction","[0, 3, 4, 5]",22,Black/African American,Female,Very well,PASSED,c57ed32566a2db1ec3d6e4fd595b9d05,BY,Black/African American,<=35,test,"[1, 0, 0, 1, 1, 1]"
384,QID777,384,Noble citizen of the Roman empire believed those born with lower status were what to them?,D,peasant,3,"Noble,citizen,Roman,empire,believed,born,lower,status","[0, 1, 4, 5, 6, 8, 10, 11]",22,Black/African American,Female,Very well,PASSED,c640116ca6905d5256edadb616b3f76e,BY,Black/African American,<=35,test,"[1, 1, 0, 0, 1, 1, 1, 0, 1, 0, 1, 1, 0, 0, 0, 0]"
385,QID779,385,"Some people got escorted out of the library, they were probably what?",B,talking loudly,2,"people,escorted,out,library","[1, 3, 4, 7]",22,Black/African American,Female,Very well,PASSED,c6f10fd07348bf2cf5488b0d9f38d806,BY,Black/African American,<=35,test,"[0, 1, 0, 1, 1, 0, 0, 1, 0, 0, 0, 0]"
386,QID781,386,Dan fell off a bar stool. He did this because he was what than ever before?,B,drunker,2,"fell,off,bar,stool","[1, 2, 4, 5]",22,Black/African American,Female,Very well,PASSED,c7526b682e64f355384631b35cd78fc9,BY,Black/African American,<=35,test,"[0, 1, 1, 0, 1, 1, 0, 0, 0, 0, 0, 0, 0, 0, 0, 0]"
387,QID783,387,What is a treat that you dog will enjoy?,D,bone,4,"a,treat,dog,enjoy","[2, 3, 6, 8]",22,Black/African American,Female,Very well,PASSED,c82ed0c2a2e115452b4d596c5faafbcf,BY,Black/African American,<=35,test,"[0, 0, 1, 1, 0, 0, 1, 0, 1]"
388,QID785,388,"If while driving to work another car makes a careless maneuver, what emotion might you feel?",E,road rage,5,"driving,another,car,careless,maneuver,emotion","[2, 5, 6, 9, 10, 12]",22,Black/African American,Female,Very well,PASSED,c908d7c4633c5e6add9463bdd47cb27e,BY,Black/African American,<=35,test,"[0, 0, 1, 0, 0, 1, 1, 0, 0, 1, 1, 0, 1, 0, 0, 0]"
389,QID787,389,Blowfish require what specific thing to live?,A,body of water,4,"Blowfish,require,what,to,live","[0, 1, 2, 5, 6]",22,Black/African American,Female,Very well,PASSED,c961578f4c5768b67b843e5d2ce18452,BY,Black/African American,<=35,test,"[1, 1, 1, 0, 0, 1, 1]"
390,QID789,390,What might someone do after they finish creating art?,B,relax,2,"after,they,finish,creating","[4, 5, 6, 7]",35,Black/African American,Female,Very well,PASSED,cb5b39878be0e05a3ffe783801adbc3b,BY,Black/African American,<=35,test,"[0, 0, 0, 0, 1, 1, 1, 1, 0]"
391,QID791,391,"He was at the gym trying to build muscle, what is it called that he is trying to build muscle on?",E,human body,5,"trying,to,build,muscle","[5, 6, 7, 8]",35,Black/African American,Female,Very well,PASSED,cb6766fb25daee911fc8e9816b98938c,BY,Black/African American,<=35,test,"[0, 0, 0, 0, 0, 1, 1, 1, 1, 0, 0, 0, 0, 0, 0, 0, 0, 0, 0, 0, 0]"
392,QID793,392,"The hostess was good at her job, she always had a smile when she would what?",C,welcome guests,3,"always,had,a,smile,when","[8, 9, 10, 11, 12]",35,Black/African American,Female,Very well,PASSED,cbf3dd48b4d591fc872a53cd4b9dd3af,BY,Black/African American,<=35,test,"[0, 0, 0, 0, 0, 0, 0, 0, 1, 1, 1, 1, 1, 0, 0, 0]"
393,QID795,393,"The man often made smart remarks, like that any restaurant is a mexican restaurant where?",E,city,1,"often,made,smart,remarks","[2, 3, 4, 5]",35,Black/African American,Female,Very well,PASSED,cc8eac9956f645533b8d7b99702e3507,BY,Black/African American,<=35,test,"[0, 0, 1, 1, 1, 1, 0, 0, 0, 0, 0, 0, 0, 0, 0]"
394,QID797,394,How might releasing energy that has built up feel?,B,wonderful,2,"How,might,releasing,energy","[0, 1, 2, 3]",35,Black/African American,Female,Very well,PASSED,cce13a32fedb997c017d3fac87c34912,BY,Black/African American,<=35,test,"[1, 1, 1, 1, 0, 0, 0, 0, 0]"
395,QID799,395,The place where my linen closet is really needs repainting a light color as it only has one overhead light.,D,house,1,"The,place,where,my,linen","[0, 1, 2, 3, 4]",35,Black/African American,Female,Very well,PASSED,cd39e442204d3edf7acc185fd59c8a44,BY,Black/African American,<=35,test,"[1, 1, 1, 1, 1, 0, 0, 0, 0, 0, 0, 0, 0, 0, 0, 0, 0, 0, 0, 0]"
396,QID801,396,What very cold area in the east can a crab be found?,C,shallow waters,2,"What,area,in,the","[0, 3, 4, 5]",35,Black/African American,Female,Very well,PASSED,cdd3d074031fbd3efeb4f9408abef04e,BY,Black/African American,<=35,test,"[1, 0, 0, 1, 1, 1, 0, 0, 0, 0, 0, 0]"
397,QID803,397,"His house was a mess, he began doing housework to get what?",E,house clean,5,"His,house,was,a,mess","[0, 1, 2, 3, 4]",35,Black/African American,Female,Very well,PASSED,ce246bc94a54431b9c0530e71d2456b5,BY,Black/African American,<=35,test,"[1, 1, 1, 1, 1, 0, 0, 0, 0, 0, 0, 0]"
398,QID805,398,Loss of someone you love can cause what kind of feeling in your heart?,A,painful,1,"Loss,someone,you,love","[0, 2, 3, 4]",35,Black/African American,Female,Very well,PASSED,ce2fd94212243f843b3f357046051f57,BY,Black/African American,<=35,test,"[1, 0, 1, 1, 1, 0, 0, 0, 0, 0, 0, 0, 0, 0]"
399,QID807,399,"Joe is a squirrel, which is an animal. He probably lives in what sort of place.",C,pet store,1,"a,squirrel","[2, 3]",35,Black/African American,Female,Very well,PASSED,cebc07bd5080cc72862cb333b10d782d,BY,Black/African American,<=35,test,"[0, 0, 1, 1, 0, 0, 0, 0, 0, 0, 0, 0, 0, 0, 0, 0]"
400,QID809,400,She wanted a kitten and puppy so why did she only get the puppy?,A,one choice for pet,1,"She,wanted,a,kitten,and,puppy","[0, 1, 2, 3, 4, 5]",35,Black/African American,Female,Very well,PASSED,cf02cca40a47c2deefd8b2e5a5ff2f70,BY,Black/African American,<=35,test,"[1, 1, 1, 1, 1, 1, 0, 0, 0, 0, 0, 0, 0, 0]"
401,QID811,401,What would be happening if you are pretending to be a police officer?,C,deception,3,"if,you,are,pretending,to,be,a,police,officer","[4, 5, 6, 7, 8, 9, 10, 11, 12]",35,Black/African American,Female,Very well,PASSED,cf33e0f5891ce53a716432be06a46ee1,BY,Black/African American,<=35,test,"[0, 0, 0, 0, 1, 1, 1, 1, 1, 1, 1, 1, 1]"
402,QID813,402,What happens at soon as a living being is born?,B,start reproduction,5,"living,being,is,born","[6, 7, 8, 9]",35,Black/African American,Female,Very well,PASSED,cfc7fccb8449a2a950c9d2a50991420e,BY,Black/African American,<=35,test,"[0, 0, 0, 0, 0, 0, 1, 1, 1, 1]"
403,QID815,403,"The coach decided to make a lineup change, the team's effort was suffering from what?",B,stagnant,1,"coach,decided,to,make,a,lineup,change","[1, 2, 3, 4, 5, 6, 7]",35,Black/African American,Female,Very well,PASSED,d060ab71d0efff3cab5960089a6bb3a2,BY,Black/African American,<=35,test,"[0, 1, 1, 1, 1, 1, 1, 1, 0, 0, 0, 0, 0, 0, 0]"
404,QID817,404,Why do some people get passports and go to different locations?,C,desire to travel,3,"some,people,get,passports","[2, 3, 4, 5]",35,Black/African American,Female,Very well,PASSED,d06de16a4aaeaef32b398c1213257b4a,BY,Black/African American,<=35,test,"[0, 0, 1, 1, 1, 1, 0, 0, 0, 0, 0]"
405,QID819,405,"Computers have allowed everybody to answer questions they have quickly, but still we seem to be getting duller despite access to this what?",B,advance knowledge,2,"Computers,have,allowed,everybody,to,answer,questions","[0, 1, 2, 3, 4, 5, 6]",35,Black/African American,Female,Very well,PASSED,d0a42c8180b4e080aa071dd70fce7e03,BY,Black/African American,<=35,test,"[1, 1, 1, 1, 1, 1, 1, 0, 0, 0, 0, 0, 0, 0, 0, 0, 0, 0, 0, 0, 0, 0, 0]"
406,QID821,406,"The man was giving assistance to a pan handler in the streets, how did he give assistance?",D,out of pocket,4,"The,man,was,giving,assistance,to,a,pan,handler","[0, 1, 2, 3, 4, 5, 6, 7, 8]",35,Black/African American,Female,Very well,PASSED,d0bda97a087904320216e4d0b8a08a8d,BY,Black/African American,<=35,test,"[1, 1, 1, 1, 1, 1, 1, 1, 1, 0, 0, 0, 0, 0, 0, 0, 0]"
407,QID823,407,Where would you buy food?,B,store,2,"Where,would,you,buy,food","[0, 1, 2, 3, 4]",35,Black/African American,Female,Very well,PASSED,d1d2585e0ba1160948b7c5822a99b7a1,BY,Black/African American,<=35,test,"[1, 1, 1, 1, 1]"
408,QID825,408,"Billy hated using other people's toilets. He was only comfortable on his own. So whenever he needed to poop, he would go back to his what?",D,house,4,"Billy,hated,using,other,people,'s,toilets,He,was,only,comfortable","[0, 1, 2, 3, 4, 5, 6, 7, 8, 9]",35,Black/African American,Female,Very well,PASSED,d2871dc28c82471e5d7f71f79e49c257,BY,Black/African American,<=35,test,"[1, 1, 1, 1, 1, 1, 1, 1, 1, 1, 0, 0, 0, 0, 0, 0, 0, 0, 0, 0, 0, 0, 0, 0, 0, 0]"
409,QID827,409,What do you need to do to use television if it is already turned on?,B,plug in,4,"What,do,you,need,to,do,to,use,television","[0, 1, 2, 3, 4, 5, 6, 7, 8]",35,Black/African American,Female,Very well,PASSED,d29252ddaf7c7ef491abcce342d7bb98,BY,Black/African American,<=35,test,"[1, 1, 1, 1, 1, 1, 1, 1, 1, 0, 0, 0, 0, 0, 0]"
410,QID829,410,"He walked into the room and had a great shock, his friends had what him?",E,surprised,5,"shock,his,friends,what,him","[9, 10, 11, 13, 14]",26,African,Female,Very well,PASSED,d312741df1b14bcbe358f4f30aff3994,BY,Black/African American,<=35,test,"[0, 0, 0, 0, 0, 0, 0, 0, 0, 1, 1, 1, 0, 1, 1]"
411,QID831,411,What is a wet person likely to do?,C,catch cold,3,"wet,person,likely,do","[3, 4, 5, 7]",26,African,Female,Very well,PASSED,d31ee38f67d1173275e120b8ad36039c,BY,Black/African American,<=35,test,"[0, 0, 0, 1, 1, 1, 0, 1]"
412,QID833,412,Where is a bird likely to make it's home?,A,nest,2,"bird,likely,make,it,'s,home","[3, 4, 6, 7, 8]",26,African,Female,Very well,PASSED,d3b145911a76fd6fbe9a23ab027be024,BY,Black/African American,<=35,test,"[0, 0, 0, 1, 1, 0, 1, 1, 1]"
413,QID835,413,"The pitcher stepped on the mound ready to throw, where was he located specifically?",E,golf course,3,"pitcher,mound,throw,located,specifically","[1, 5, 8, 12, 13]",26,African,Female,Very well,PASSED,d47986deb91d64b2b15d385da3d2f483,BY,Black/African American,<=35,test,"[0, 1, 0, 0, 0, 1, 0, 0, 1, 0, 0, 0, 1, 1]"
414,QID837,414,What is a prisoner sentenced to do?,E,do time,5,"prisoner,sentenced,to,do","[3, 4, 5, 6]",26,African,Female,Very well,PASSED,d6900a01a9dd6627b4bb22b0f6d191a5,BY,Black/African American,<=35,test,"[0, 0, 0, 1, 1, 1, 1]"
415,QID839,415,How many hours are in a day?,D,twenty four,4,"hours,are,in,a,day","[2, 3, 4, 5, 6]",26,African,Female,Very well,PASSED,d6c002d46d9bfa466637cec4a134f332,BY,Black/African American,<=35,test,"[0, 0, 1, 1, 1, 1, 1]"
416,QID841,416,"The couple explained they were having trouble communicating, it seemed every conversation took great what?",B,effort,2,"having,trouble,communicating,seemed,conversation,great,what","[5, 6, 7, 9, 11, 13, 14]",26,African,Female,Very well,PASSED,d6ff2d749494d89e9c7a53f587c519f4,BY,Black/African American,<=35,test,"[0, 0, 0, 0, 0, 1, 1, 1, 0, 1, 0, 1, 0, 1, 1]"
417,QID843,417,Joe was thrown from his boat into the water. The water was cold because it was the middle of winter and he cried out to his crew for help. They couldn't hear him over the sound of the what?,D,surface of earth,1,"water,water,cold,middle,of,winter,cried,out,to,his,crew,for,help,They,n't,hear,him,over,sound","[8, 10, 12, 17, 18, 19, 22, 23, 24, 25, 26, 27, 28, 29, 31, 32, 33, 35]",26,African,Female,Very well,PASSED,d867f76d000bdb59b9b4cb982bd7f0a0,BY,Black/African American,<=35,test,"[0, 0, 0, 0, 0, 0, 0, 0, 1, 0, 1, 0, 1, 0, 0, 0, 0, 1, 1, 1, 0, 0, 1, 1, 1, 1, 1, 1, 1, 1, 0, 1, 1, 1, 0, 1, 0, 0, 0]"
418,QID845,418,Why would one try to avoid work?,D,bad mood,5,"try,avoid,work","[3, 5, 6]",26,African,Female,Very well,PASSED,d9835ede7a0ed79325de13ca95b85b78,BY,Black/African American,<=35,test,"[0, 0, 0, 1, 0, 1, 1]"
419,QID847,419,Paul wants carrots and doesn't need to drive anywhere. He gets them from where?,A,refrigerator,1,"drive,anywhere,gets,them","[7, 8, 10, 11]",26,African,Female,Very well,PASSED,db1eb157671109bbb9113b0f71a6b957,BY,Black/African American,<=35,test,"[0, 0, 0, 0, 0, 0, 0, 1, 1, 0, 1, 1, 0, 0]"
420,QID849,420,Where would you go to get some pamphlets if you want to own them?,A,bookstore,1,"Where,get,pamphlets,own,them","[0, 5, 7, 12, 13]",23,African,Male,Very well,PASSED,db7f2bfdabcf53d6778fd7af80b603d2,BY,Black/African American,<=35,test,"[1, 0, 0, 0, 0, 1, 0, 1, 0, 0, 0, 0, 1, 1]"
421,QID851,421,"The child pretended he was reading newspaper, he couldn't actually do it without what?",E,knowing how to read,5,"pretended,reading,newspaper","[2, 5, 6]",23,African,Male,Very well,PASSED,dba51270f789c75a2e38a5201b124d99,BY,Black/African American,<=35,test,"[0, 0, 1, 0, 0, 1, 1, 0, 0, 0, 0, 0, 0, 0]"
422,QID853,422,Where are you likely to set papers while working on them?,A,table,1,"Where,set,papers,working","[0, 5, 6, 8]",23,African,Male,Very well,PASSED,dbdad44029098d4b1d202d6d857d6092,BY,Black/African American,<=35,test,"[1, 0, 0, 0, 0, 1, 1, 0, 1, 0, 0]"
423,QID855,423,Where can you get a lizard to keep in your home?,C,pet shop,3,"Where,lizard,keep,your,home","[0, 5, 7, 9, 10]",23,African,Male,Very well,PASSED,ddd8c62ec94b4f94eeefdd05b9208a71,BY,Black/African American,<=35,test,"[1, 0, 0, 0, 0, 1, 0, 1, 0, 1, 1]"
424,QID857,424,Where could a personal ficus live?,C,front yard,3,"Where,personal,ficus","[0, 3, 4]",23,African,Male,Very well,PASSED,de0386024f32cdf277a785a851b97544,BY,Black/African American,<=35,test,"[1, 0, 0, 1, 1, 0]"
425,QID859,425,What can happen if you are buying products that someone else does not want you to buy?,B,disagreements,2,"happen,someone,does,not,want","[2, 9, 11, 12, 13]",23,African,Male,Very well,PASSED,de54d03e69d9765872f95ff06ed21499,BY,Black/African American,<=35,test,"[0, 0, 1, 0, 0, 0, 0, 0, 0, 1, 0, 1, 1, 1, 0, 0, 0]"
426,QID861,426,What happens when airplane engines cut off and are unable to be restarted in flight?,D,crash,4,"happens,airplane,engines,unable,to,be,restarted,in,flight","[1, 3, 4, 9, 10, 11, 12, 13, 14]",23,African,Male,Very well,PASSED,dea70fe40fac9ad03bf319bf8a480efa,BY,Black/African American,<=35,test,"[0, 1, 0, 1, 1, 0, 0, 0, 0, 1, 1, 1, 1, 1, 1]"
427,QID863,427,"The janitor never had much to clean after services, but there was still always a paper or two to pick up where?",A,synagogue,1,"janitor,clean,after,services","[1, 6, 7, 8]",23,African,Male,Very well,PASSED,dec1c42628a7448aa364cdada6e82f98,BY,Black/African American,<=35,test,"[0, 1, 0, 0, 0, 0, 1, 1, 1, 0, 0, 0, 0, 0, 0, 0, 0, 0, 0, 0, 0, 0]"
428,QID865,428,Where do you keep your pizza slice before you eat it?,B,oven,4,"Where,pizza,slice,before,you,eat","[0, 5, 6, 7, 8, 9]",23,African,Male,Very well,PASSED,df3d27338bcf86b341b8b02d4309daf5,BY,Black/African American,<=35,test,"[1, 0, 0, 0, 0, 1, 1, 1, 1, 1, 0]"
429,QID867,429,What does a person with a what likely do?,E,own house,3,what,[6],23,African,Male,Very well,PASSED,dfa23d3422b7294843447b6950d2b476,BY,Black/African American,<=35,test,"[0, 0, 0, 0, 0, 0, 1, 0, 0]"
430,QID869,430,"The company sent off many purchases, they used recycled cardboard as their what?",A,packaging materials,1,"company,purchases,used,recycled,cardboard","[1, 5, 7, 8, 9]",33,African,Female,Very well,PASSED,e050bce7048da1b3743a54153e91694e,BY,Black/African American,<=35,test,"[0, 1, 0, 0, 0, 1, 0, 1, 1, 1, 0, 0, 0]"
431,QID871,431,Where can fisherman store their rods when on a fishing trip?,C,fishing camp,3,"fisherman,rods,fishing,trip","[2, 5, 9, 10]",33,African,Female,Very well,PASSED,e0a7d1df3ce14b27888e785e6636d5f0,BY,Black/African American,<=35,test,"[0, 0, 1, 0, 0, 1, 0, 0, 0, 1, 1]"
432,QID873,432,Where would you keep an ottoman near your front door?,A,living room,1,"ottoman,front,door","[5, 8, 9]",33,African,Female,Very well,PASSED,e1403a7c581bc263aea2ed8d179826d1,BY,Black/African American,<=35,test,"[0, 0, 0, 0, 0, 1, 0, 0, 1, 1]"
433,QID875,433,Where would I not want a fox?,A,outside bedroom window,4,"Where,want,fox","[0, 4, 6]",33,African,Female,Very well,PASSED,e145618c2062eb9ea8928fdb0d42185e,BY,Black/African American,<=35,test,"[1, 0, 0, 0, 1, 0, 1]"
434,QID877,434,What was the man encouraged to do after he expressed his anger violently?,A,cool off,1,"What,encouraged,expressed,anger,violently","[0, 4, 9, 11, 12]",33,African,Female,Very well,PASSED,e172a93c72d305ee8262a8deb00d9fc3,BY,Black/African American,<=35,test,"[1, 0, 0, 0, 1, 0, 0, 0, 0, 1, 0, 1, 1]"
