,QID,text_id,sentence,original_label,label,label_index,rationale,rationale_index,age,ethnicity,gender,english_proficiency,attentioncheck,originaldata_id,group_id,recruitment_ethnicity,recruitment_age,originaldata_split,rationale_binary
355,QID719,355,Where is the large area location of the empire state building?,E,new york city,5,large,[3],48,Latino/Hispanic,Female,Well,PASSED,b92f786638796fc028947ac0e9a44fef,LO,Latino/Hispanic,>=38,test,"[0, 0, 0, 1, 0, 0, 0, 0, 0, 0, 0]"
356,QID721,356,What do children require to grow up healthy?,A,need care,1,healthy,[7],48,Latino/Hispanic,Female,Well,PASSED,b94a9764acff078b52a9cbae04661dc9,LO,Latino/Hispanic,>=38,test,"[0, 0, 0, 0, 0, 0, 0, 1]"
357,QID723,357,"The business man was promoted recently, to celebrate he went where to buy an expensive wristwatch?",B,jewelry store,2,expensive,[14],48,Latino/Hispanic,Female,Well,PASSED,b9bed83138901f4a45041b02c5b242c1,LO,Latino/Hispanic,>=38,test,"[0, 0, 0, 0, 0, 0, 0, 0, 0, 0, 0, 0, 0, 0, 1, 0]"
358,QID725,358,"The vet found malignant tumors on the animals, what is their likely fate?",C,euthanasia,1,"malignant,tumors","[3, 4]",48,Latino/Hispanic,Female,Well,PASSED,ba3a2b9ff289c106051163f840a6f5ba,LO,Latino/Hispanic,>=38,test,"[0, 0, 0, 1, 1, 0, 0, 0, 0, 0, 0, 0, 0]"
359,QID727,359,"They needed grape juice for their party, they went to buy it and other snacks at the what?",E,food store,5,"to,buy,what","[9, 10, 17]",48,Latino/Hispanic,Female,Well,PASSED,ba9132ebf2bc3ad21e6a0631dc4e0a77,LO,Latino/Hispanic,>=38,test,"[0, 0, 0, 0, 0, 0, 0, 0, 0, 1, 1, 0, 0, 0, 0, 0, 0, 1]"
360,QID729,360,If you spend all your time buying and not saving what is is likely to happen?,E,go broke,5,"all,your,time,buying,not,saving,what,happen","[3, 4, 5, 6, 8, 9, 10, 15]",56,Latino/Hispanic,Female,Not well,PASSED,ba9a05bd2086c0d37733e26479d6630f,LO,Latino/Hispanic,>=38,test,"[0, 0, 0, 1, 1, 1, 1, 0, 1, 1, 1, 0, 0, 0, 0, 1]"
361,QID731,361,"If somebody buys something and gives it to me as a free gift, what is the cost status of the gift?",C,paid for,3,"somebody,buys,something,gives,gift,what,is,cost","[1, 2, 3, 5, 12, 13, 14, 16]",56,Latino/Hispanic,Female,Not well,PASSED,bb503ece4eac41dfe608a1dcb654e6bf,LO,Latino/Hispanic,>=38,test,"[0, 1, 1, 1, 0, 1, 0, 0, 0, 0, 0, 0, 1, 1, 1, 0, 1, 0, 0, 0, 0]"
362,QID733,362,What kind of tale might feature a talking weasel?,E,children 's story,5,"kind,tale,might,talking,weasel","[1, 3, 4, 7, 8]",56,Latino/Hispanic,Female,Not well,PASSED,bc08c354e5bead6863ea4a29cb8fa359,LO,Latino/Hispanic,>=38,test,"[0, 1, 0, 1, 1, 0, 0, 1, 1]"
363,QID735,363,"I want to use string to keep something from moving, how should I do it?",A,stringbed,4,"want,use,string,keep,moving,how,do","[1, 3, 4, 6, 9, 10, 13]",56,Latino/Hispanic,Female,Not well,PASSED,bc268cd19e2c95c78967fd6b9092fb90,LO,Latino/Hispanic,>=38,test,"[0, 1, 0, 1, 1, 0, 1, 0, 0, 1, 1, 0, 0, 1, 0]"
364,QID737,364,"The player lifted his cornet and walked in rhythm, what was the player a member of?",C,high school band,2,"player,lifted,cornet,walked,in,rhythm","[1, 2, 4, 6, 7, 8]",56,Latino/Hispanic,Female,Not well,PASSED,bcc5dd6292a64d8fa17cd07c360b335d,LO,Latino/Hispanic,>=38,test,"[0, 1, 1, 0, 1, 0, 1, 1, 1, 0, 0, 0, 0, 0, 0, 0]"
365,QID739,365,"Joe was there to meet a large number of people. As he filed though the entrance hall, he saw many strangers who came from far away. What sort of building is he probably in?",C,large building,5,"was,meet,people,came,from,far,What,building,is","[1, 4, 9, 22, 23, 24, 26, 29, 30]",56,Latino/Hispanic,Female,Not well,PASSED,bd780fea2d4dd262583446e64c0f314d,LO,Latino/Hispanic,>=38,test,"[0, 1, 0, 0, 1, 0, 0, 0, 0, 1, 0, 0, 0, 0, 0, 0, 0, 0, 0, 0, 0, 0, 1, 1, 1, 0, 1, 0, 0, 1, 1, 0, 0, 0]"
366,QID741,366,Miss Grady took a stick from Bob because he was playing with it during class. She wanted to make sure that he couldn't get to it so she put it where?,A,classroom,3,"Miss,took,stick,because,was,playing,during,class,he,could,get,she,put,where","[0, 2, 4, 7, 9, 10, 13, 14, 21, 22, 23, 27, 28, 30]",56,Latino/Hispanic,Female,Not well,PASSED,bdf92566f14599f1606109677206001f,LO,Latino/Hispanic,>=38,test,"[1, 0, 1, 0, 1, 0, 0, 1, 0, 1, 1, 0, 0, 1, 1, 0, 0, 0, 0, 0, 0, 1, 1, 1, 0, 0, 0, 1, 1, 0, 1]"
367,QID743,367,Where can you buy a replacement ax handle?,B,hardware store,2,"Where,buy,replacement,ax","[0, 3, 5, 6]",56,Latino/Hispanic,Female,Not well,PASSED,be2cb9c96069ac355a7ccef262743d14,LO,Latino/Hispanic,>=38,test,"[1, 0, 0, 1, 0, 1, 1, 0]"
368,QID745,368,What animal is known for being a follower?,A,goat,1,"animal,known,for,follower","[1, 3, 4, 7]",56,Latino/Hispanic,Female,Not well,PASSED,be737cd4db844574ef594442ce6c9453,LO,Latino/Hispanic,>=38,test,"[0, 1, 0, 1, 1, 0, 0, 1]"
369,QID747,369,What is part of a republic like the USA?,A,state,1,"part,of,republic","[2, 3, 5]",56,Latino/Hispanic,Female,Not well,PASSED,bea07406aaadeef50110883b6932d86a,LO,Latino/Hispanic,>=38,test,"[0, 0, 1, 1, 0, 1, 0, 0, 0]"
370,QID749,370,"He was a sloppy eater, so where did he leave a mess?",D,table,4,where,[6],48,Latino/Hispanic,Male,Very well,PASSED,c02a3c2d4f726b9e1be99533a24a6ab4,LO,Latino/Hispanic,>=38,test,"[0, 0, 0, 0, 0, 0, 1, 0, 0, 0, 0, 0]"
371,QID751,371,"Something had the nerve to break into the garbage last night, what did it?",B,animal,2,"break,garbage,did,it","[5, 8, 12, 13]",48,Latino/Hispanic,Male,Very well,PASSED,c036ce033bc429ac1aba0a6ac8d057e1,LO,Latino/Hispanic,>=38,test,"[0, 0, 0, 0, 0, 1, 0, 0, 1, 0, 0, 0, 1, 1]"
372,QID753,372,"The man took paperwork to other people to consult over it, where was he heading?",B,office,3,"paperwork,people,heading","[3, 6, 14]",48,Latino/Hispanic,Male,Very well,PASSED,c0d75f9fbf30aa3a612f16edb20d6b8d,LO,Latino/Hispanic,>=38,test,"[0, 0, 0, 1, 0, 0, 1, 0, 0, 0, 0, 0, 0, 0, 1]"
373,QID755,373,When someone has little knowledge and is judging someone they are considered what?,D,ignorance,4,"little,judging","[3, 7]",48,Latino/Hispanic,Male,Very well,PASSED,c1aebf059c5102f4e773f7fe4afe13f0,LO,Latino/Hispanic,>=38,test,"[0, 0, 0, 1, 0, 0, 0, 1, 0, 0, 0, 0, 0]"
374,QID757,374,"For some reason she was devoid of regular emotions, buying products was the only way she could feel what?",A,pleasure,1,"devoid,regular","[5, 7]",48,Latino/Hispanic,Male,Very well,PASSED,c22f30eee57f7191ee07e9a916460f68,LO,Latino/Hispanic,>=38,test,"[0, 0, 0, 0, 0, 1, 0, 1, 0, 0, 0, 0, 0, 0, 0, 0, 0, 0, 0]"
375,QID759,375,Where is a salt shaker most often kept?,B,kitchen cupboard,3,"is,?",[1],48,Latino/Hispanic,Male,Very well,PASSED,c2a8c6814ed3e207771cfc23b3b42cf1,LO,Latino/Hispanic,>=38,test,"[0, 1, 0, 0, 0, 0, 0, 0]"
376,QID761,376,What is a place that is far away from your house and where you could consume beer?,B,friend 's house,2,"house,beer","[10, 16]",48,Latino/Hispanic,Male,Very well,PASSED,c2c2a387fd9a6a26cff636008de21f71,LO,Latino/Hispanic,>=38,test,"[0, 0, 0, 0, 0, 0, 0, 0, 0, 0, 1, 0, 0, 0, 0, 0, 1]"
377,QID763,377,Killing people should not cause what emotion?,C,joy,3,"Killing,not","[0, 3]",48,Latino/Hispanic,Male,Very well,PASSED,c35f7de9e9005fcf654cb0b23f17acd6,LO,Latino/Hispanic,>=38,test,"[1, 0, 0, 1, 0, 0, 0]"
378,QID765,378,What do people do for food?,D,kill animals,4,"What,food","[0, 5]",48,Latino/Hispanic,Male,Very well,PASSED,c3890d43b84635d9e61c007ca2521d5b,LO,Latino/Hispanic,>=38,test,"[1, 0, 0, 0, 0, 1]"
379,QID767,379,To what do trees roots cling?,E,surface of earth,5,roots,[4],48,Latino/Hispanic,Male,Very well,PASSED,c39131d979c9205c11d0e109e18188e4,LO,Latino/Hispanic,>=38,test,"[0, 0, 0, 0, 1, 0]"
380,QID769,380,"When you fail to finish something, you failed at doing what to it",C,completing,3,"finish,something","[4, 5]",44,Latino/Hispanic,Male,Very well,PASSED,c492b8b9754a181c924c1df19998cbc7,LO,Latino/Hispanic,>=38,test,"[0, 0, 0, 0, 1, 1, 0, 0, 0, 0, 0, 0, 0]"
381,QID771,381,Where might someone store a reusable shopping bag?,E,closet,5,"store,a,reusable,shopping,bag","[3, 4, 5, 6, 7]",44,Latino/Hispanic,Male,Very well,PASSED,c509c499bace6de324b39c0d4d0c30fa,LO,Latino/Hispanic,>=38,test,"[0, 0, 0, 1, 1, 1, 1, 1]"
382,QID773,382,"The man working in the attic swatted away a bee, but soon the single bee was an entire what?",A,swarm,1,"single,bee,was,an,entire","[13, 14, 15, 16, 17]",44,Latino/Hispanic,Male,Very well,PASSED,c54ddc0f9d170ba65d9f4f2e0bb41d1c,LO,Latino/Hispanic,>=38,test,"[0, 0, 0, 0, 0, 0, 0, 0, 0, 0, 0, 0, 0, 1, 1, 1, 1, 1, 0]"
383,QID775,383,Why do people read non fiction?,C,learn new things,3,"non,fiction","[4, 5]",44,Latino/Hispanic,Male,Very well,PASSED,c57ed32566a2db1ec3d6e4fd595b9d05,LO,Latino/Hispanic,>=38,test,"[0, 0, 0, 0, 1, 1]"
384,QID777,384,Noble citizen of the Roman empire believed those born with lower status were what to them?,D,ignoble,2,"lower,status","[10, 11]",44,Latino/Hispanic,Male,Very well,PASSED,c640116ca6905d5256edadb616b3f76e,LO,Latino/Hispanic,>=38,test,"[0, 0, 0, 0, 0, 0, 0, 0, 0, 0, 1, 1, 0, 0, 0, 0]"
385,QID779,385,"Some people got escorted out of the library, they were probably what?",B,talking loudly,2,"out,of,the,library","[4, 5, 6, 7]",44,Latino/Hispanic,Male,Very well,PASSED,c6f10fd07348bf2cf5488b0d9f38d806,LO,Latino/Hispanic,>=38,test,"[0, 0, 0, 0, 1, 1, 1, 1, 0, 0, 0, 0]"
386,QID781,386,Dan fell off a bar stool. He did this because he was what than ever before?,B,drunker,2,"fell,off,a,bar,stool","[1, 2, 3, 4, 5]",44,Latino/Hispanic,Male,Very well,PASSED,c7526b682e64f355384631b35cd78fc9,LO,Latino/Hispanic,>=38,test,"[0, 1, 1, 1, 1, 1, 0, 0, 0, 0, 0, 0, 0, 0, 0, 0]"
387,QID783,387,What is a treat that you dog will enjoy?,D,bone,4,"dog,will,enjoy","[6, 7, 8]",44,Latino/Hispanic,Male,Very well,PASSED,c82ed0c2a2e115452b4d596c5faafbcf,LO,Latino/Hispanic,>=38,test,"[0, 0, 0, 0, 0, 0, 1, 1, 1]"
388,QID785,388,"If while driving to work another car makes a careless maneuver, what emotion might you feel?",E,road rage,5,"careless,maneuver","[9, 10]",44,Latino/Hispanic,Male,Very well,PASSED,c908d7c4633c5e6add9463bdd47cb27e,LO,Latino/Hispanic,>=38,test,"[0, 0, 0, 0, 0, 0, 0, 0, 0, 1, 1, 0, 0, 0, 0, 0]"
389,QID787,389,Blowfish require what specific thing to live?,A,sea water,1,Blowfish,[0],44,Latino/Hispanic,Male,Very well,PASSED,c961578f4c5768b67b843e5d2ce18452,LO,Latino/Hispanic,>=38,test,"[1, 0, 0, 0, 0, 0, 0]"
390,QID789,390,What might someone do after they finish creating art?,B,relax,2,"do,after,they,finish","[3, 4, 5, 6]",43,Latino/Hispanic,Male,Very well,PASSED,cb5b39878be0e05a3ffe783801adbc3b,LO,Latino/Hispanic,>=38,test,"[0, 0, 0, 1, 1, 1, 1, 0, 0]"
391,QID791,391,"He was at the gym trying to build muscle, what is it called that he is trying to build muscle on?",E,human body,5,"He,gym,build,muscle","[0, 4, 7, 8]",43,Latino/Hispanic,Male,Very well,PASSED,cb6766fb25daee911fc8e9816b98938c,LO,Latino/Hispanic,>=38,test,"[1, 0, 0, 0, 1, 0, 0, 1, 1, 0, 0, 0, 0, 0, 0, 0, 0, 0, 0, 0, 0]"
392,QID793,392,"The hostess was good at her job, she always had a smile when she would what?",C,welcome guests,3,"hostess,good,job,smile","[1, 3, 6, 11]",43,Latino/Hispanic,Male,Very well,PASSED,cbf3dd48b4d591fc872a53cd4b9dd3af,LO,Latino/Hispanic,>=38,test,"[0, 1, 0, 1, 0, 0, 1, 0, 0, 0, 0, 1, 0, 0, 0, 0]"
393,QID795,393,"The man often made smart remarks, like that any restaurant is a mexican restaurant where?",E,mexico,5,"any,restaurant,is,mexican","[8, 9, 10, 12]",43,Latino/Hispanic,Male,Very well,PASSED,cc8eac9956f645533b8d7b99702e3507,LO,Latino/Hispanic,>=38,test,"[0, 0, 0, 0, 0, 0, 0, 0, 1, 1, 1, 0, 1, 0, 0]"
394,QID797,394,How might releasing energy that has built up feel?,B,wonderful,2,"energy,built,up,feel","[3, 6, 7, 8]",43,Latino/Hispanic,Male,Very well,PASSED,cce13a32fedb997c017d3fac87c34912,LO,Latino/Hispanic,>=38,test,"[0, 0, 0, 1, 0, 0, 1, 1, 1]"
395,QID799,395,The place where my linen closet is really needs repainting a light color as it only has one overhead light.,D,home,2,"my,closet,needs,repainting","[3, 5, 8, 9]",43,Latino/Hispanic,Male,Very well,PASSED,cd39e442204d3edf7acc185fd59c8a44,LO,Latino/Hispanic,>=38,test,"[0, 0, 0, 1, 0, 1, 0, 0, 1, 1, 0, 0, 0, 0, 0, 0, 0, 0, 0, 0]"
396,QID801,396,What very cold area in the east can a crab be found?,C,shore line,5,"cold,area,crab,found","[2, 3, 9, 11]",43,Latino/Hispanic,Male,Very well,PASSED,cdd3d074031fbd3efeb4f9408abef04e,LO,Latino/Hispanic,>=38,test,"[0, 0, 1, 1, 0, 0, 0, 0, 0, 1, 0, 1]"
397,QID803,397,"His house was a mess, he began doing housework to get what?",E,house clean,5,"house,mess,doing,housework","[1, 4, 7, 8]",43,Latino/Hispanic,Male,Very well,PASSED,ce246bc94a54431b9c0530e71d2456b5,LO,Latino/Hispanic,>=38,test,"[0, 1, 0, 0, 1, 0, 0, 1, 1, 0, 0, 0]"
398,QID805,398,Loss of someone you love can cause what kind of feeling in your heart?,A,painful,1,"Loss,someone,you,love","[0, 2, 3, 4]",43,Latino/Hispanic,Male,Very well,PASSED,ce2fd94212243f843b3f357046051f57,LO,Latino/Hispanic,>=38,test,"[1, 0, 1, 1, 1, 0, 0, 0, 0, 0, 0, 0, 0, 0]"
399,QID807,399,"Joe is a squirrel, which is an animal. He probably lives in what sort of place.",C,woodland,3,"squirrel,animal,lives,place","[3, 7, 10, 15]",43,Latino/Hispanic,Male,Very well,PASSED,cebc07bd5080cc72862cb333b10d782d,LO,Latino/Hispanic,>=38,test,"[0, 0, 0, 1, 0, 0, 0, 1, 0, 0, 1, 0, 0, 0, 0, 1]"
400,QID809,400,She wanted a kitten and puppy so why did she only get the puppy?,A,one choice for pet,1,"wanted,kitten,puppy,she,only,get,puppy","[1, 3, 5, 9, 10, 11, 13]",65,Latino/Hispanic,Female,Very well,PASSED,cf02cca40a47c2deefd8b2e5a5ff2f70,LO,Latino/Hispanic,>=38,test,"[0, 1, 0, 1, 0, 1, 0, 0, 0, 1, 1, 1, 0, 1]"
401,QID811,401,What would be happening if you are pretending to be a police officer?,C,deception,3,"pretending,to,be,police,officer","[7, 8, 9, 11, 12]",65,Latino/Hispanic,Female,Very well,PASSED,cf33e0f5891ce53a716432be06a46ee1,LO,Latino/Hispanic,>=38,test,"[0, 0, 0, 0, 0, 0, 0, 1, 1, 1, 0, 1, 1]"
402,QID813,402,What happens at soon as a living being is born?,B,growing older,2,"What,happens,living,being,is,born","[0, 1, 6, 7, 8, 9]",65,Latino/Hispanic,Female,Very well,PASSED,cfc7fccb8449a2a950c9d2a50991420e,LO,Latino/Hispanic,>=38,test,"[1, 1, 0, 0, 0, 0, 1, 1, 1, 1]"
403,QID815,403,"The coach decided to make a lineup change, the team's effort was suffering from what?",B,stagnation,2,"coach,make,lineup,change","[1, 4, 6, 7]",65,Latino/Hispanic,Female,Very well,PASSED,d060ab71d0efff3cab5960089a6bb3a2,LO,Latino/Hispanic,>=38,test,"[0, 1, 0, 0, 1, 0, 1, 1, 0, 0, 0, 0, 0, 0, 0]"
404,QID817,404,Why do some people get passports and go to different locations?,C,desire to travel,3,"Why,get,passports,go,different,locations","[0, 4, 5, 7, 9, 10]",65,Latino/Hispanic,Female,Very well,PASSED,d06de16a4aaeaef32b398c1213257b4a,LO,Latino/Hispanic,>=38,test,"[1, 0, 0, 0, 1, 1, 0, 1, 0, 1, 1]"
405,QID819,405,"Computers have allowed everybody to answer questions they have quickly, but still we seem to be getting duller despite access to this what?",B,advance knowledge,2,"Computers,allowed,everybody,answer,questions,quickly,but,getting,duller","[0, 2, 3, 5, 6, 9, 10, 16, 17]",65,Latino/Hispanic,Female,Very well,PASSED,d0a42c8180b4e080aa071dd70fce7e03,LO,Latino/Hispanic,>=38,test,"[1, 0, 1, 1, 0, 1, 1, 0, 0, 1, 1, 0, 0, 0, 0, 0, 1, 1, 0, 0, 0, 0, 0]"
406,QID821,406,"The man was giving assistance to a pan handler in the streets, how did he give assistance?",D,out of pocket,4,"man,giving,assistance,to,pan,handler","[1, 3, 4, 5, 7, 8]",65,Latino/Hispanic,Female,Very well,PASSED,d0bda97a087904320216e4d0b8a08a8d,LO,Latino/Hispanic,>=38,test,"[0, 1, 0, 1, 1, 1, 0, 1, 1, 0, 0, 0, 0, 0, 0, 0, 0]"
407,QID823,407,Where would you buy food?,B,store,2,"Where,buy,food","[0, 3, 4]",65,Latino/Hispanic,Female,Very well,PASSED,d1d2585e0ba1160948b7c5822a99b7a1,LO,Latino/Hispanic,>=38,test,"[1, 0, 0, 1, 1]"
408,QID825,408,"Billy hated using other people's toilets. He was only comfortable on his own. So whenever he needed to poop, he would go back to his what?",D,bathroom,1,"Billy,hated,using,other,people,toilets,only,comfortable,own,whenever,needed,poop,would,go,back","[0, 1, 2, 3, 4, 5, 8, 9, 12, 14, 16, 18, 20, 21, 22]",65,Latino/Hispanic,Female,Very well,PASSED,d2871dc28c82471e5d7f71f79e49c257,LO,Latino/Hispanic,>=38,test,"[1, 1, 1, 1, 1, 1, 0, 0, 1, 1, 0, 0, 1, 0, 1, 0, 1, 0, 1, 0, 1, 1, 1, 0, 0, 0]"
409,QID827,409,What do you need to do to use television if it is already turned on?,B,open eyes,2,"What,need,to,use,television,if,already,on","[0, 3, 6, 7, 8, 9, 12, 14]",65,Latino/Hispanic,Female,Very well,PASSED,d29252ddaf7c7ef491abcce342d7bb98,LO,Latino/Hispanic,>=38,test,"[1, 0, 0, 1, 0, 0, 1, 1, 1, 1, 0, 0, 1, 0, 1]"
410,QID829,410,"He walked into the room and had a great shock, his friends had what him?",E,surprised,5,"his,friends,had,what,him","[10, 11, 12, 13, 14]",63,Latino/Hispanic,Female,Very well,PASSED,d312741df1b14bcbe358f4f30aff3994,LO,Latino/Hispanic,>=38,test,"[0, 0, 0, 0, 0, 0, 0, 0, 0, 0, 1, 1, 1, 1, 1]"
411,QID831,411,What is a wet person likely to do?,C,catch cold,3,"wet,likely,to,do","[3, 5, 6, 7]",63,Latino/Hispanic,Female,Very well,PASSED,d31ee38f67d1173275e120b8ad36039c,LO,Latino/Hispanic,>=38,test,"[0, 0, 0, 1, 0, 1, 1, 1]"
412,QID833,412,Where is a bird likely to make it's home?,A,nest,2,"Where,bird,make,home","[0, 3, 6, 8]",63,Latino/Hispanic,Female,Very well,PASSED,d3b145911a76fd6fbe9a23ab027be024,LO,Latino/Hispanic,>=38,test,"[1, 0, 0, 1, 0, 0, 1, 0, 1]"
413,QID835,413,"The pitcher stepped on the mound ready to throw, where was he located specifically?",E,baseball diamond,5,"pitcher,stepped,on,mound","[1, 2, 3, 5]",63,Latino/Hispanic,Female,Very well,PASSED,d47986deb91d64b2b15d385da3d2f483,LO,Latino/Hispanic,>=38,test,"[0, 1, 1, 1, 0, 1, 0, 0, 0, 0, 0, 0, 0, 0]"
414,QID837,414,What is a prisoner sentenced to do?,E,do time,5,"prisoner,sentenced,to,do","[3, 4, 5, 6]",63,Latino/Hispanic,Female,Very well,PASSED,d6900a01a9dd6627b4bb22b0f6d191a5,LO,Latino/Hispanic,>=38,test,"[0, 0, 0, 1, 1, 1, 1]"
415,QID839,415,How many hours are in a day?,D,twenty four,4,"hours,in,day","[2, 4, 6]",63,Latino/Hispanic,Female,Very well,PASSED,d6c002d46d9bfa466637cec4a134f332,LO,Latino/Hispanic,>=38,test,"[0, 0, 1, 0, 1, 0, 1]"
416,QID841,416,"The couple explained they were having trouble communicating, it seemed every conversation took great what?",B,effort,2,"couple,trouble,communicating","[1, 6, 7]",63,Latino/Hispanic,Female,Very well,PASSED,d6ff2d749494d89e9c7a53f587c519f4,LO,Latino/Hispanic,>=38,test,"[0, 1, 0, 0, 0, 0, 1, 1, 0, 0, 0, 0, 0, 0, 0]"
417,QID843,417,Joe was thrown from his boat into the water. The water was cold because it was the middle of winter and he cried out to his crew for help. They couldn't hear him over the sound of the what?,D,motor,5,"boat,hear,over,sound,of","[5, 31, 33, 35, 36]",63,Latino/Hispanic,Female,Very well,PASSED,d867f76d000bdb59b9b4cb982bd7f0a0,LO,Latino/Hispanic,>=38,test,"[0, 0, 0, 0, 0, 1, 0, 0, 0, 0, 0, 0, 0, 0, 0, 0, 0, 0, 0, 0, 0, 0, 0, 0, 0, 0, 0, 0, 0, 0, 0, 1, 0, 1, 0, 1, 1, 0, 0]"
418,QID845,418,Why would one try to avoid work?,D,malaise,4,"Why,avoid,work","[0, 5, 6]",63,Latino/Hispanic,Female,Very well,PASSED,d9835ede7a0ed79325de13ca95b85b78,LO,Latino/Hispanic,>=38,test,"[1, 0, 0, 0, 0, 1, 1]"
419,QID847,419,Paul wants carrots and doesn't need to drive anywhere. He gets them from where?,A,refrigerator,1,"does,n't,need,to,drive,anywhere","[4, 5, 6, 7, 8]",63,Latino/Hispanic,Female,Very well,PASSED,db1eb157671109bbb9113b0f71a6b957,LO,Latino/Hispanic,>=38,test,"[0, 0, 0, 0, 1, 1, 1, 1, 1, 0, 0, 0, 0, 0]"
420,QID849,420,Where would you go to get some pamphlets if you want to own them?,A,bookstore,1,"some,pamphlets,want,own","[6, 7, 10, 12]",43,Latino/Hispanic,Female,Very well,PASSED,db7f2bfdabcf53d6778fd7af80b603d2,LO,Latino/Hispanic,>=38,test,"[0, 0, 0, 0, 0, 0, 1, 1, 0, 0, 1, 0, 1, 0]"
421,QID851,421,"The child pretended he was reading newspaper, he couldn't actually do it without what?",E,knowing how to read,5,"child,pretended,reading,newspaper,could,n't,actually","[1, 2, 5, 6, 8, 9]",43,Latino/Hispanic,Female,Very well,PASSED,dba51270f789c75a2e38a5201b124d99,LO,Latino/Hispanic,>=38,test,"[0, 1, 1, 0, 0, 1, 1, 0, 1, 1, 0, 0, 0, 0]"
422,QID853,422,Where are you likely to set papers while working on them?,A,table,1,"set,papers,while,working","[5, 6, 7, 8]",43,Latino/Hispanic,Female,Very well,PASSED,dbdad44029098d4b1d202d6d857d6092,LO,Latino/Hispanic,>=38,test,"[0, 0, 0, 0, 0, 1, 1, 1, 1, 0, 0]"
423,QID855,423,Where can you get a lizard to keep in your home?,C,desert country,1,"Where,lizard,keep,home","[0, 5, 7, 10]",43,Latino/Hispanic,Female,Very well,PASSED,ddd8c62ec94b4f94eeefdd05b9208a71,LO,Latino/Hispanic,>=38,test,"[1, 0, 0, 0, 0, 1, 0, 1, 0, 0, 1]"
424,QID857,424,Where could a personal ficus live?,C,front yard,3,"personal,ficus,live","[3, 4, 5]",43,Latino/Hispanic,Female,Very well,PASSED,de0386024f32cdf277a785a851b97544,LO,Latino/Hispanic,>=38,test,"[0, 0, 0, 1, 1, 1]"
425,QID859,425,What can happen if you are buying products that someone else does not want you to buy?,B,disagreements,2,"buying,products,someone,else,want,buy","[6, 7, 9, 10, 13, 16]",43,Latino/Hispanic,Female,Very well,PASSED,de54d03e69d9765872f95ff06ed21499,LO,Latino/Hispanic,>=38,test,"[0, 0, 0, 0, 0, 0, 1, 1, 0, 1, 1, 0, 0, 1, 0, 0, 1]"
426,QID861,426,What happens when airplane engines cut off and are unable to be restarted in flight?,D,stall,1,"airplane,engines,unable,restarted,flight","[3, 4, 9, 12, 14]",43,Latino/Hispanic,Female,Very well,PASSED,dea70fe40fac9ad03bf319bf8a480efa,LO,Latino/Hispanic,>=38,test,"[0, 0, 0, 1, 1, 0, 0, 0, 0, 1, 0, 0, 1, 0, 1]"
427,QID863,427,"The janitor never had much to clean after services, but there was still always a paper or two to pick up where?",A,classroom,3,"janitor,clean,services,always,paper,two,pick,up","[1, 6, 8, 13, 15, 17, 19, 20]",43,Latino/Hispanic,Female,Very well,PASSED,dec1c42628a7448aa364cdada6e82f98,LO,Latino/Hispanic,>=38,test,"[0, 1, 0, 0, 0, 0, 1, 0, 1, 0, 0, 0, 0, 1, 0, 1, 0, 1, 0, 1, 1, 0]"
428,QID865,428,Where do you keep your pizza slice before you eat it?,B,plate,2,"Where,pizza,slice,before,eat","[0, 5, 6, 7, 9]",43,Latino/Hispanic,Female,Very well,PASSED,df3d27338bcf86b341b8b02d4309daf5,LO,Latino/Hispanic,>=38,test,"[1, 0, 0, 0, 0, 1, 1, 1, 0, 1, 0]"
429,QID867,429,What does a person with a what likely do?,E,electrical circuit,4,"person,with,what","[3, 4, 6]",43,Latino/Hispanic,Female,Very well,PASSED,dfa23d3422b7294843447b6950d2b476,LO,Latino/Hispanic,>=38,test,"[0, 0, 0, 1, 1, 0, 1, 0, 0]"
430,QID869,430,"The company sent off many purchases, they used recycled cardboard as their what?",A,packaging materials,1,"off,what","[3, 12]",38,Latino/Hispanic,Female,Very well,PASSED,e050bce7048da1b3743a54153e91694e,LO,Latino/Hispanic,>=38,test,"[0, 0, 0, 1, 0, 0, 0, 0, 0, 0, 0, 0, 1]"
431,QID871,431,Where can fisherman store their rods when on a fishing trip?,C,fishing camp,3,"Where,can,when","[0, 1, 6]",38,Latino/Hispanic,Female,Very well,PASSED,e0a7d1df3ce14b27888e785e6636d5f0,LO,Latino/Hispanic,>=38,test,"[1, 1, 0, 0, 0, 0, 1, 0, 0, 0, 0]"
432,QID873,432,Where would you keep an ottoman near your front door?,A,living room,1,"Where,would,you","[0, 1, 2]",38,Latino/Hispanic,Female,Very well,PASSED,e1403a7c581bc263aea2ed8d179826d1,LO,Latino/Hispanic,>=38,test,"[1, 1, 1, 0, 0, 0, 0, 0, 0, 0]"
433,QID875,433,Where would I not want a fox?,A,hen house,1,"would,I","[1, 2]",38,Latino/Hispanic,Female,Very well,PASSED,e145618c2062eb9ea8928fdb0d42185e,LO,Latino/Hispanic,>=38,test,"[0, 1, 1, 0, 0, 0, 0]"
434,QID877,434,What was the man encouraged to do after he expressed his anger violently?,A,cool off,1,encouraged,[4],38,Latino/Hispanic,Female,Very well,PASSED,e172a93c72d305ee8262a8deb00d9fc3,LO,Latino/Hispanic,>=38,test,"[0, 0, 0, 0, 1, 0, 0, 0, 0, 0, 0, 0, 0]"
435,QID879,435,"The person wasn't bothered by the weather, she had remembered to bring her what?",E,warm coat,5,"was,n't",[2],38,Latino/Hispanic,Female,Very well,PASSED,e18dd9ffc7b7934c39f2b5e9dee5a8c2,LO,Latino/Hispanic,>=38,test,"[0, 0, 1, 0, 0, 0, 0, 0, 0, 0, 0, 0, 0, 0]"
436,QID881,436,"If you have a ticket and you are planning to eat hot dogs, where would you go?",C,baseball stadium,3,"If,you,have,a,ticket,and","[0, 1, 2, 3, 4, 5]",38,Latino/Hispanic,Female,Very well,PASSED,e211b1a3f3401d164c8b0bfc10160caa,LO,Latino/Hispanic,>=38,test,"[1, 1, 1, 1, 1, 1, 0, 0, 0, 0, 0, 0, 0, 0, 0, 0, 0]"
437,QID883,437,What do you call the caretakers of a child?,E,parents,5,"of,a,child","[6, 7, 8]",38,Latino/Hispanic,Female,Very well,PASSED,e216381e9f0ddd1d248ee25fccca2b1f,LO,Latino/Hispanic,>=38,test,"[0, 0, 0, 0, 0, 0, 1, 1, 1]"
438,QID885,438,Where are you likely to find much more than a drop of blood on the floor?,D,crime scene,1,"much,more,than,a,drop,of","[6, 7, 8, 9, 10, 11]",38,Latino/Hispanic,Female,Very well,PASSED,e248968fec422e1fab0f0561fedff76e,LO,Latino/Hispanic,>=38,test,"[0, 0, 0, 0, 0, 0, 1, 1, 1, 1, 1, 1, 0, 0, 0, 0]"
439,QID887,439,Where do you store a large container?,E,cabinet,5,"store,large","[3, 5]",38,Latino/Hispanic,Female,Very well,PASSED,e408a5a031caec33782cb3b3a005eecc,LO,Latino/Hispanic,>=38,test,"[0, 0, 0, 1, 0, 1, 0]"
440,QID889,440,"If you have a condo in a Wisconsin city known for beer, where are you?",E,milwaukee,5,"condo,Wisconsin,city,beer","[4, 7, 8, 11]",55,Latino/Hispanic,Female,Well,PASSED,e40fd2c17fe2cde4bd4af540d35fd518,LO,Latino/Hispanic,>=38,test,"[0, 0, 0, 0, 1, 0, 0, 1, 1, 0, 0, 1, 0, 0, 0]"
441,QID891,441,James need to use a toilet but there were no public ones in sight. Eventually he broke down and did something very expensive so that he could get a toilet. Where might he have gone?,A,bathroom,3,"need,toilet,public,expensive,toilet","[1, 5, 10, 22, 29]",55,Latino/Hispanic,Female,Well,PASSED,e43c4eaa04243ddee30f29171718eb92,LO,Latino/Hispanic,>=38,test,"[0, 1, 0, 0, 0, 1, 0, 0, 0, 0, 1, 0, 0, 0, 0, 0, 0, 0, 0, 0, 0, 0, 1, 0, 0, 0, 0, 0, 0, 1, 0, 0, 0, 0, 0]"
