,QID,text_id,sentence,original_label,label,label_index,rationale,rationale_index,age,ethnicity,gender,english_proficiency,attentioncheck,originaldata_id,group_id,recruitment_ethnicity,recruitment_age
327,QID603,297,Where is hard to read note likely to be ?,E,sheet music,2,"hard,to,read,note","3,4,5,6",21,White/Caucasian,Female,Well,PASSED,98a04457025f18c2287d5c610ff8000d,WY,White/Causasian,<=35
328,QID605,298,John wanted scatter his wife 's remains in a lake in the wilderness . He had to delay before of where he lived . Where did he live ?,E,state park,4,"his,remains,wilderness","4,7,13",21,White/Caucasian,Female,Well,PASSED,99e0b2ddf88ebed98b977043b7c2331b,WY,White/Causasian,<=35
329,QID607,299,"After standing up I had to sit right back down , why would I feel like this ?",C,effort,2,"sit,why,would,I,feel","7,12,13,14,15",21,White/Caucasian,Female,Well,PASSED,9a23a7f04e63bf9f4c7dfe50c58abfd2,WY,White/Causasian,<=35
330,QID609,300,Why do people stop caring about their problems ?,E,face problems,3,"stop,caring,about,their,problems","4,5,6,7,8",27,White/Caucasian,Male,Very well,PASSED,9ae52783d8fdb5cc2e8caa01542c3341,WY,White/Causasian,<=35
331,QID611,301,"If my husband never helps me doing housework , what might that lead to ?",B,arguments,2,"husband,never,helps,me,doing,housework,lead,to","3,4,5,6,7,8,13,14",27,White/Caucasian,Male,Very well,PASSED,9b26329d74a6159ab9af4f899303de39,WY,White/Causasian,<=35
332,QID613,302,Where would you find people standing in a line outside ?,A,bus depot,1,"find,people,standing,in,line,outside","4,5,6,7,9,10",27,White/Caucasian,Male,Very well,PASSED,9b4bbf3c4d24ecdb4b27320afb706808,WY,White/Causasian,<=35
333,QID615,303,"The juror was quite bored and zoning out but wanted to convey he was hearing testimony , so he just sat there doing what ?",B,take notes,1,"juror,was,bored,but,wanted,to,convey,he,was,hearing,testimony,,,just,sat,there,doing,what","2,3,5,9,10,11,12,13,14,15,16,17,20,21,22,23,24",27,White/Caucasian,Male,Very well,PASSED,9b631734e72a0e559da153492c1e7894,WY,White/Causasian,<=35
334,QID617,304,"John did n't mind getting in line . It was what game after that he hated . The time , the sore feet . He did not like doing what ?",B,have to wait for,1,"did,n't,mind,getting,in,line,what,game,after,that,he,hated,time,sore,feet,did,not,like,doing,what","2,3,4,5,6,7,11,12,13,14,15,16,19,22,23,26,27,28,29,30",27,White/Caucasian,Male,Very well,PASSED,9bac07574c966cae34c85e9f25538cba,WY,White/Causasian,<=35
335,QID619,305,"The bell rang , and the congregation began to what in to the church ?",C,wind instrument,2,"bell,rang,congregation,began,in,the,church","2,3,7,8,11,13,14",27,White/Caucasian,Male,Very well,PASSED,9c596382ea15768f95b5ef9ceec191dc,WY,White/Causasian,<=35
336,QID621,306,Where could a sloth live ?,A,tropical jungle,1,"Where,could,sloth,live","1,2,4,5",27,White/Caucasian,Male,Very well,PASSED,9d625e948e9c3777e7cc54ed8ffea135,WY,White/Causasian,<=35
337,QID623,307,"If you are hungry and going fishing , why would you be going fishing ?",C,catching fish,3,"you,are,hungry,going,fishing,why,would,be,going","2,3,4,6,7,9,10,12,13",27,White/Caucasian,Male,Very well,PASSED,9e5ce2b7d9eb404cdf8c7317dd0b5a59,WY,White/Causasian,<=35
338,QID625,308,Where would you put a glass after drinking from it ?,D,dishwasher,4,"Where,would,you,put,glass,after,drinking","1,2,3,4,6,7,8",27,White/Caucasian,Male,Very well,PASSED,9ed019338a48216de9eadf64faaf1ce0,WY,White/Causasian,<=35
339,QID627,309,Where are you if you 've paid to get a pizza ?,C,restaurant,3,"Where,you,'ve,paid,a,pizza","1,5,6,7,10,11",27,White/Caucasian,Male,Very well,PASSED,9f9ca9bb06d6afc31b19c365fb29a1c9,WY,White/Causasian,<=35
340,QID629,310,"If someone is found to be committing murder , what did they do to someone ?",B,kill,2,"to,someone","14,15",23,White/Caucasian,Male,Well,PASSED,a00276c6db928900772c0320aeff77c0,WY,White/Causasian,<=35
341,QID631,311,"There 's one obvious reason to eat vegetables , they 're plain what you ?",B,lose weight,1,",,they,'re,plain,what,you,?","9,10,11,12,13,14,15",23,White/Caucasian,Male,Well,PASSED,a0d02fc32878efdf0b0d420972943492,WY,White/Causasian,<=35
342,QID633,312,Where off the eastern U.S. would you find an anemone ?,C,flower bed,1,"Where,off,the,eastern","1,2,3,4",23,White/Caucasian,Male,Well,PASSED,a0f5414bf98e094f4d807abee28861a4,WY,White/Causasian,<=35
343,QID635,313,Where would a person live if they wanted no neighbors ?,D,woods,4,a,3.0,23,White/Caucasian,Male,Well,PASSED,a1303b5177df0a5b653c9abd7d5f5e08,WY,White/Causasian,<=35
344,QID637,314,Why is it hard for a young child to read a long book ?,E,many words,5,"Why,?","1,14",23,White/Caucasian,Male,Well,PASSED,a15d564d0be6996251b5d523ac62db2a,WY,White/Causasian,<=35
345,QID639,315,What does someone stop doing when being dead ?,C,breathing,3,"What,does,?","1,2,9",23,White/Caucasian,Male,Well,PASSED,a2977fd575faba162d04a490dabd1b9b,WY,White/Causasian,<=35
346,QID641,316,"The traveling business man was glad his credit card had perks , it offset the high prices for travel from a what ?",C,airport,3,what,22.0,23,White/Caucasian,Male,Well,PASSED,a2cd03ed068f6d613e85f3a60f4db0a1,WY,White/Causasian,<=35
347,QID643,317,What is main benefit to exercising ?,C,losing weight,1,"What,is,?","1,2,7",23,White/Caucasian,Male,Well,PASSED,a4b44a986e7f9045432e20ea75611df4,WY,White/Causasian,<=35
348,QID645,318,What is someone likely to want as a result of sex ?,D,procreation,4,?,12.0,23,White/Caucasian,Male,Well,PASSED,a4f5e5412f0f8ac9190db1730db07a90,WY,White/Causasian,<=35
349,QID647,319,Where do you head to travel to a star ?,C,outer space,3,"Where,do,?","1,2,10",23,White/Caucasian,Male,Well,PASSED,a5097b7f56d20217679f28201801476f,WY,White/Causasian,<=35
350,QID649,320,"If someone mean wanted to insult somebody by calling them a fruit , where is probably not the smartest place to do it ?",A,market,2,"wanted,insult,somebody,a,fruit,is,not,smartest","4,6,7,11,12,15,17,19",20,White/Caucasian,Male,Well,PASSED,a585df0818180ce3c06f963a4c3c810a,WY,White/Causasian,<=35
351,QID651,321,"In basic training they build you up only to do what , all in hopes of building you up even stronger the next time ?",B,tear down,2,"they,only,of,stronger","4,8,16,21",20,White/Caucasian,Male,Well,PASSED,a5d853d1c2fb3ef160218fb91110fbe5,WY,White/Causasian,<=35
352,QID653,322,What does a successful dog grooming session likely to make a owner feel ?,D,mistakes,2,"successful,dog,session,likely,to,a","4,5,7,8,9,11",20,White/Caucasian,Male,Well,PASSED,a5e76dd088aab4f89e2fe93f6de6e46d,WY,White/Causasian,<=35
353,QID655,323,If you want to kill someone you can do what to them with a gun ?,C,shoot,3,"kill,you,can,what,with","5,7,8,10,13",20,White/Caucasian,Male,Well,PASSED,a617eb4d27edea93e7fd630ce00c8219,WY,White/Causasian,<=35
354,QID657,324,"If you 're seeking a connection for your laptop , what are you trying to hook up with ?",A,company,4,"connection,your,what,to,hook,up","6,8,11,15,16,17",20,White/Caucasian,Male,Well,PASSED,a6d3a2cb250a6310b8cabd31dbe2138c,WY,White/Causasian,<=35
355,QID659,325,Where is a likely place for an ivy plant ?,D,shelf,2,"is,place,plant","2,5,9",20,White/Caucasian,Male,Well,PASSED,a74753bf249c1cbcff632c5c16b0397b,WY,White/Causasian,<=35
356,QID661,326,"The princess was pure , the evil wizard wished to do what to her ?",C,applied,5,"pure,evil,do,her","4,7,11,14",20,White/Caucasian,Male,Well,PASSED,a7f29f4aebe0e3bcb77038fea71bf28c,WY,White/Causasian,<=35
357,QID663,327,Where areas are there likely to be many nightclubs ?,D,drink and dance,2,"are,there,be,nightclubs","3,4,7,9",20,White/Caucasian,Male,Well,PASSED,a85441d6a0e3f871d81a9f19b31360b7,WY,White/Causasian,<=35
358,QID665,328,All the power tools like the drill used for fixing cars made for a very loud workplace where ?,D,work shop,2,"tools,like,fixing,cars,made,very,loud,workplace","4,5,10,11,12,15,16,17",20,White/Caucasian,Male,Well,PASSED,a90f9197a13c64089c9ba95bcba275ad,WY,White/Causasian,<=35
359,QID667,329,Where would you store a pillow case that is not in use ?,D,bedding store,2,"would,you,pillow,that,not,use","2,3,6,8,10,12",20,White/Caucasian,Male,Well,PASSED,aa4c5d2d348796b8d7fa324f27f4c34f,WY,White/Causasian,<=35
360,QID669,330,"After the weight cut he was worried about his energy levels , but this was part of participating in a what ?",B,wrestle,2,"weight,cut,participating,in","3,4,18,19",35,White/Caucasian,Female,Very well,PASSED,aabe8eb218468fc63b6c9aa6d428c951,WY,White/Causasian,<=35
361,QID671,331,"He kept plugging away in his cubicle , it seemed he was the only person not called into the what ?",B,conference,2,"plugging,away,cubicle,called","3,4,7,17",35,White/Caucasian,Female,Very well,PASSED,ab8d5e21a2cf34b60a04768b01f1f8e9,WY,White/Causasian,<=35
362,QID673,332,"After high tide , where on the coast can you look to find a sea anemone ?",D,intertidal zone,5,"high,tide,coast,sea,anemone","2,3,8,15,16",35,White/Caucasian,Female,Very well,PASSED,abcf1b550b4d44f46d4f68b8e1d98ec8,WY,White/Causasian,<=35
363,QID675,333,"The runner was in third place , but he pushed harder and thought he might be able to reach second . What was beginning to do ?",D,gain ground,4,"third,pushed,harder,reach,second","5,10,11,19,20",35,White/Caucasian,Female,Very well,PASSED,ac6f0e24dd6203cda43e1089dcf081d6,WY,White/Causasian,<=35
364,QID677,334,What could you use to get to some airplanes ?,A,car,3,"use,some,airplanes","4,8,9",35,White/Caucasian,Female,Very well,PASSED,acb3147d946db3b06a596d48e0be56cf,WY,White/Causasian,<=35
365,QID679,335,Why does someone want to examine thing closely ?,B,learn about,2,"examine,closely","6,8",35,White/Caucasian,Female,Very well,PASSED,ad769851a59375865607452d3bf2a45d,WY,White/Causasian,<=35
366,QID681,336,"While John Candy and Dan Aykroyd did n't run into a gazelle , you 'd have to go where to see one ?",E,great outdoors,5,"run,into,gazelle,go,where","9,10,12,18,19",35,White/Caucasian,Female,Very well,PASSED,ad8ee2965a33ff4b0e3d2ac732676594,WY,White/Causasian,<=35
367,QID683,337,Why would you go to an office ?,A,work,1,"go,office","4,7",35,White/Caucasian,Female,Very well,PASSED,ada088b7c97de80336ad043757c2db16,WY,White/Causasian,<=35
368,QID685,338,What could suddenly stop someone when he or she is running ?,B,falling down,2,"suddenly,stop,running","3,4,11",35,White/Caucasian,Female,Very well,PASSED,ae56eff01d05422ddbcb26be7181356a,WY,White/Causasian,<=35
369,QID687,339,What do you ask a child to do when you first meet her ?,D,state name,4,"ask,a,child,first,meet","4,5,6,11,12",35,White/Caucasian,Female,Very well,PASSED,aead08289ca9abfcd169f935ea228ee5,WY,White/Causasian,<=35
370,QID689,340,Sean was leaving work and took the roadway that led to his what ?,A,city,2,"led,to,his","10,11,12",27,White/Caucasian,Female,Very well,PASSED,aefa60233f3c5c4966f8ac22e901a1c7,WY,White/Causasian,<=35
371,QID691,341,What furniture will you normally find near a side chair ?,B,table,2,"furniture,chair","2,10",27,White/Caucasian,Female,Very well,PASSED,af035b75b6f7a1927b1648963f281c5e,WY,White/Causasian,<=35
372,QID693,342,"Christine could n't be having a baby at her age , she thought to herself . What was Christine ?",A,girl,5,"Christine,having,a,baby,her,age,she,herself","1,5,6,7,9,10,12,15",27,White/Caucasian,Female,Very well,PASSED,af11faa29097b71141fe192ad019d1dd,WY,White/Causasian,<=35
373,QID695,343,"The electrode would n't spark , it turned out that the what had n't been connected ?",A,battery,1,"electrode,spark,connected","2,5,16",27,White/Caucasian,Female,Very well,PASSED,b1a9b20793b46e46e1beedadbf852f84,WY,White/Causasian,<=35
374,QID697,344,"The merchant wanted to open in a high - traffic space , where did he rent space ?",A,mall,1,"merchant,high,-,traffic,space,rent,space","2,8,9,10,11,16,17",27,White/Caucasian,Female,Very well,PASSED,b1d5cdbf8ef7b3954a6a352bd4df5866,WY,White/Causasian,<=35
375,QID699,345,"The victim was to take stand today , they were going to do what ?",A,testify,1,"victim,take,stand","2,5,6",27,White/Caucasian,Female,Very well,PASSED,b1f36d1c8ab7e5a28783cb38e8709c27,WY,White/Causasian,<=35
376,QID701,346,"The child was getting many gifts for his birthday , his father reminded him to do what after opening each one ?",D,say thank,4,"child,getting,many,gifts,father,after,opening,each,one","2,4,5,6,12,18,19,20,21",27,White/Caucasian,Female,Very well,PASSED,b231a732a3fdf0621391e7e385f8d651,WY,White/Causasian,<=35
377,QID703,347,Where would you find a toy soldier that is being played with ?,C,toy box,1,"Where,find,toy","1,4,6",27,White/Caucasian,Female,Very well,PASSED,b4cde6a56fb19afc84876ebf2fb9e71a,WY,White/Causasian,<=35
378,QID705,348,"If a person were going to bed , what would be their goal ?",D,rest,3,"bed,goal","7,13",27,White/Caucasian,Female,Very well,PASSED,b5baf77d3855935c87f01f5fb2216667,WY,White/Causasian,<=35
379,QID707,349,What do airplanes do as they are arriving at the gate ?,A,land,4,"airplanes,arriving,at,the,gate","3,8,9,10,11",27,White/Caucasian,Female,Very well,PASSED,b63e5cd88bfe75d29ff9fdc6dd97fed6,WY,White/Causasian,<=35
380,QID709,350,Where would you find a basement that can be accessed with an elevator ?,D,office building,4,"basement,accessed,elevator","6,10,13",21,White/Caucasian,Female,Very well,PASSED,b67971747e95ba425a5b81e0ba8d0b28,WY,White/Causasian,<=35
381,QID711,351,The table was n't level . some parts were higher and some were lower with no rhyme or reason . It was very what ?,C,unbalanced,4,"level,parts,higher,lower","5,8,10,14",21,White/Caucasian,Female,Very well,PASSED,b6bbe013995fdb5def3d504319af0791,WY,White/Causasian,<=35
382,QID713,352,A creek is a body of water found in what low land ?,B,valley,2,"creek,body,water,low,land","2,5,7,11,12",21,White/Caucasian,Female,Very well,PASSED,b7276bb9139ec25c98c7e3822404eb6c,WY,White/Causasian,<=35
383,QID715,353,What does a person do when they feel dirty ?,C,wash themselves,3,"person,do,feel,dirty","4,5,8,9",21,White/Caucasian,Female,Very well,PASSED,b8937a30f25093910c040f4e63e1d352,WY,White/Causasian,<=35
384,QID717,354,"Bob stands in the grass surrounded by trees and nature , where is Bob ?",C,state park,3,"grass,surrounded,trees,nature","5,6,8,10",21,White/Caucasian,Female,Very well,PASSED,b9121c3228f961c5ad68958c702cd94b,WY,White/Causasian,<=35
385,QID719,355,Where is the large area location of the empire state building ?,E,manhattan,1,"large,area,location,empire,state,building","4,5,6,9,10,11",21,White/Caucasian,Female,Very well,PASSED,b92f786638796fc028947ac0e9a44fef,WY,White/Causasian,<=35
386,QID721,356,What do children require to grow up healthy ?,A,need care,1,"children,require,grow,up,healthy","3,4,6,7,8",21,White/Caucasian,Female,Very well,PASSED,b94a9764acff078b52a9cbae04661dc9,WY,White/Causasian,<=35
387,QID723,357,"The business man was promoted recently , to celebrate he went where to buy an expensive wristwatch ?",B,jewelry store,2,"buy,expensive,wristwatch","14,16,17",21,White/Caucasian,Female,Very well,PASSED,b9bed83138901f4a45041b02c5b242c1,WY,White/Causasian,<=35
388,QID725,358,"The vet found malignant tumors on the animals , what is their likely fate ?",C,die of cancer,3,"malignant,tumors,fate","4,5,14",21,White/Caucasian,Female,Very well,PASSED,ba3a2b9ff289c106051163f840a6f5ba,WY,White/Causasian,<=35
389,QID727,359,"They needed grape juice for their party , they went to buy it and other snacks at the what ?",E,food store,5,"grape,juice,party,snacks","3,4,7,16",21,White/Caucasian,Female,Very well,PASSED,ba9132ebf2bc3ad21e6a0631dc4e0a77,WY,White/Causasian,<=35
390,QID729,360,If you spend all your time buying and not saving what is is likely to happen ?,E,go broke,5,"buying,and,not,saving","7,8,9,10",22,White/Caucasian,Female,Very well,PASSED,ba9a05bd2086c0d37733e26479d6630f,WY,White/Causasian,<=35
391,QID731,361,"If somebody buys something and gives it to me as a free gift , what is the cost status of the gift ?",C,paid for,3,"gives,it,to,me,as,a,free,gift","6,7,8,9,10,11,12,13",22,White/Caucasian,Female,Very well,PASSED,bb503ece4eac41dfe608a1dcb654e6bf,WY,White/Causasian,<=35
392,QID733,362,What kind of tale might feature a talking weasel ?,E,children 's story,5,"talking,weasel","8,9",22,White/Caucasian,Female,Very well,PASSED,bc08c354e5bead6863ea4a29cb8fa359,WY,White/Causasian,<=35
393,QID735,363,"I want to use string to keep something from moving , how should I do it ?",A,tie around,1,"keep,something,from,moving","7,8,9,10",22,White/Caucasian,Female,Very well,PASSED,bc268cd19e2c95c78967fd6b9092fb90,WY,White/Causasian,<=35
394,QID737,364,"The player lifted his cornet and walked in rhythm , what was the player a member of ?",C,marching band,3,"lifted,his,cornet,and,walked,in,rhythm","3,4,5,6,7,8,9",22,White/Caucasian,Female,Very well,PASSED,bcc5dd6292a64d8fa17cd07c360b335d,WY,White/Causasian,<=35
395,QID739,365,"Joe was there to meet a large number of people . As he filed though the entrance hall , he saw many strangers who came from far away . What sort of building is he probably in ?",C,public building,4,"many,strangers,who,came,from,far,away","22,23,24,25,26,27,28",22,White/Caucasian,Female,Very well,PASSED,bd780fea2d4dd262583446e64c0f314d,WY,White/Causasian,<=35
396,QID741,366,Miss Grady took a stick from Bob because he was playing with it during class . She wanted to make sure that he could n't get to it so she put it where ?,A,desk drawer,1,"She,wanted,to,make,sure,that,he,could,n't,get,to,it","17,18,19,20,21,22,23,24,25,26,27,28",22,White/Caucasian,Female,Very well,PASSED,bdf92566f14599f1606109677206001f,WY,White/Causasian,<=35
397,QID743,367,Where can you buy a replacement ax handle ?,B,hardware store,2,"ax,handle","7,8",22,White/Caucasian,Female,Very well,PASSED,be2cb9c96069ac355a7ccef262743d14,WY,White/Causasian,<=35
398,QID745,368,What animal is known for being a follower ?,A,goat,1,"being,a,follower","6,7,8",22,White/Caucasian,Female,Very well,PASSED,be737cd4db844574ef594442ce6c9453,WY,White/Causasian,<=35
399,QID747,369,What is part of a republic like the USA ?,A,democracy,4,republic,6.0,22,White/Caucasian,Female,Very well,PASSED,bea07406aaadeef50110883b6932d86a,WY,White/Causasian,<=35
400,QID749,370,"He was a sloppy eater , so where did he leave a mess ?",D,table,4,"sloppy,eater,leave,a,mess","4,5,11,12,13",23,White/Caucasian,Female,Very well,PASSED,c02a3c2d4f726b9e1be99533a24a6ab4,WY,White/Causasian,<=35
401,QID751,371,"Something had the nerve to break into the garbage last night , what did it ?",B,animal,2,"Something,break,into,the,garbage","1,6,7,8,9",23,White/Caucasian,Female,Very well,PASSED,c036ce033bc429ac1aba0a6ac8d057e1,WY,White/Causasian,<=35
402,QID753,372,"The man took paperwork to other people to consult over it , where was he heading ?",B,meeting,2,"paperwork,other,people,consult","4,6,7,9",23,White/Caucasian,Female,Very well,PASSED,c0d75f9fbf30aa3a612f16edb20d6b8d,WY,White/Causasian,<=35
403,QID755,373,When someone has little knowledge and is judging someone they are considered what ?,D,ignorance,4,"little,knowledge,judging,someone","4,5,8,9",23,White/Caucasian,Female,Very well,PASSED,c1aebf059c5102f4e773f7fe4afe13f0,WY,White/Causasian,<=35
404,QID757,374,"For some reason she was devoid of regular emotions , buying products was the only way she could feel what ?",A,pleasure,1,"devoid,of,regular,emotions,buying,products","6,7,8,9,11,12",23,White/Caucasian,Female,Very well,PASSED,c22f30eee57f7191ee07e9a916460f68,WY,White/Causasian,<=35
405,QID759,375,Where is a salt shaker most often kept ?,B,kitchen cupboard,3,"salt,shaker,most,often,kept","4,5,6,7,8",23,White/Caucasian,Female,Very well,PASSED,c2a8c6814ed3e207771cfc23b3b42cf1,WY,White/Causasian,<=35
406,QID761,376,What is a place that is far away from your house and where you could consume beer ?,B,friend 's house,2,"place,far,away,from,your,house,consume,beer","4,7,8,9,10,11,16,17",23,White/Caucasian,Female,Very well,PASSED,c2c2a387fd9a6a26cff636008de21f71,WY,White/Causasian,<=35
407,QID763,377,Killing people should not cause what emotion ?,C,joy,3,"Killing,people,should,not,emotion","1,2,3,4,7",23,White/Caucasian,Female,Very well,PASSED,c35f7de9e9005fcf654cb0b23f17acd6,WY,White/Causasian,<=35
408,QID765,378,What do people do for food ?,D,complete job,2,"do,for,food","4,5,6",23,White/Caucasian,Female,Very well,PASSED,c3890d43b84635d9e61c007ca2521d5b,WY,White/Causasian,<=35
409,QID767,379,To what do trees roots cling ?,E,surface of earth,5,"trees,roots,cling","4,5,6",23,White/Caucasian,Female,Very well,PASSED,c39131d979c9205c11d0e109e18188e4,WY,White/Causasian,<=35
410,QID769,380,"When you fail to finish something , you failed at doing what to it",C,completing,3,"to,finish,something","4,5,6",28,Latino/Hispanic,Male,Very well,PASSED,c492b8b9754a181c924c1df19998cbc7,WY,White/Causasian,<=35
411,QID769,380,"When you fail to finish something , you failed at doing what to it",C,completing,3,"fail,finish,something,you,failed,at,doing,what,to,it","3,5,6,8,9,10,11,12,13,14",35,White/Caucasian,Male,Very well,PASSED,c492b8b9754a181c924c1df19998cbc7,WY,White/Causasian,<=35
412,QID771,381,Where might someone store a reusable shopping bag ?,E,home,2,"store,reusable,shopping,bag","4,6,7,8",28,Latino/Hispanic,Male,Very well,PASSED,c509c499bace6de324b39c0d4d0c30fa,WY,White/Causasian,<=35
413,QID771,381,Where might someone store a reusable shopping bag ?,E,home,2,store,4,35,White/Caucasian,Male,Very well,PASSED,c509c499bace6de324b39c0d4d0c30fa,WY,White/Causasian,<=35
414,QID773,382,"The man working in the attic swatted away a bee , but soon the single bee was an entire what ?",A,swarm,1,"single,bee,was,an,entire,what","15,16,17,18,19,20",35,White/Caucasian,Male,Very well,PASSED,c54ddc0f9d170ba65d9f4f2e0bb41d1c,WY,White/Causasian,<=35
415,QID773,382,"The man working in the attic swatted away a bee , but soon the single bee was an entire what ?",A,swarm,1,"a,bee,but,soon,single,bee,was,an,entire","9,10,12,13,15,16,17,18,19",28,Latino/Hispanic,Male,Very well,PASSED,c54ddc0f9d170ba65d9f4f2e0bb41d1c,WY,White/Causasian,<=35
416,QID775,383,Why do people read non fiction ?,C,it 's more relatable,2,"Why,read,non,fiction","1,4,5,6",28,Latino/Hispanic,Male,Very well,PASSED,c57ed32566a2db1ec3d6e4fd595b9d05,WY,White/Causasian,<=35
417,QID775,383,Why do people read non fiction ?,C,learn new things,3,"non,fiction","5,6",35,White/Caucasian,Male,Very well,PASSED,c57ed32566a2db1ec3d6e4fd595b9d05,WY,White/Causasian,<=35
418,QID777,384,Noble citizen of the Roman empire believed those born with lower status were what to them ?,D,peasant,3,"with,lower,status,were,what,to,them,?","10,11,12,13,14,15,16,17",35,White/Caucasian,Male,Very well,PASSED,c640116ca6905d5256edadb616b3f76e,WY,White/Causasian,<=35
419,QID777,384,Noble citizen of the Roman empire believed those born with lower status were what to them ?,D,plebeian,5,"Roman,empire,born,lower,status","5,6,9,11,12",28,Latino/Hispanic,Male,Very well,PASSED,c640116ca6905d5256edadb616b3f76e,WY,White/Causasian,<=35
420,QID779,385,"Some people got escorted out of the library , they were probably what ?",B,talking loudly,2,"people,escorted,out,library,were,probably","2,4,5,8,11,12",28,Latino/Hispanic,Male,Very well,PASSED,c6f10fd07348bf2cf5488b0d9f38d806,WY,White/Causasian,<=35
421,QID779,385,"Some people got escorted out of the library , they were probably what ?",B,talking loudly,2,"they,were,probably,what,?","10,11,12,13,14",35,White/Caucasian,Male,Very well,PASSED,c6f10fd07348bf2cf5488b0d9f38d806,WY,White/Causasian,<=35
422,QID781,386,Dan fell off a bar stool . He did this because he was what than ever before ?,B,drunker,2,"fell,off,bar,stool","2,3,5,6",28,Latino/Hispanic,Male,Very well,PASSED,c7526b682e64f355384631b35cd78fc9,WY,White/Causasian,<=35
423,QID781,386,Dan fell off a bar stool . He did this because he was what than ever before ?,B,drunker,2,"he,was,what,than,ever,before","12,13,14,15,16,17",35,White/Caucasian,Male,Very well,PASSED,c7526b682e64f355384631b35cd78fc9,WY,White/Causasian,<=35
424,QID783,387,What is a treat that you dog will enjoy ?,D,bone,4,"treat,dog,enjoy","4,7,9",28,Latino/Hispanic,Male,Very well,PASSED,c82ed0c2a2e115452b4d596c5faafbcf,WY,White/Causasian,<=35
425,QID783,387,What is a treat that you dog will enjoy ?,D,bone,4,"dog,will,enjoy","7,8,9",35,White/Caucasian,Male,Very well,PASSED,c82ed0c2a2e115452b4d596c5faafbcf,WY,White/Causasian,<=35
426,QID785,388,"If while driving to work another car makes a careless maneuver , what emotion might you feel ?",E,road rage,5,"what,emotion,might,you,feel,?","13,14,15,16,17,18",35,White/Caucasian,Male,Very well,PASSED,c908d7c4633c5e6add9463bdd47cb27e,WY,White/Causasian,<=35
427,QID785,388,"If while driving to work another car makes a careless maneuver , what emotion might you feel ?",E,road rage,5,"driving,car,careless,maneuver,emotion,feel","3,7,10,11,14,17",28,Latino/Hispanic,Male,Very well,PASSED,c908d7c4633c5e6add9463bdd47cb27e,WY,White/Causasian,<=35
428,QID787,389,Blowfish require what specific thing to live ?,A,sea water,1,"specific,thing,to,live","4,5,6,7",35,White/Caucasian,Male,Very well,PASSED,c961578f4c5768b67b843e5d2ce18452,WY,White/Causasian,<=35
429,QID787,389,Blowfish require what specific thing to live ?,A,body of water,4,"Blowfish,require,to,live","1,2,6,7",28,Latino/Hispanic,Male,Very well,PASSED,c961578f4c5768b67b843e5d2ce18452,WY,White/Causasian,<=35
430,QID789,390,What might someone do after they finish creating art ?,B,relax,2,"creating,art","8,9",23,White/Caucasian,Female,Very well,PASSED,cb5b39878be0e05a3ffe783801adbc3b,WY,White/Causasian,<=35
431,QID791,391,"He was at the gym trying to build muscle , what is it called that he is trying to build muscle on ?",E,human body,5,"he,is,trying,to,build,muscle,on","16,17,18,19,20,21,22",23,White/Caucasian,Female,Very well,PASSED,cb6766fb25daee911fc8e9816b98938c,WY,White/Causasian,<=35
432,QID793,392,"The hostess was good at her job , she always had a smile when she would what ?",C,welcome guests,3,good,4.0,23,White/Caucasian,Female,Very well,PASSED,cbf3dd48b4d591fc872a53cd4b9dd3af,WY,White/Causasian,<=35
