,QID,text_id,sentence,original_label,label,label_index,rationale,rationale_index,age,ethnicity,gender,english_proficiency,attentioncheck,originaldata_id,group_id,recruitment_ethnicity,recruitment_age
0,QID9,0,"Eating is part of living , but your body does n't use it all and the next day you will be doing what ?",E,defecating,5,"doing,what,?","22,23,24",34,White/Caucasian,Male,Well,PASSED,001b0f5a841fd81d13fbe67c7c7179d6,WY,White/Causasian,<=35
1,QID11,1,Where would you get a pen if you do not have one ?,C,briefcase,1,one,12.0,34,White/Caucasian,Male,Well,PASSED,004607228ad49b69eac932c1005d6106,WY,White/Causasian,<=35
2,QID13,2,"John is sitting in a toilet stall in a bathroom , outside he can hear cars going around in circles . What is the function of the place he is most likely at ?",C,race track,3,"sitting,in,a,toilet,stall","3,4,5,6,7",34,White/Caucasian,Male,Well,PASSED,008b7ba0c039f6d0d542c6c90aae173c,WY,White/Causasian,<=35
3,QID15,3,Where would you find a large dining room containing a fancy chandelier ?,A,mansion,1,"containing,a,fancy,chandelier","9,10,11,12",34,White/Caucasian,Male,Well,PASSED,01abce8c4964371d85a5be2019f75827,WY,White/Causasian,<=35
4,QID17,4,What happens to a dog before someone puts up posters of them ?,A,roll over,5,?,13.0,34,White/Caucasian,Male,Well,PASSED,01f01cc3ad152773ef42b30e926912bf,WY,White/Causasian,<=35
5,QID19,5,Where are horses judged on appearance ?,B,fair,2,"on,appearance","5,6",34,White/Caucasian,Male,Well,PASSED,026cb9c07a583ec933f2c4c67ae73836,WY,White/Causasian,<=35
6,QID21,6,How might a automobile get off a freeway ?,A,exit ramp,1,might,2.0,34,White/Caucasian,Male,Well,PASSED,02f43014a135cbd39f23b044c99de96e,WY,White/Causasian,<=35
7,QID23,7,Where are required to carry books all day ?,B,university,2,"are,required,to","2,3,4",34,White/Caucasian,Male,Well,PASSED,03f06f77aaf80b5f5e296ffbd11e9d82,WY,White/Causasian,<=35
8,QID25,8,"Nature can be good and bad for the person who walks , what are some things ?",B,getting lost,4,"good,and","4,5",34,White/Caucasian,Male,Well,PASSED,047c2d8c65d297b39aa42821c1ca76a9,WY,White/Causasian,<=35
9,QID27,9,What can you use to store a book while traveling ?,D,backpack,3,"use,to","4,5",34,White/Caucasian,Male,Well,PASSED,05490e6c191fbc3c2fe0033ed0bd8aa0,WY,White/Causasian,<=35
10,QID29,10,Where would stones not be arranged in a path ?,B,made from rocks,5,"not,be,arranged","4,5,6",22,White/Caucasian,Male,Very well,PASSED,056b33c7050c167b0d4348d40d169358,WY,White/Causasian,<=35
11,QID31,11,What do you use to carry your briefcase ?,E,hand,5,"carry,briefcase","6,8",22,White/Caucasian,Male,Very well,PASSED,0611dfbf5114084723d75f59b4f67412,WY,White/Causasian,<=35
12,QID33,12,John bought a new water hose . But he found his old one near his car . Where did he find the old one ?,D,garage,4,"hose,Where,he,find,the,old","6,18,20,21,22,23",22,White/Caucasian,Male,Very well,PASSED,061f326d2a87a10da6316b55bd5522bd,WY,White/Causasian,<=35
13,QID35,13,Joe plays a percussion instrument in something . What might be play in ?,D,orchestra,4,"instrument,What,might,play,in","5,9,10,12,13",22,White/Caucasian,Male,Very well,PASSED,07fd8b0aed06406fedb137d11b07a890,WY,White/Causasian,<=35
14,QID37,14,"His phone was dead and they could n't find the expressway , he opened up the glove compartment and handed his passenger the what to navigate ?",C,map,3,"handed,his,passenger,what,to,navigate","20,21,22,24,25,26",22,White/Caucasian,Male,Very well,PASSED,0843c51212a3c2eee660fab5648c9e19,WY,White/Causasian,<=35
15,QID39,15,Where would you find many varieties of plants including a rosebush ?,E,garder,2,"Where,would,you,find,many,varieties,of,plants","1,2,3,4,5,6,7,8",22,White/Caucasian,Male,Very well,PASSED,08d3175de59a639be02f2ebc032d56bd,WY,White/Causasian,<=35
16,QID41,16,"I am cold , what should I do to stay warm ?",B,light fire,2,"what,should,I,do,to,stay,warm","5,6,7,8,9,10,11",22,White/Caucasian,Male,Very well,PASSED,08d908ed723f813574992195d61386a2,WY,White/Causasian,<=35
17,QID43,17,What could happen to a cat other than wanting food ?,B,thirsty,2,"cat,other,than,wanting,food","6,7,8,9,10",22,White/Caucasian,Male,Very well,PASSED,094fe91b20b03c647325fa2ee94470b3,WY,White/Causasian,<=35
18,QID45,18,James was below the balloon . He watched it rise . What direction did he look in ?,E,upwards,5,"below,the,balloon,watched,it,rise,What,direction,did,he,look,in","3,4,5,8,9,10,12,13,14,15,16,17",22,White/Caucasian,Male,Very well,PASSED,0a006d16d9042e0c170935e5fbf7f9af,WY,White/Causasian,<=35
19,QID47,19,"I saw the receptionist carelessly toss my resume into the drawer , where did I want it to end up ?",D,file cabinet,1,"toss,my,resume,into,the,drawer,where,did,I,want,it,to,end,up","6,7,8,9,10,11,13,14,15,16,17,18,19,20",22,White/Caucasian,Male,Very well,PASSED,0a5c069836784c3d574828d85a20a074,WY,White/Causasian,<=35
20,QID49,20,"James was someone who was caught in his own delusions . To him , the truth did n't do what what ?",B,matter to,2,"his,own,delusions","8,9,10",25,White/Caucasian,Female,Well,PASSED,0b25bbd9e9aa976655e1975e31331709,WY,White/Causasian,<=35
21,QID51,21,Where could you find a shark before it was caught ?,B,tomales bay,2,"before,it,was,caught","7,8,9,10",25,White/Caucasian,Female,Well,PASSED,0b30831fb1862bc62339bdf930cbc447,WY,White/Causasian,<=35
22,QID53,22,Where would you put a dollar if you want to go to a store and buy something with it ?,D,pocket,4,"if,you,want,to,go,to,a,store","7,8,9,10,11,12,13,14",25,White/Caucasian,Female,Well,PASSED,0b52cc905fff0ca69a45e6353d10e401,WY,White/Causasian,<=35
23,QID55,23,A person would join a trade school for finding information related to what ?,D,degree,2,"trade,school","6,7",25,White/Caucasian,Female,Well,PASSED,0b5d0c3bafbe06dd5334c20cd8ea7fe2,WY,White/Causasian,<=35
24,QID57,24,What could people do that involves talking ?,A,confession,1,talking,7.0,25,White/Caucasian,Female,Well,PASSED,0bbb82c1dc4bfd3b0e0c409a0afd248b,WY,White/Causasian,<=35
25,QID59,25,Jim decided to lose weight . He thought that exercise is the best way to lose weight because you ca n't get rid of what ?,A,need for food,1,"you,ca,n't,get,rid,of","19,20,21,22,23,24",25,White/Caucasian,Female,Well,PASSED,0bed77da54b6c54facd0ee6614aad72e,WY,White/Causasian,<=35
26,QID61,26,What happens when to ice when it is in the sun ?,B,melted,2,"when,it,is,in,the,sun","6,7,8,9,10,11",25,White/Caucasian,Female,Well,PASSED,0bf4d64ad0eee7224acb3a4eb85accb2,WY,White/Causasian,<=35
27,QID63,27,"He looked at the field of pumps , all slowing churning oil out of the what ?",D,service station,5,"oil,out,of,the,what","12,13,14,15,16",25,White/Caucasian,Female,Well,PASSED,0c1efb38e023ee9725486fbec4f2d797,WY,White/Causasian,<=35
28,QID65,28,"The person signed up for home insurance , what is he seeking ?",A,financial security,1,insurance,7.0,25,White/Caucasian,Female,Well,PASSED,0c2fa15a02d0b6ca6707e98fac7589e4,WY,White/Causasian,<=35
29,QID67,29,"James and Holly went dancing together . As they danced , he pressed himself against her what ?",B,moving body,2,"pressed,himself,against,her","13,14,15,16",25,White/Caucasian,Female,Well,PASSED,0cba8ddda21e29c8c53482e131d741cd,WY,White/Causasian,<=35
30,QID69,30,"He was n't the hugging type , even when he meet friend he 'd just do what ?",E,handshake,5,friend,12.0,29,White/Caucasian,Male,Very well,PASSED,0df3f58645b4bc306093845fb297a50e,WY,White/Causasian,<=35
31,QID71,31,"If you wanted a license to catch crabs , what government office would you go to ?",B,fish department,2,crabs,8.0,29,White/Caucasian,Male,Very well,PASSED,0e5c7c0cec5b693e52f74f5f879d84fb,WY,White/Causasian,<=35
32,QID73,32,What might someone believe in if they are cleaning clothes ?,B,sanitation,2,cleaning,9.0,29,White/Caucasian,Male,Very well,PASSED,0e80f2afe5c4f652e8720b52d7c06c87,WY,White/Causasian,<=35
33,QID75,33,"Ficus can be planted in a yard to make summer more bearable , what sort of areas do they create ?",A,shady places,1,summer,10.0,29,White/Caucasian,Male,Very well,PASSED,0f0e339412f719a019bf373e6daf2530,WY,White/Causasian,<=35
34,QID77,34,What animal has quills all over it ?,E,calligraphy,3,animal,2.0,29,White/Caucasian,Male,Very well,PASSED,0f2377604e628c55ba588366139396b9,WY,White/Causasian,<=35
35,QID79,35,What is the opposite of an area of elevation ?,C,depression,3,"opposite,elevation","4,9",29,White/Caucasian,Male,Very well,PASSED,0f54a1ee30a0034a3d2db1bfdef9ca85,WY,White/Causasian,<=35
36,QID81,36,Most items in retail stores are what even when they are on sale ?,A,overpriced,1,"on,sale","12,13",29,White/Caucasian,Male,Very well,PASSED,0f7419d25337e0a75503a015ae777905,WY,White/Causasian,<=35
37,QID83,37,"Marathoners feel fatigued after running twenty six miles , but some that have pushed them self too hard might be prone to what ?",B,passing out,2,"Marathoners,twenty,six,miles","1,6,7,8",29,White/Caucasian,Male,Very well,PASSED,0f7425ecbe369bf41a230aab92d84132,WY,White/Causasian,<=35
38,QID85,38,Printing on a printer can get expensive because it does what ?,B,use paper,2,expensive,7.0,29,White/Caucasian,Male,Very well,PASSED,0f79faf5337706f2e0e39c15bbd2e99a,WY,White/Causasian,<=35
39,QID87,39,"She wanted to get in shape , but she could n't stay focused on the hour long what ?",C,work out,3,"in,shape","5,6",29,White/Caucasian,Male,Very well,PASSED,1017807310a25d3ea4a4ec305e91cba3,WY,White/Causasian,<=35
40,QID89,40,How would you express information to a deaf person ?,C,write down,3,"express,information,to,deaf,person","4,5,6,8,9",25,White/Caucasian,Male,Very well,PASSED,114d310d1198abffaf8b88dab5a55aa7,WY,White/Causasian,<=35
41,QID91,41,In the building where James worked there was a small mezzanine in the auditorium to make more space for seats . Where might James work ?,A,concert hall,3,"building,where,worked,small,mezzanine,auditorium,seats","3,4,6,10,11,14,20",25,White/Caucasian,Male,Very well,PASSED,1272e693cf9152e7ac71095c643676b5,WY,White/Causasian,<=35
42,QID93,42,What will happen to someone if his or her spirits can not elevate ?,C,depress,3,"happen,someone,spirits,can,not,elevate","3,5,10,11,12,13",25,White/Caucasian,Male,Very well,PASSED,129ec46cc2541b73198d774ee632c8d7,WY,White/Causasian,<=35
43,QID95,43,What type of feeling is performing for the first time likely to produce ?,E,butterflies,2,"feeling,performing,for,first,time","4,6,7,9,10",25,White/Caucasian,Male,Very well,PASSED,14309d9bd3c13d1c0efb625198f6304a,WY,White/Causasian,<=35
44,QID97,44,"The painter started to edge the room with tape , he always took extra care to make the lines clean and crisp when working with an what ?",E,corner,3,"painter,edge,room,tape,extra,care,lines,crisp","2,5,7,9,14,15,19,22",25,White/Caucasian,Male,Very well,PASSED,14d760e43728e9e4643c414627f2b596,WY,White/Causasian,<=35
45,QID99,45,If a person is trying to keep something in their hand what should they do ?,E,have to hold,5,"person,keep,something,in,hand","3,7,8,9,11",25,White/Caucasian,Male,Very well,PASSED,15798a23ee6952fedd6d202064069126,WY,White/Causasian,<=35
46,QID101,46,What is a form of anaerobic exercising ?,E,lift weights,2,"form,anaerobic,exercising","4,6,7",25,White/Caucasian,Male,Very well,PASSED,159d50e325b59c6d29ec371500e173b4,WY,White/Causasian,<=35
47,QID103,47,Why are dogs often known as man 's best friend ?,C,very loyal,3,"Why,dogs,man,best,friend","1,3,7,9,10",25,White/Caucasian,Male,Very well,PASSED,15b090801256085ad465e74af47cbee9,WY,White/Causasian,<=35
48,QID105,48,Diving into backyard pools can be very dangerous and can lead to serious head and what ?,E,spinal injuries,5,"Diving,pools,dangerous,lead,to,serious","1,4,8,11,12,13",25,White/Caucasian,Male,Very well,PASSED,15c38f66e811d6ed68cde931bc31d93c,WY,White/Causasian,<=35
49,QID107,49,"Where can you buy a magazine , paper or gum ?",D,newsstand,4,"Where,buy,magazine,paper,gum","1,4,6,8,10",25,White/Caucasian,Male,Very well,PASSED,167d2cfa04bfaea0e0b5bac3598d5769,WY,White/Causasian,<=35
50,QID109,50,What do you need to wear when hiking ?,C,physical exertion,2,"when,hiking","7,8",19,White/Caucasian,Male,Very well,PASSED,1729c737ff92cf558efecde2c6cafc5e,WY,White/Causasian,<=35
51,QID111,51,"If a storey contained a panoramic view , what kind of structure would it be in ?",D,mall,3,"panoramic,view,kind,of,structure,in","6,7,10,11,12,16",19,White/Caucasian,Male,Very well,PASSED,179fff4b5928e5ac3d3ae3e1db782547,WY,White/Causasian,<=35
52,QID113,52,What could you be a few hours after you finish cashing in due to your cash ?,A,happy,1,"you,be,cashing,in","3,4,11,12",19,White/Caucasian,Male,Very well,PASSED,1875f70cf736c68c7a9df3ef870224a1,WY,White/Causasian,<=35
53,QID115,53,Who might wear dark glasses indoors ?,A,blind person,1,indoors,6.0,19,White/Caucasian,Male,Very well,PASSED,18844d3aa4e52b331b5382c8244cf4db,WY,White/Causasian,<=35
54,QID117,54,Metal is taken from what which is pulled from the ground ?,C,ore,3,"pulled,from,the,ground","8,9,10,11",19,White/Caucasian,Male,Very well,PASSED,18ee7a93410a6b4c9cec5d4894775991_1,WY,White/Causasian,<=35
55,QID119,55,"Bob 's only light source was a small bulb . There were four walls , if there was a door he could n't see it . What was Bob in ?",A,house,5,"There,were,four,walls","11,12,13,14",19,White/Caucasian,Male,Very well,PASSED,191e3c676f05a11d6b2565d8c27d2001,WY,White/Causasian,<=35
56,QID121,56,During a shark filled tornado where should you not be ?,E,outside,5,"shark,filled,tornado","3,4,5",19,White/Caucasian,Male,Very well,PASSED,194b66240f6fab75749c1e30ed09ea09,WY,White/Causasian,<=35
57,QID123,57,What type of store would have lots of sports equipment ?,D,sporting goods store,4,"sports,equipment","9,10",19,White/Caucasian,Male,Very well,PASSED,19dfd55e967dacd6f5700a62c1e14eee,WY,White/Causasian,<=35
58,QID125,58,What is it called when a person with mental illness is able to lead a relatively normal life ?,A,managed,1,"lead,a,relatively,normal,life","14,15,16,17,18",19,White/Caucasian,Male,Very well,PASSED,1a4e83b433620cb2d7d806882f8d57e4,WY,White/Causasian,<=35
59,QID127,59,"You have to a lot of thinking while studying a new subject , but it is how you gain what ?",E,knowledge,5,"how,you,gain,what","17,18,19,20",19,White/Caucasian,Male,Very well,PASSED,1a8fbab20bbdf0bbf3961894662d5f7c,WY,White/Causasian,<=35
60,QID129,60,Where would one find a snake in a cage ?,D,pet store,4,"a,cage","8,9",20,White/Caucasian,Male,Very well,PASSED,1ac54dbf6b67f27daa3d456416047584,WY,White/Causasian,<=35
61,QID131,61,What would someone use a personal key for ?,C,own home,3,personal,6.0,20,White/Caucasian,Male,Very well,PASSED,1b3d286458a7e7f069222de0376d06da,WY,White/Causasian,<=35
62,QID133,62,What do you do when you 're in a new place and want to see new things ?,B,new experience,5,"new,place,new,things","10,11,16,17",20,White/Caucasian,Male,Very well,PASSED,1caf93d6a22dc8190e19c14bbe1fafda,WY,White/Causasian,<=35
63,QID135,63,"He was trying to procreate with many individuals , this led to a what ?",D,std,4,"procreate,individuals,what","5,8,14",20,White/Caucasian,Male,Very well,PASSED,1cd94405124031e8681cd12bd25e2d61,WY,White/Causasian,<=35
64,QID137,64,What could happen if someone is seeing new presents at a birthday party ?,E,excitement,5,"new,presents,birthday,party","8,9,12,13",20,White/Caucasian,Male,Very well,PASSED,1e09c3136a743b862e783700b7667028,WY,White/Causasian,<=35
65,QID139,65,What would you put coins into to make it work ?,B,water fountain,2,"coins,into","5,6",20,White/Caucasian,Male,Very well,PASSED,1e939cc6fef999953d692b57caab254b,WY,White/Causasian,<=35
66,QID141,66,Where would you borrow furniture if you do not have any ?,B,neighbor 's house,2,"borrow,furniture,not,have,any","4,5,9,10,11",20,White/Caucasian,Male,Very well,PASSED,1ef68db97654f30cd3701b942fadc934,WY,White/Causasian,<=35
67,QID143,67,"Steve thought that it was possible , but he agreed that it was what ?",C,unlikely,3,"he,agreed,that,it,was,what","9,10,11,12,13,14",20,White/Caucasian,Male,Very well,PASSED,1f492f556fae64f72ce36b6caa242dd0,WY,White/Causasian,<=35
68,QID145,68,"The man acted ridiculous at the funeral , what attitude should he have taken ?",C,serious,2,"ridiculous,what,attitude","4,9,10",20,White/Caucasian,Male,Very well,PASSED,1fcc547e4e6813afc1a66717248d6c62,WY,White/Causasian,<=35
69,QID147,69,What are cats often known for ?,E,sharp claws,5,"often,known","4,5",20,White/Caucasian,Male,Very well,PASSED,1fe90a4aee405e1aa2279442d28803ae,WY,White/Causasian,<=35
70,QID149,70,In what kind of environment does an anemone live ?,D,atlantic ocean,5,"anemone,live","8,9",20,White/Caucasian,Male,Not well,PASSED,20a3bb788cf408d9a3e25e610fe60905,WY,White/Causasian,<=35
71,QID151,71,"If you really wanted a grape , where would you go to get it ?",B,fruit stand,2,"grape,where,would,you,go,to,get,it","6,8,9,10,11,12,13,14",20,White/Caucasian,Male,Not well,PASSED,21ce6f7c5c3d1ad8cf234988c1ad471f,WY,White/Causasian,<=35
72,QID153,72,"The cat carefully navigated the area , they do everything they can to avoid what ?",A,falling,3,"cat,everything,they,can,to,avoid","2,10,11,12,13,14",20,White/Caucasian,Male,Not well,PASSED,21e312c7fd1a52341ce35b66457eab36,WY,White/Causasian,<=35
73,QID155,73,Where is one likely to find a brownstone ?,A,new york city,1,brownstone,8.0,20,White/Caucasian,Male,Not well,PASSED,21fb76bd8349628b441c76f47c33e77b,WY,White/Causasian,<=35
74,QID157,74,What are you getting from you boss at the end of the week ?,B,money,2,"getting,from,you,boss","4,5,6,7",20,White/Caucasian,Male,Not well,PASSED,225287e06c993feee34e0f06b25f6ba8,WY,White/Causasian,<=35
75,QID159,75,Where do most people turn to get information on their phones ?,D,google,4,"people,get,information,on,their,phones","4,7,8,9,10,11",20,White/Caucasian,Male,Not well,PASSED,236691d38665d7bcdd0c9b9834252a51,WY,White/Causasian,<=35
76,QID161,76,What do professors primarily do ?,E,teach courses,5,"professors,primarily,do","3,4,5",20,White/Caucasian,Male,Not well,PASSED,23d97480fe45bace231503f8fc367a5b,WY,White/Causasian,<=35
77,QID163,77,"I 'm having some food at my party , what will I need to serve it ?",E,bowl,3,"food,at,my,party","5,6,7,8",20,White/Caucasian,Male,Not well,PASSED,24ceaf5c10863e73919b5f1b0f2db38e,WY,White/Causasian,<=35
78,QID165,78,To see new films you must ?,B,open eyes,1,see,2.0,20,White/Caucasian,Male,Not well,PASSED,2509fdd7d94afe9d0c021654ce0ba93f,WY,White/Causasian,<=35
79,QID167,79,What could you use to fill a cup and then drink from it ?,D,water fountain,4,"fill,a,cup,drink","6,7,8,11",20,White/Caucasian,Male,Not well,PASSED,25136807f7b2e78b115698daa1677b4a,WY,White/Causasian,<=35
80,QID169,80,"She loved spending money at the thrift store on knickknacks , this resulted in a lot of what on every shelf in her house ?",B,clutter,2,"She,loved,thrift,knickknacks","1,2,7,10",27,White/Caucasian,Male,Very well,PASSED,2632ff6c9b781d3aa74e8dd36b990871,WY,White/Causasian,<=35
81,QID171,81,What would you need if you want to smoke ?,D,cigarette,4,"What,need,want,to,smoke","1,4,7,8,9",27,White/Caucasian,Male,Very well,PASSED,26bd85f05d29863ed777a4f1a4b8fa63,WY,White/Causasian,<=35
82,QID173,82,Why do people who are dying receive social security payments ?,D,unable to work,4,"people,dying,receive,social,security,payments","3,6,7,8,9,10",27,White/Caucasian,Male,Very well,PASSED,26c8a7165d0ed7250b9328f90d83ba83,WY,White/Causasian,<=35
83,QID175,83,"The man tried to reply to the woman , but he had difficulty keeping track of conversations that he did n't do what to ?",A,question,3,"man,tried,reply,woman,but,difficulty,conversations,did","2,3,5,8,10,13,17,20",27,White/Caucasian,Male,Very well,PASSED,26ce83b8e9a263079aa8cdbd5258d667,WY,White/Causasian,<=35
84,QID177,84,Where might you see a green field while driving ?,D,farmland,3,"might,you,field,while,driving","2,3,7,8,9",27,White/Caucasian,Male,Very well,PASSED,26d7d59ef7b9f2e0c2d47419fa5bca91,WY,White/Causasian,<=35
85,QID179,85,What can disease destroy ?,C,human body,3,"disease,destroy","3,4",27,White/Caucasian,Male,Very well,PASSED,2729d8502208c25d8e9293cd4e8ecbb5,WY,White/Causasian,<=35
86,QID181,86,Where could you find hundreds of thousands of home ?,D,city or town,4,"Where,hundreds,thousands,home","1,5,7,9",27,White/Caucasian,Male,Very well,PASSED,273d0134e8ce53d4ebcf41ca7fde02af,WY,White/Causasian,<=35
87,QID183,87,When you need to rest it 's often because you have been doing what ?,E,using energy,5,"When,need,rest,often,what","1,3,5,8,14",27,White/Caucasian,Male,Very well,PASSED,275c859994f7d3acd3c8863be591ab2c,WY,White/Causasian,<=35
88,QID185,88,Where would you put a plate immediately after eating from it ?,D,dishwasher,4,"Where,put,immediately,eating,from","1,4,7,9,10",27,White/Caucasian,Male,Very well,PASSED,28357ebf85f8bb82b6a3210c4397e0aa,WY,White/Causasian,<=35
89,QID187,89,Where is a lake likely to be glacial ?,D,mountains,4,"Where,lake,likely,glacial","1,4,5,8",27,White/Caucasian,Male,Very well,PASSED,2982d0eae1bf880f5930341af7665716,WY,White/Causasian,<=35
90,QID189,90,"A potato is kept in the cellar , where is likely to be stored ?",D,bushel basket,4,"potato,cellar,likely,stored","2,7,11,14",23,White/Caucasian,Female,Well,PASSED,29c2cc0ba85b4afb9c9d29801469a68f,WY,White/Causasian,<=35
91,QID191,91,The old style pop ups literally let you see the story when you did what ?,C,visualize,2,"old,pop,ups,story","2,4,5,11",23,White/Caucasian,Female,Well,PASSED,2a0e82bbf1471290c93c8f2a11af197f,WY,White/Causasian,<=35
92,QID193,92,How is riding a bike getting it to move ?,E,pedalling,5,"riding,bike,move","3,5,9",23,White/Caucasian,Female,Well,PASSED,2a21820a135e1a49883525c055c74a0b,WY,White/Causasian,<=35
93,QID195,93,What could happen to you after you are cleaning house for a long time ?,D,exhaustion,4,"cleaning,house,long,time","9,10,13,14",23,White/Caucasian,Female,Well,PASSED,2adbb4fc0d5249dc411dda433f378591,WY,White/Causasian,<=35
94,QID197,94,"At the new comic store he found himself making friends , it was nice to meet people with what ?",D,common interests,4,"comic,store,making,friends","4,5,9,10",23,White/Caucasian,Female,Well,PASSED,2b416120e2fbd84b44b5dcd4eb42ed5c,WY,White/Causasian,<=35
95,QID199,95,Where can one obtain a bass fiddle ?,E,music store,5,"obtain,bass,fiddle","4,6,7",23,White/Caucasian,Female,Well,PASSED,2b7dd91da5dde1560ace2cd82af926de,WY,White/Causasian,<=35
96,QID201,96,Who is the guard here for ?,D,prisoner,4,"guard,here,for","4,5,6",23,White/Caucasian,Female,Well,PASSED,2b9b625c788584b8d41f1a74d740e126,WY,White/Causasian,<=35
97,QID203,97,"They children loved having a back yard , and the parents loved that it was a safe what ?",B,property,5,"back,yard,parents,loved,safe","6,7,11,12,17",23,White/Caucasian,Female,Well,PASSED,2c9f4a98ce774cd734b6e384d95051a7,WY,White/Causasian,<=35
98,QID205,98,What type of geographic area will you find a marmot ?,A,mountainous area,1,"geographic,area,marmot","4,5,10",23,White/Caucasian,Female,Well,PASSED,2d2b69ad187b7c40273ab13caab7dc19,WY,White/Causasian,<=35
99,QID207,99,"The man laid on the soft moss and looked up at the trees , where was the man ?",B,forest,2,"soft,moss,trees","6,7,13",23,White/Caucasian,Female,Well,PASSED,2d3c9d3dff1a7a8253180cb3de1ceeea,WY,White/Causasian,<=35
100,QID209,100,"If you take the risk buying a used car , you still hope it can what ?",E,last several years,5,"risk,buying,used,car,still,hope","5,6,8,9,12,13",25,White/Caucasian,Female,Very well,PASSED,2dd138a63b5895cf737ced793cc668e7,WY,White/Causasian,<=35
101,QID211,101,Sally was afraid of danger and always double checked what ?,D,being safe,3,"afraid,of,danger,double,checked","3,4,5,8,9",25,White/Caucasian,Female,Very well,PASSED,2ef2ae21a2d3a9ecbd5c45ff378d10e3,WY,White/Causasian,<=35
102,QID213,102,"Playing baseball is a lot like any other sport , there is always a risk of what ?",D,injury,4,"baseball,risk","2,15",25,White/Caucasian,Female,Very well,PASSED,2f0931adc3d0d422d9ab6264395e89d8,WY,White/Causasian,<=35
103,QID215,103,Where would you be concerned about finding a cavity ?,E,teeth,5,"be,concerned,finding,cavity","4,5,7,9",25,White/Caucasian,Female,Very well,PASSED,2f1680da0d388a8453150ff3637e4689,WY,White/Causasian,<=35
104,QID217,104,"The man tried to break the glass in order to make his escape in time , but he could not . The person in the cat , trying to kill him , did what ?",A,accelerate,1,"tried,to,break,the,glass,escape,in,time,but,could,not,person,kill","3,4,5,6,7,13,14,15,17,19,20,23,30",25,White/Caucasian,Female,Very well,PASSED,2f85d53721ccc8b3fa4cfc184186d124,WY,White/Causasian,<=35
105,QID219,105,What does someone do to relax at night ?,D,go to bed,4,"to,relax,at,night","5,6,7,8",25,White/Caucasian,Female,Very well,PASSED,300bd7704ae8c5fcef618902f18fd01d,WY,White/Causasian,<=35
106,QID221,106,"I could n't find anybody who recalled the event , what were they adroit at doing ?",E,forget,5,"could,n't,find,anybody,recalled,adroit,at,doing","2,3,4,5,7,14,15,16",25,White/Caucasian,Female,Very well,PASSED,30138608d4934a75cf0911a06b021374,WY,White/Causasian,<=35
107,QID223,107,"Jan tested the current , and noticed that it was high . He thought that the wires might have too much what ?",D,resistance,4,"tested,the,current,high,wires","2,3,4,11,17",25,White/Caucasian,Female,Very well,PASSED,30e66db11e0257a14a17108b90cd69fb,WY,White/Causasian,<=35
108,QID225,108,What type of non - vegetarian soup is one likely to find a potato ?,C,beef stew,1,"type,non,vegetarian,soup,likely,find,potato","2,4,6,7,10,12,14",25,White/Caucasian,Female,Very well,PASSED,313d033c33ec475e04e628f87c5686bd,WY,White/Causasian,<=35
109,QID227,109,Where is a likely place to store unused soap ?,A,cabinet,1,"likely,place,store,unused,soap","4,5,7,8,9",25,White/Caucasian,Female,Very well,PASSED,31487ab8b1e8f12e252590cc58bd19c2,WY,White/Causasian,<=35
110,QID229,110,Where is the control room that controls a PWR located ?,E,nuclear power plant,5,"that,controls,a,PWR,located","6,7,8,9,10",24,White/Caucasian,Female,Well,PASSED,315baf79f8dd3673f67a90de0758240e,WY,White/Causasian,<=35
