,QID,text_id,sentence,original_label,label,label_index,rationale,rationale_index,age,ethnicity,gender,english_proficiency,attentioncheck,originaldata_id,group_id,recruitment_ethnicity,recruitment_age,sst2_id,sst2_split,rationale_binary
156,QID557,19,"What makes How I Killed My Father compelling, besides its terrific performances, is Fontaine's willingness to wander into the dark areas of parent-child relationships without flinching.",positive,positive,1,"compelling,,wander,without,flinching.","[7, 16, 24, 25]",58,White/Caucasian,Female,Well,PASSED,335,WO,White/Causasian,>=38,22843,train,"[0, 0, 0, 0, 0, 0, 0, 1, 0, 0, 0, 0, 0, 0, 0, 0, 1, 0, 0, 0, 0, 0, 0, 0, 1, 1]"
157,QID525,3,Exudes the fizz of a Busby Berkeley musical and the visceral excitement of a sports extravaganza.,positive,positive,1,"fizz,visceral,excitement","[2, 10, 11]",45,White/Caucasian,Female,Very well,PASSED,305,WO,White/Causasian,>=38,22941,train,"[0, 0, 1, 0, 0, 0, 0, 0, 0, 0, 1, 1, 0, 0, 0, 0]"
158,QID931,206,"A dim-witted and lazy spin-off of the Animal Planet documentary series, Crocodile Hunter is entertainment opportunism at its most glaring.",negative,negative,2,"A,dim-witted,and,lazy,spin-off,entertainment,opportunism,at,its,most,glaring.","[0, 1, 2, 3, 4, 14, 15, 16, 17, 18, 19]",40,White/Caucasian,Female,Very well,PASSED,610,WO,White/Causasian,>=38,23110,train,"[1, 1, 1, 1, 1, 0, 0, 0, 0, 0, 0, 0, 0, 0, 1, 1, 1, 1, 1, 1]"
159,QID969,225,Godard's ode to tackling life's wonderment is a rambling and incoherent manifesto about the vagueness of topical excess... In Praise of Love remains a ponderous and pretentious endeavor that's unfocused and tediously exasperating.,negative,negative,2,"rambling,incoherent,vagueness,pretentious,unfocused,tediously,exasperating.","[8, 10, 14, 26, 29, 31, 32]",43,White/Caucasian,Male,Very well,PASSED,644,WO,White/Causasian,>=38,23957,train,"[0, 0, 0, 0, 0, 0, 0, 0, 1, 0, 1, 0, 0, 0, 1, 0, 0, 0, 0, 0, 0, 0, 0, 0, 0, 0, 1, 0, 0, 1, 0, 1, 1]"
160,QID949,215,"This is an extraordinary film, not least because it is Japanese and yet feels universal.",positive,positive,1,"extraordinary,film,","[3, 4]",39,White/Caucasian,Male,Very well,PASSED,623,WO,White/Causasian,>=38,24602,train,"[0, 0, 0, 1, 1, 0, 0, 0, 0, 0, 0, 0, 0, 0, 0]"
161,QID597,39,... something appears to have been lost in the translation this time.,negative,negative,2,"lost,in,the,translation","[6, 7, 8, 9]",38,White/Caucasian,Female,Very well,PASSED,359,WO,White/Causasian,>=38,24731,train,"[0, 0, 0, 0, 0, 0, 1, 1, 1, 1, 0, 0]"
162,QID697,89,"Thanks to a small star with big heart, this family film sequel is plenty of fun for all.",positive,positive,1,"small,star,with,big,heart,","[3, 4, 5, 6, 7]",47,White/Caucasian,Male,Well,PASSED,432,WO,White/Causasian,>=38,24787,train,"[0, 0, 0, 1, 1, 1, 1, 1, 0, 0, 0, 0, 0, 0, 0, 0, 0, 0]"
163,QID1041,261,"Bray is completely at sea; with nothing but a Savage Garden music video on his resume, he has no clue about making a movie.",negative,negative,2,"nothing,on,his,resume,,he,has,no,clue,about,making,a,movie.","[6, 13, 14, 15, 16, 17, 18, 19, 20, 21, 22, 23]",42,White/Caucasian,Female,Well,PASSED,696,WO,White/Causasian,>=38,24788,train,"[0, 0, 0, 0, 0, 0, 1, 0, 0, 0, 0, 0, 0, 1, 1, 1, 1, 1, 1, 1, 1, 1, 1, 1]"
164,QID759,120,A small movie with a big impact.,positive,positive,1,"big,impact.","[5, 6]",52,White/Caucasian,Female,Very well,PASSED,471,WO,White/Causasian,>=38,24949,train,"[0, 0, 0, 0, 0, 1, 1]"
165,QID991,236,"Co-writer/director Jonathan Parker's attempts to fashion a Brazil-like, hyper-real satire fall dreadfully short.",negative,negative,2,"fall,dreadfully,short.","[10, 11, 12]",41,White/Caucasian,Female,Very well,PASSED,662,WO,White/Causasian,>=38,25097,train,"[0, 0, 0, 0, 0, 0, 0, 0, 0, 0, 1, 1, 1]"
166,QID993,237,"An amateurish, quasi-improvised acting exercise shot on ugly digital video.",negative,negative,2,"amateurish,,quasi-improvised,ugly","[1, 2, 7]",41,White/Caucasian,Female,Very well,PASSED,663,WO,White/Causasian,>=38,25253,train,"[0, 1, 1, 0, 0, 0, 0, 1, 0, 0]"
167,QID579,30,"At times, the movie looks genuinely pretty.",positive,positive,1,"looks,genuinely,pretty.","[4, 5, 6]",38,White/Caucasian,Female,Very well,PASSED,347,WO,White/Causasian,>=38,25338,train,"[0, 0, 0, 0, 1, 1, 1]"
168,QID901,191,This stuck pig of a movie flails limply between bizarre comedy and pallid horror.,negative,negative,2,"stuck,pig,of,a,movie,bizarre,pallid","[1, 2, 3, 4, 5, 9, 12]",41,White/Caucasian,Female,Very well,PASSED,577,WO,White/Causasian,>=38,25694,train,"[0, 1, 1, 1, 1, 1, 0, 0, 0, 1, 0, 0, 1, 0]"
169,QID881,181,The most compelling performance of the year adds substantial depth to this shocking testament to anti-Semitism and neo-fascism.,positive,positive,1,"most,compelling,performance","[1, 2, 3]",67,White/Caucasian,Male,Very well,PASSED,559,WO,White/Causasian,>=38,26146,train,"[0, 1, 1, 1, 0, 0, 0, 0, 0, 0, 0, 0, 0, 0, 0, 0, 0, 0]"
170,QID977,229,"Devos and Cassel have tremendous chemistry -- their sexual and romantic tension, while never really vocalized, is palpable.",positive,positive,1,"tremendous,chemistry","[4, 5]",43,White/Caucasian,Male,Very well,PASSED,651,WO,White/Causasian,>=38,26550,train,"[0, 0, 0, 0, 1, 1, 0, 0, 0, 0, 0, 0, 0, 0, 0, 0, 0, 0]"
171,QID681,81,"No French people were harmed during the making of this movie, but they were insulted and the audience was put through torture for an hour and a half.",negative,negative,2,"they,were,insulted,and,the,audience,was,put,through,torture,for,an,hour,and,a,half.","[12, 13, 14, 15, 16, 17, 18, 19, 20, 21, 22, 23, 24, 25, 26, 27]",47,White/Caucasian,Male,Well,PASSED,419,WO,White/Causasian,>=38,27443,train,"[0, 0, 0, 0, 0, 0, 0, 0, 0, 0, 0, 0, 1, 1, 1, 1, 1, 1, 1, 1, 1, 1, 1, 1, 1, 1, 1, 1]"
172,QID585,33,"Sparkling, often hilarious romantic jealousy comedy... Attal looks so much like a young Robert DeNiro that it seems the film should instead be called `My Husband Is Travis Bickle'.",positive,no sentiment,3,"romantic,jealousy,comedy...","[3, 4, 5]",38,White/Caucasian,Female,Very well,PASSED,351,WO,White/Causasian,>=38,27502,train,"[0, 0, 0, 1, 1, 1, 0, 0, 0, 0, 0, 0, 0, 0, 0, 0, 0, 0, 0, 0, 0, 0, 0, 0, 0, 0, 0, 0, 0]"
173,QID925,203,"This enthralling documentary... is at once playful and haunting, an in-depth portrait of an iconoclastic artist who was fundamentally unknowable even to his closest friends.",positive,positive,1,"enthralling,documentary...,playful,haunting,","[1, 2, 6, 8]",40,White/Caucasian,Female,Very well,PASSED,603,WO,White/Causasian,>=38,27544,train,"[0, 1, 1, 0, 0, 0, 1, 0, 1, 0, 0, 0, 0, 0, 0, 0, 0, 0, 0, 0, 0, 0, 0, 0, 0]"
174,QID821,151,"It's difficult to conceive of anyone who has reached puberty actually finding the characters in Slackers or their antics amusing, let alone funny.",negative,negative,2,"amusing,,let,alone,funny.","[19, 20, 21, 22]",39,White/Caucasian,Female,Very well,PASSED,513,WO,White/Causasian,>=38,27649,train,"[0, 0, 0, 0, 0, 0, 0, 0, 0, 0, 0, 0, 0, 0, 0, 0, 0, 0, 0, 1, 1, 1, 1]"
175,QID1027,254,"This picture is murder by numbers, and as easy to be bored by as your ABC's, despite a few whopping shootouts.",negative,negative,2,bored,[11],42,White/Caucasian,Female,Well,PASSED,686,WO,White/Causasian,>=38,27797,train,"[0, 0, 0, 0, 0, 0, 0, 0, 0, 0, 0, 1, 0, 0, 0, 0, 0, 0, 0, 0, 0]"
176,QID707,94,What should have been a cutting Hollywood satire is instead about as fresh as last week's issue of Variety.,negative,no sentiment,3,"instead,as,as,issue,of,Variety.","[9, 11, 13, 16, 17, 18]",46,White/Caucasian,Female,Very well,PASSED,441,WO,White/Causasian,>=38,28024,train,"[0, 0, 0, 0, 0, 0, 0, 0, 0, 1, 0, 1, 0, 1, 0, 0, 1, 1, 1]"
177,QID625,53,... a bland murder-on-campus yawner.,negative,no sentiment,3,"a,bland,murder-on-campus,yawner.","[1, 2, 3, 4]",50,White/Caucasian,Female,Very well,PASSED,380,WO,White/Causasian,>=38,28089,train,"[0, 1, 1, 1, 1]"
178,QID845,163,"A thoroughly awful movie -- dumb, narratively chaotic, visually sloppy... a weird amalgam of `The Thing' and a geriatric `Scream.'",negative,negative,2,"thoroughly,awful,dumb,,chaotic,,sloppy...,weird,amalgam","[1, 2, 5, 7, 9, 11, 12]",41,White/Caucasian,Female,Very well,PASSED,529,WO,White/Causasian,>=38,28444,train,"[0, 1, 1, 0, 0, 1, 0, 1, 0, 1, 0, 1, 1, 0, 0, 0, 0, 0, 0, 0]"
179,QID777,129,Audiard successfully maintains suspense on different levels throughout a film that is both gripping and compelling.,positive,positive,1,"successfully,maintains,suspense,gripping,compelling.","[1, 2, 3, 13, 15]",52,White/Caucasian,Female,Very well,PASSED,485,WO,White/Causasian,>=38,29160,train,"[0, 1, 1, 1, 0, 0, 0, 0, 0, 0, 0, 0, 0, 1, 0, 1]"
180,QID565,23,Crush could be the worst film a man has made about women since Valley of the Dolls.,negative,negative,2,worst,[4],66,White/Caucasian,Female,Very well,PASSED,339,WO,White/Causasian,>=38,29269,train,"[0, 0, 0, 0, 1, 0, 0, 0, 0, 0, 0, 0, 0, 0, 0, 0, 0]"
181,QID915,198,A movie so bad that it quickly enters the pantheon of wreckage that includes Battlefield Earth and Showgirls.,negative,negative,2,"A,movie,so,bad,pantheon,of,wreckage","[0, 1, 2, 3, 9, 10, 11]",41,White/Caucasian,Female,Very well,PASSED,595,WO,White/Causasian,>=38,29702,train,"[1, 1, 1, 1, 0, 0, 0, 0, 0, 1, 1, 1, 0, 0, 0, 0, 0, 0]"
182,QID1033,257,"Starts out mediocre, spirals downward, and thuds to the bottom of the pool with an utterly incompetent conclusion.",negative,negative,2,"mediocre,,downward,,bottom,incompetent,conclusion.","[2, 4, 9, 16, 17]",42,White/Caucasian,Female,Well,PASSED,691,WO,White/Causasian,>=38,29721,train,"[0, 0, 1, 0, 1, 0, 0, 0, 0, 1, 0, 0, 0, 0, 0, 0, 1, 1]"
183,QID611,46,"Whatever heartwarming scene the impressively discreet filmmakers may have expected to record with their mini DV, they show a remarkable ability to document both sides of this emotional car-wreck.",positive,positive,1,"they,show,a,remarkable,ability,to","[16, 17, 18, 19, 20, 21]",52,White/Caucasian,Female,Well,PASSED,371,WO,White/Causasian,>=38,30034,train,"[0, 0, 0, 0, 0, 0, 0, 0, 0, 0, 0, 0, 0, 0, 0, 0, 1, 1, 1, 1, 1, 1, 0, 0, 0, 0, 0, 0, 0]"
184,QID627,54,In comparison to his earlier films it seems a disappointingly thin slice of lower-class London life; despite the title... amounts to surprisingly little.,negative,negative,2,"disappointingly,despite,the,title...","[9, 16, 17, 18]",50,White/Caucasian,Female,Very well,PASSED,381,WO,White/Causasian,>=38,30183,train,"[0, 0, 0, 0, 0, 0, 0, 0, 0, 1, 0, 0, 0, 0, 0, 0, 1, 1, 1, 0, 0, 0, 0]"
185,QID963,222,An exhilarating experience.,positive,positive,1,"exhilarating,experience.","[1, 2]",43,White/Caucasian,Male,Very well,PASSED,639,WO,White/Causasian,>=38,31302,train,"[0, 1, 1]"
186,QID585,33,"Sparkling, often hilarious romantic jealousy comedy... Attal looks so much like a young Robert DeNiro that it seems the film should instead be called `My Husband Is Travis Bickle'.",positive,no sentiment,3,"romantic,jealousy,comedy...","[3, 4, 5]",38,White/Caucasian,Female,Very well,PASSED,351,WO,White/Causasian,>=38,31357,train,"[0, 0, 0, 1, 1, 1, 0, 0, 0, 0, 0, 0, 0, 0, 0, 0, 0, 0, 0, 0, 0, 0, 0, 0, 0, 0, 0, 0, 0]"
187,QID835,158,"After sitting through this sloppy, made-for-movie comedy special, it makes me wonder if Lawrence hates criticism so much that he refuses to evaluate his own work.",negative,negative,2,"sloppy,,made-for-movie,comedy,Lawrence,hates,criticism","[4, 5, 6, 13, 14, 15]",39,White/Caucasian,Female,Very well,PASSED,523,WO,White/Causasian,>=38,32055,train,"[0, 0, 0, 0, 1, 1, 1, 0, 0, 0, 0, 0, 0, 1, 1, 1, 0, 0, 0, 0, 0, 0, 0, 0, 0, 0]"
188,QID753,117,"A bittersweet contemporary comedy about benevolent deception, which, while it may not rival the filmmaker's period pieces, is still very much worth seeing.",positive,positive,1,"is,still,very,much,worth,seeing.","[17, 18, 19, 20, 21, 22]",48,White/Caucasian,Male,Well,PASSED,468,WO,White/Causasian,>=38,32190,train,"[0, 0, 0, 0, 0, 0, 0, 0, 0, 0, 0, 0, 0, 0, 0, 0, 0, 1, 1, 1, 1, 1, 1]"
189,QID829,155,It's a funny little movie with clever dialogue and likeable characters.,positive,positive,1,"funny,clever,dialogue,likeable,characters.","[2, 6, 7, 9, 10]",39,White/Caucasian,Female,Very well,PASSED,518,WO,White/Causasian,>=38,32851,train,"[0, 0, 1, 0, 0, 0, 1, 1, 0, 1, 1]"
190,QID703,92,"For those for whom the name Woody Allen was once a guarantee of something fresh, sometimes funny, and usually genuinely worthwhile, Hollywood Ending is a depressing experience.",negative,negative,2,"was,once,depressing,experience.","[8, 9, 25, 26]",46,White/Caucasian,Female,Very well,PASSED,438,WO,White/Causasian,>=38,33235,train,"[0, 0, 0, 0, 0, 0, 0, 0, 1, 1, 0, 0, 0, 0, 0, 0, 0, 0, 0, 0, 0, 0, 0, 0, 0, 1, 1]"
191,QID687,84,"A stupid, derivative horror film that substitutes extreme gore for suspense.",negative,negative,2,"A,stupid,,derivative,horror","[0, 1, 2, 3]",47,White/Caucasian,Male,Well,PASSED,424,WO,White/Causasian,>=38,33358,train,"[1, 1, 1, 1, 0, 0, 0, 0, 0, 0, 0]"
192,QID645,63,"Even a hardened voyeur would require the patience of Job to get through this interminable, shapeless documentary about the swinging subculture.",negative,negative,2,"require,patience,get,through,interminable,,shapeless,documentary,swinging,subculture.","[5, 7, 11, 12, 14, 15, 16, 19, 20]",41,White/Caucasian,Female,Very well,PASSED,396,WO,White/Causasian,>=38,33681,train,"[0, 0, 0, 0, 0, 1, 0, 1, 0, 0, 0, 1, 1, 0, 1, 1, 1, 0, 0, 1, 1]"
193,QID625,53,... a bland murder-on-campus yawner.,negative,no sentiment,3,"a,bland,murder-on-campus,yawner.","[1, 2, 3, 4]",50,White/Caucasian,Female,Very well,PASSED,380,WO,White/Causasian,>=38,33824,train,"[0, 1, 1, 1, 1]"
194,QID677,79,"Apparently, romantic comedy with a fresh point of view just doesn't figure in the present Hollywood program.",negative,no sentiment,3,"Apparently,",[0],57,White/Caucasian,Male,Very well,PASSED,416,WO,White/Causasian,>=38,34817,train,"[1, 0, 0, 0, 0, 0, 0, 0, 0, 0, 0, 0, 0, 0, 0, 0, 0]"
195,QID785,133,"A loud, ugly, irritating movie without any of its satirical salvos hitting a discernible target.",negative,negative,2,"loud,,ugly,,irritating,without","[1, 2, 3, 5]",38,White/Sephardic Jew,Male,Very well,PASSED,490,WO,White/Causasian,>=38,35344,train,"[0, 1, 1, 1, 0, 1, 0, 0, 0, 0, 0, 0, 0, 0, 0]"
196,QID593,37,"A strong script, powerful direction and splendid production design allows us to be transported into the life of Wladyslaw Szpilman, who is not only a pianist, but a good human being.",positive,positive,1,"strong,script,,splendid,production,design","[1, 2, 6, 7, 8]",38,White/Caucasian,Female,Very well,PASSED,355,WO,White/Causasian,>=38,35518,train,"[0, 1, 1, 0, 0, 0, 1, 1, 1, 0, 0, 0, 0, 0, 0, 0, 0, 0, 0, 0, 0, 0, 0, 0, 0, 0, 0, 0, 0, 0, 0]"
197,QID877,179,"This method almost never fails him, and it works superbly here.",positive,positive,1,"never,fails,works,superbly,here.","[3, 4, 8, 9, 10]",46,White/Caucasian,Female,Very well,PASSED,555,WO,White/Causasian,>=38,36594,train,"[0, 0, 0, 1, 1, 0, 0, 0, 1, 1, 1]"
198,QID527,4,The film rehashes several old themes and is capped with pointless extremes -- it's insanely violent and very graphic.,negative,negative,2,"capped,with,pointless,extremes,insanely,violent,very,graphic.","[8, 9, 10, 11, 14, 15, 17, 18]",45,White/Caucasian,Female,Very well,PASSED,306,WO,White/Causasian,>=38,36879,train,"[0, 0, 0, 0, 0, 0, 0, 0, 1, 1, 1, 1, 0, 0, 1, 1, 0, 1, 1]"
199,QID639,60,"... a solid, well-formed satire.",positive,positive,1,satire.,[4],41,White/Caucasian,Female,Very well,PASSED,389,WO,White/Causasian,>=38,37151,train,"[0, 0, 0, 0, 1]"
200,QID647,64,A lame romantic comedy about an unsympathetic character and someone who would not likely be so stupid as to get involved with her.,negative,negative,2,"lame,unsympathetic,character,stupid","[1, 6, 7, 16]",41,White/Caucasian,Female,Very well,PASSED,398,WO,White/Causasian,>=38,37656,train,"[0, 1, 0, 0, 0, 0, 1, 1, 0, 0, 0, 0, 0, 0, 0, 0, 1, 0, 0, 0, 0, 0, 0]"
201,QID701,91,under-rehearsed and lifeless,negative,negative,2,"under-rehearsed,lifeless","[0, 2]",46,White/Caucasian,Female,Very well,PASSED,435,WO,White/Causasian,>=38,37928,train,"[1, 0, 1]"
202,QID1037,259,Its engaging simplicity is driven by appealing leads.,positive,positive,1,"engaging,appealing,leads.","[1, 6, 7]",42,White/Caucasian,Female,Well,PASSED,693,WO,White/Causasian,>=38,38200,train,"[0, 1, 0, 0, 0, 0, 1, 1]"
203,QID989,235,"This odd, poetic road movie, spiked by jolts of pop music, pretty much takes place in Morton's ever-watchful gaze -- and it's a tribute to the actress, and to her inventive director, that the journey is such a mesmerizing one.",positive,positive,1,"tribute,inventive,director,,mesmerizing","[23, 30, 31, 38]",41,White/Caucasian,Female,Very well,PASSED,661,WO,White/Causasian,>=38,38498,train,"[0, 0, 0, 0, 0, 0, 0, 0, 0, 0, 0, 0, 0, 0, 0, 0, 0, 0, 0, 0, 0, 0, 0, 1, 0, 0, 0, 0, 0, 0, 1, 1, 0, 0, 0, 0, 0, 0, 1, 0]"
204,QID681,81,"No French people were harmed during the making of this movie, but they were insulted and the audience was put through torture for an hour and a half.",negative,negative,2,"they,were,insulted,and,the,audience,was,put,through,torture,for,an,hour,and,a,half.","[12, 13, 14, 15, 16, 17, 18, 19, 20, 21, 22, 23, 24, 25, 26, 27]",47,White/Caucasian,Male,Well,PASSED,419,WO,White/Causasian,>=38,39289,train,"[0, 0, 0, 0, 0, 0, 0, 0, 0, 0, 0, 0, 1, 1, 1, 1, 1, 1, 1, 1, 1, 1, 1, 1, 1, 1, 1, 1]"
205,QID935,208,One of the most exciting action films to come out of China in recent years.,positive,positive,1,"One,of,the,most,exciting,action,films","[0, 1, 2, 3, 4, 5, 6]",40,White/Caucasian,Female,Very well,PASSED,613,WO,White/Causasian,>=38,39361,train,"[1, 1, 1, 1, 1, 1, 1, 0, 0, 0, 0, 0, 0, 0, 0]"
206,QID683,82,"I was feeling this movie until it veered off too far into the Exxon zone, and left me behind at the station looking for a return ticket to realism.",negative,positive,1,"left,me,behind,at,the,station,looking,for,a,return,ticket,to,realism.","[16, 17, 18, 19, 20, 21, 22, 23, 24, 25, 26, 27, 28]",47,White/Caucasian,Male,Well,PASSED,420,WO,White/Causasian,>=38,39520,train,"[0, 0, 0, 0, 0, 0, 0, 0, 0, 0, 0, 0, 0, 0, 0, 0, 1, 1, 1, 1, 1, 1, 1, 1, 1, 1, 1, 1, 1]"
207,QID615,48,"It has fun with the quirks of family life, but it also treats the subject with fondness and respect.",positive,no sentiment,3,"It,has,it,treats","[0, 1, 10, 12]",52,White/Caucasian,Female,Well,PASSED,373,WO,White/Causasian,>=38,39650,train,"[1, 1, 0, 0, 0, 0, 0, 0, 0, 0, 1, 0, 1, 0, 0, 0, 0, 0, 0]"
208,QID917,199,"If you're over 25, have an IQ over 90, and have a driver's license, you should be able to find better entertainment.",negative,negative,2,"If,you're,over,25,,have,an,IQ,over,90,,have,a,driver's,license,,you,should,be,able,to,find,better,entertainment.","[0, 1, 2, 3, 4, 5, 6, 7, 8, 10, 11, 12, 13, 14, 15, 16, 17, 18, 19, 20, 21]",41,White/Caucasian,Female,Very well,PASSED,596,WO,White/Causasian,>=38,39688,train,"[1, 1, 1, 1, 1, 1, 1, 1, 1, 0, 1, 1, 1, 1, 1, 1, 1, 1, 1, 1, 1, 1]"
209,QID747,114,"Even by the intentionally low standards of frat-boy humor, Sorority Boys is a bowser.",negative,no sentiment,3,"Sorority,Boys,is,a,bowser.","[9, 10, 11, 12, 13]",48,White/Caucasian,Male,Well,PASSED,464,WO,White/Causasian,>=38,39806,train,"[0, 0, 0, 0, 0, 0, 0, 0, 0, 1, 1, 1, 1, 1]"
210,QID893,187,"If you enjoy being rewarded by a script that assumes you aren't very bright, then Blood Work is for you.",negative,negative,2,"you,aren't,very,bright,","[10, 11, 12, 13]",67,White/Caucasian,Male,Very well,PASSED,570,WO,White/Causasian,>=38,39855,train,"[0, 0, 0, 0, 0, 0, 0, 0, 0, 0, 1, 1, 1, 1, 0, 0, 0, 0, 0, 0]"
211,QID559,20,"This hastily mounted production exists only to capitalize on Hopkins' inclination to play Hannibal Lecter again, even though Harris has no immediate inclination to provide a fourth book.",negative,negative,2,"hastily,capitalize","[1, 7]",66,White/Caucasian,Female,Very well,PASSED,336,WO,White/Causasian,>=38,39868,train,"[0, 1, 0, 0, 0, 0, 0, 1, 0, 0, 0, 0, 0, 0, 0, 0, 0, 0, 0, 0, 0, 0, 0, 0, 0, 0, 0, 0]"
212,QID753,117,"A bittersweet contemporary comedy about benevolent deception, which, while it may not rival the filmmaker's period pieces, is still very much worth seeing.",positive,positive,1,"is,still,very,much,worth,seeing.","[17, 18, 19, 20, 21, 22]",48,White/Caucasian,Male,Well,PASSED,468,WO,White/Causasian,>=38,40080,train,"[0, 0, 0, 0, 0, 0, 0, 0, 0, 0, 0, 0, 0, 0, 0, 0, 0, 1, 1, 1, 1, 1, 1]"
213,QID735,108,The cast is top-notch and I predict there will be plenty of female audience members drooling over Michael Idemoto as Michael.,positive,positive,1,"top-notch,drooling","[3, 15]",44,White/Caucasian,Male,Very well,PASSED,458,WO,White/Causasian,>=38,40217,train,"[0, 0, 0, 1, 0, 0, 0, 0, 0, 0, 0, 0, 0, 0, 0, 1, 0, 0, 0, 0, 0]"
214,QID743,112,It's anchored by splendid performances from an honored screen veteran and a sparkling newcomer who instantly transform themselves into a believable mother/daughter pair.,positive,positive,1,"It's,anchored,by,splendid,performances","[0, 1, 2, 3, 4]",48,White/Caucasian,Male,Well,PASSED,462,WO,White/Causasian,>=38,40598,train,"[1, 1, 1, 1, 1, 0, 0, 0, 0, 0, 0, 0, 0, 0, 0, 0, 0, 0, 0, 0, 0, 0, 0]"
215,QID735,108,The cast is top-notch and I predict there will be plenty of female audience members drooling over Michael Idemoto as Michael.,positive,positive,1,"top-notch,drooling","[3, 15]",44,White/Caucasian,Male,Very well,PASSED,458,WO,White/Causasian,>=38,41313,train,"[0, 0, 0, 1, 0, 0, 0, 0, 0, 0, 0, 0, 0, 0, 0, 1, 0, 0, 0, 0, 0]"
216,QID649,65,"Rob Schneider's infantile cross-dressing routines fill The Hot Chick, the latest gimmick from this unimaginative comedian.",negative,negative,2,"infantile,gimmick,unimaginative","[2, 11, 14]",41,White/Caucasian,Female,Very well,PASSED,399,WO,White/Causasian,>=38,41583,train,"[0, 0, 1, 0, 0, 0, 0, 0, 0, 0, 0, 1, 0, 0, 1, 0]"
217,QID867,174,Bad and baffling from the get-go.,negative,negative,2,"Bad,and,baffling","[0, 1, 2]",46,White/Caucasian,Female,Very well,PASSED,548,WO,White/Causasian,>=38,41627,train,"[1, 1, 1, 0, 0, 0]"
218,QID849,165,"After seeing the film, I can tell you that there's no other reason why anyone should bother remembering it.",negative,negative,2,"no,reason,why,anyone,should,bother,remembering,it.","[10, 12, 13, 14, 15, 16, 17, 18]",41,White/Caucasian,Female,Very well,PASSED,534,WO,White/Causasian,>=38,41831,train,"[0, 0, 0, 0, 0, 0, 0, 0, 0, 0, 1, 0, 1, 1, 1, 1, 1, 1, 1]"
219,QID709,95,"Cox offers plenty of glimpses at existing photos, but there are no movies of Nijinsky, so instead the director treats us to an aimless hodgepodge.",negative,negative,2,"treats,us,an,aimless,hodgepodge.","[19, 20, 22, 23, 24]",46,White/Caucasian,Female,Very well,PASSED,442,WO,White/Causasian,>=38,41940,train,"[0, 0, 0, 0, 0, 0, 0, 0, 0, 0, 0, 0, 0, 0, 0, 0, 0, 0, 0, 1, 1, 0, 1, 1, 1]"
220,QID967,224,Distinctly sub-par... more likely to drown a viewer in boredom than to send any shivers down his spine.,negative,negative,2,"sub-par...,boredom,shivers,spine.","[1, 9, 14, 17]",43,White/Caucasian,Male,Very well,PASSED,643,WO,White/Causasian,>=38,42335,train,"[0, 1, 0, 0, 0, 0, 0, 0, 0, 1, 0, 0, 0, 0, 1, 0, 0, 1]"
221,QID895,188,"Like Rudy Yellow Lodge, Eyre needs to take a good sweat to clarify his cinematic vision before his next creation and remember the lessons of the trickster spider.",negative,no sentiment,3,"clarify,his,cinematic,vision","[12, 13, 14, 15]",67,White/Caucasian,Male,Very well,PASSED,571,WO,White/Causasian,>=38,42555,train,"[0, 0, 0, 0, 0, 0, 0, 0, 0, 0, 0, 0, 1, 1, 1, 1, 0, 0, 0, 0, 0, 0, 0, 0, 0, 0, 0, 0]"
222,QID521,1,"Bread, My Sweet has so many flaws it would be easy for critics to shred it.",negative,negative,2,"so,many,flaws,easy,for,critics,to,shred,it.","[4, 5, 6, 10, 11, 12, 13, 14, 15]",45,White/Caucasian,Female,Very well,PASSED,302,WO,White/Causasian,>=38,42813,train,"[0, 0, 0, 0, 1, 1, 1, 0, 0, 0, 1, 1, 1, 1, 1, 1]"
223,QID607,44,"It is supremely unfunny and unentertaining to watch middle-age and older men drink to excess, piss on trees, b.s. one another and put on a show in drag.",negative,negative,2,"supremely,unfunny,and,unentertaining","[2, 3, 4, 5]",52,White/Caucasian,Female,Well,PASSED,368,WO,White/Causasian,>=38,43065,train,"[0, 0, 1, 1, 1, 1, 0, 0, 0, 0, 0, 0, 0, 0, 0, 0, 0, 0, 0, 0, 0, 0, 0, 0, 0, 0, 0, 0]"
224,QID873,177,"Although the sequel has all the outward elements of the original, the first film's lovely flakiness is gone, replaced by the forced funniness found in the dullest kiddie flicks.",negative,negative,2,"lovely,flakiness,is,gone,,forced,funniness,dullest,kiddie,flicks.","[14, 15, 16, 17, 21, 22, 26, 27, 28]",46,White/Caucasian,Female,Very well,PASSED,552,WO,White/Causasian,>=38,43077,train,"[0, 0, 0, 0, 0, 0, 0, 0, 0, 0, 0, 0, 0, 0, 1, 1, 1, 1, 0, 0, 0, 1, 1, 0, 0, 0, 1, 1, 1]"
225,QID717,99,"Loud, chaotic and largely unfunny.",negative,negative,2,"Loud,,chaotic,largely,unfunny.","[0, 1, 3, 4]",46,White/Caucasian,Female,Very well,PASSED,448,WO,White/Causasian,>=38,43084,train,"[1, 1, 0, 1, 1]"
226,QID615,48,"It has fun with the quirks of family life, but it also treats the subject with fondness and respect.",positive,no sentiment,3,"It,has,it,treats","[0, 1, 10, 12]",52,White/Caucasian,Female,Well,PASSED,373,WO,White/Causasian,>=38,43306,train,"[1, 1, 0, 0, 0, 0, 0, 0, 0, 0, 1, 0, 1, 0, 0, 0, 0, 0, 0]"
227,QID545,13,Another Best of the Year selection.,positive,positive,1,"Best,of,the,Year","[1, 2, 3, 4]",58,White/Caucasian,Female,Well,PASSED,323,WO,White/Causasian,>=38,43407,train,"[0, 1, 1, 1, 1, 0]"
228,QID525,3,Exudes the fizz of a Busby Berkeley musical and the visceral excitement of a sports extravaganza.,positive,positive,1,"fizz,visceral,excitement","[2, 10, 11]",45,White/Caucasian,Female,Very well,PASSED,305,WO,White/Causasian,>=38,43724,train,"[0, 0, 1, 0, 0, 0, 0, 0, 0, 0, 1, 1, 0, 0, 0, 0]"
